,Timestamp,SubmissionID,Comment
0,2020-02-05 15:33:12,ezb8p5,"**Thank you for your submission. Make sure to follow the rules.**

**Check out our [FAP LOTTERY!](https://jerkofftocelebs.com/)**

**Don't forget to follow us on [Instagram](https://www.instagram.com/jotocelebs/) and [join our Discord Server](https://discord.gg/PrRFWsa)!**


*I am a bot, and this action was performed automatically. Please [contact the moderators of this subreddit](/message/compose/?to=/r/JerkOffToCelebs) if you have any questions or concerns.*"
1,2020-02-05 15:33:40,ezb8p5,[removed]
2,2020-02-05 15:37:04,ezb8p5,So much hotter now
3,2020-02-05 15:33:41,ezb8p5,"Your comment has been removed due to your account not meeting the required (> 7 day old) limit necessary to post here

*I am a bot, and this action was performed automatically. Please [contact the moderators of this subreddit](/message/compose/?to=/r/JerkOffToCelebs) if you have any questions or concerns.*"
4,2020-02-05 15:25:53,ezazqm,Fuck yes. Still jerk off to Party in the USA vid.
5,2020-02-05 15:09:47,ezavvi,Me
6,2020-02-06 00:16:46,ez5jy0,"You could have done stevonie on the jungle moon for every night has its dawn and cowboy ruby for every cowboy sings a sad, sad, song."
7,2020-02-06 00:21:49,ez5jy0,"I could have yes but I didn’t because I wanted to open with that scene, and cowboy ruby wouldn’t have fit into the story of the video bc it’s mainly about how pink diamond/rose hurt so many people especially pearl and steven"
8,2020-02-08 01:01:27,ez5jy0,I didn't think of that.
9,2020-02-05 06:34:02,ez56v2,Hey that sounds so cool!
10,2020-02-05 06:33:33,ez56v2,"**Scott Bradlee & Postmodern Jukebox**  
 [artist pic](https://lastfm.freetls.fastly.net/i/u/252/2a96cbd8b46e442fc41c2b86b821562f.png)  

> Related projects: Scott Bradlee and Saturday Morning Slow Jams

> Scott Bradlee has long had a love/hate relationship with pop music.

> Growing up as an aspiring jazz pianist, Scott was not interested in listening to anything that might appeal to those that he deemed to possess a less than refined palette of musical taste. This willful ignorance continued for some time; it was not until he began making YouTube videos (and subsequently receiving requests for modern pop songs) that Scott decided to drop his preconceived notions and examine contemporary pop with an open mind.

> What he found is that, despite his initial aversion to the stuff Scott was hearing, he was unable to truly categorize this as “bad music” without first defining a set of arbitrary, culturally-defined criteria. Furthermore, the fact that such a rigorous vetting process exists for the output of major labels indicated that these songs and artists certainly RESONATED with the culture of our times–no easy feat, in and of itself. As a relentless devil’s advocate, Scott then found that by simply altering the context of such songs,  he could find quite a bit of artistic merit inside of them.

> His goal with Postmodern Jukebox is to get his audience to think of songs not as rigid, ephemeral objects, but like malleable globs of silly putty. Songs can be twisted, shaped, and altered without losing their identities–just as we grow, age, and expire without losing ours–and it is through this exploration that the gap between “high” and “low” art can be bridged most readily.

> He wants to contribute to the pop music lexicon in the best way that he can.

> He wants to encourage others to push the boundaries of genres, and give them the tools to do so.

> He wants to create an alternate universe of popular song. Read more on Last.fm.

 [last.fm](https://www.last.fm/music/Scott+Bradlee+&+Postmodern+Jukebox): 41,047 listeners, 1,179,113 plays  
 tags: *jazz, cover, vintage, swing, lounge*  

^^Please ^^downvote ^^if ^^incorrect!  ^^Self-deletes ^^if ^^score ^^is ^^0."
11,2020-02-05 06:41:16,ez56v2,"Absolutely love pretty much everything Post Modern Jukebox does, some very talented artists there."
12,2020-02-05 12:41:09,ez56v2,"Yeah, I couldn't get this song out of my head for weeks after I first heard it :)"
13,2020-02-05 12:39:18,ez56v2,Indeed. They're probably my favourite band to come out of the 2010s... so many great songs to pick from.
14,2020-02-04 23:01:12,eyyofm,"Ok, sure, next time I see her."
15,2020-02-05 00:19:15,eyyofm,"No thanks, you tell her"
16,2020-02-05 18:53:34,eyyofm,She’ll get the memo eventually if you just let her relevancy continue to die out like it’s been the last 6 years.
17,2020-02-04 23:03:30,eyyofm,Only not people allowed to be confident?
18,2020-02-04 23:05:35,eyyofm,She ugly but I still eat her bussy
19,2020-02-04 23:22:38,eyyofm,She's not confident.  She's obnoxious and delusional.
20,2020-02-04 14:05:45,eyph6d,it's called miley cyrus feat. hannah montana😤
21,2020-02-04 13:16:30,eyph6d,I’m not sure but it’s probably from self tilted 💭
22,2020-02-04 13:12:35,eyph6d,broke boi
23,2020-02-04 17:58:58,eyph6d,I think that’s that new carti x chief snippet. Msg my number for cdq 07396287775
24,2020-02-04 18:10:39,eyph6d,That's molly bro... c'mon
25,2020-02-04 13:16:47,eyph6d,Bad troll
26,2020-02-04 17:54:28,eyph6d,"Not sure, I think it's from his earlier Soundcloud music"
27,2020-02-05 05:00:00,eyph6d,"Its called mileage, issa play boy carter musik"
28,2020-02-05 07:50:29,eyph6d,Beef (ft. Gunna Jeans)
29,2020-02-04 12:44:47,eyph6d,Mileage ft chief keef
30,2020-02-04 12:57:35,eyph6d,why didn’t u google the lyrics? LMAO
31,2020-02-04 14:45:44,eyph6d,Thank you bro talk about Whole Lotta Waiting whole lotta waiting for tha answer bro thanks dude slatt as they might say
32,2020-02-04 14:46:12,eyph6d,He has another album? I only see Play Boi Carter and die lit
33,2020-02-04 22:15:33,eyph6d,Thats a swedish number😳🤝
34,2020-02-04 22:31:08,eyph6d,No its actually Kid Cudi featuring asap rocker  young nudey and lil uzi vert
35,2020-02-04 12:58:24,eyph6d,"Now see I thought it was that at first, but this song sounds nothing like the lyrics"
36,2020-02-04 18:42:31,eyph6d,r/whoosh
37,2020-02-04 12:58:05,eyph6d,Too much work
38,2020-02-04 22:34:56,eyph6d,"Damn...  You're right. Lil uzi isn't on there though, I thought it was J Cole?"
39,2020-02-04 13:29:48,eyph6d,[deleted]
40,2020-02-04 23:11:50,eyph6d,No its definitely travis scott bro
41,2020-02-04 16:34:38,eyph6d,He’s trolling
42,2020-02-04 14:45:06,eyph6d,It’s my homepage now so not too far
43,2020-02-04 23:18:13,eyph6d,... it's Frank ocean breh
44,2020-02-04 23:21:13,eyph6d,"Damn, my bad 😳"
45,2020-02-04 07:52:34,eymn7m,Are you looking for r/rant ?
46,2020-02-04 08:13:54,eymn7m,"I second the modern ""country"" singer statement."
47,2020-02-04 08:11:17,eymn7m,"Alright, pilgrim."
48,2020-02-04 11:44:32,eymn7m,Do you believe Tom Cruise can fly a fighter jet.....
49,2020-02-04 11:47:31,eymn7m,"Considering Wayne applied for both the Naval Academy as a teenager and the oss during ww2, I don’t think he had any issue serving his country. He also tried to enlist during ww2"
50,2020-02-04 07:49:45,eymn7m,"Well yeah, he was an actor ffs"
51,2020-02-04 09:11:02,eymn7m,He’s just an actor calm down lmao
52,2020-02-04 16:42:45,eymn7m,"And Robert Downey Jr doesn't really fly around in an iron suit, the lying piece of shit."
53,2020-02-04 08:11:52,eymn7m,He was also gay. Just sayin
54,2020-02-04 08:37:35,eymn7m,"lol I doubt that anyone still thinks that the cringe cowboy shit is not embarrassingly stupid in hindsight, but thanks for speaking it out loudly. :-)"
55,2020-02-04 07:54:41,eymn7m,Do people actually know who any of those people are? The only name I recognised here was Miley Cyrus.
56,2020-02-04 11:45:17,eymn7m,Yes.
57,2020-02-04 11:50:20,eymn7m,"And yet while men like my grandfather were fighting John Wayne made movies. He could have fought.

It just bugged me he made a bunch of cowboy movies where he killed Native American and Mexicans as if they were always the villains.

I know it's fake but it helped shaped ideas about the west for people who never even got on a horse. 

I bet during Vietnam he licked uncle sam's balls while Muhammed Ali was a man and stood up for the truth."
58,2020-02-04 09:18:08,eymn7m,"He's suppose to be the epitome of American masculinity. Everyone thinks of him when they think of manhood and cowboys. He was a pro war pro government suck up who just played a cowboy.

Roy Rogers is the real thing.

Even Toby Keith who I hate actually owns horses and probably has some skills. 

George Straight who never really spoke about politics but supported Bush is a team roper"
59,2020-02-04 18:05:43,eymn7m,Yes he does. Don't be a mud baby.
60,2020-02-04 11:54:11,eymn7m,Big time gay.
61,2020-02-04 08:27:23,eymn7m,You... You don't know Bush?
62,2020-02-04 11:53:31,eymn7m,Yeah probably not though. It turns out the political leadership of this country wasn’t big on sending an a list actor out to get shot. Not to mention his studio was going to sue the shit out of him
63,2020-02-04 12:12:35,eymn7m,"No it didn’t though. Those events were still recent in the mind and generally seen as great by the us population. Wayne was just the best at conveying the American attitude.

How dare Wayne support a war that a huge number of Americans also supported"
64,2020-02-04 10:14:16,eymn7m,No idea. I’m guessing that isn’t the persons first name either so that makes it even harder to guess.
65,2020-02-04 15:26:35,eymn7m,What country do you live in?
66,2020-02-04 10:49:27,eymdru,Seems like the DM needs to just find the right monsters and you just tank the lead. Not anyone but his for green lighting and not throwing in a bandit troll slave or something tougher
67,2020-02-04 11:43:23,eymdru,"You did the right thing offering to rebalance your character. It’s important to recognise that the DM and the player are equally responsible for the characters integration into the game. 
I would suggest you try to reach out to your DM again and talk about what happened and speak frankly about what you can BOTH do to remedy then situation. 

And remind your DM that campaigns don’t have to work perfectly right away.. just as long as you keep playing and have fun, it’s working!"
68,2020-02-04 12:14:08,eymdru,This sounds like something I would do.
69,2020-02-05 18:15:08,eymdru,I was drinking water while reading this.....this was a mistake because I choked on it while reading “I CAME IN LIKE A WRECKING BALL”
70,2020-02-04 01:22:31,eyhu97,"It looks like OP posted an AMP link. These will often load faster, but Google's AMP [threatens the Open Web](https://www.socpub.com/articles/chris-graham-why-google-amp-threat-open-web-15847) and [your privacy](https://www.reddit.com/r/AmputatorBot/comments/ehrq3z/why_did_i_build_amputatorbot).

You might want to visit **the normal page** instead: **[https://www.hollywoodreporter.com/news/miley-cyrus-exits-caa-wme-1276140](https://www.hollywoodreporter.com/news/miley-cyrus-exits-caa-wme-1276140)**.

*****

​^(I'm a bot | )[^(Why & About)](https://www.reddit.com/r/AmputatorBot/comments/ehrq3z/why_did_i_build_amputatorbot)^( | )[^(Mention me to summon me!)](https://www.reddit.com/r/AmputatorBot/comments/cchly3/you_can_now_summon_amputatorbot/)"
71,2020-02-04 00:15:08,eygj7x,"Cherry Bomb - The Runaways

Clarity - Kim Petras

Click, Dreamer - Charli XCX

Flamboyant - Dorian Electra

Glamorous - Fergie

I love it - Icona Pop"
72,2020-02-03 23:53:15,eygj7x,The man - The Killers
73,2020-02-03 23:53:23,eygj7x,"Shame by system of a down. 
Its a cover of wu tang clan but by god it goes hard af"
74,2020-02-03 23:56:49,eygj7x,Try listening to Ooh Wee by mark Ronson. Shit never fails
75,2020-02-04 00:20:03,eygj7x,Where Eagles Dare - Misfits
76,2020-02-04 01:30:56,eygj7x,I like shut the fuck up by blink 182.
77,2020-02-04 04:28:31,eygj7x,I feel like this is Betty Davis' *genre*. [Serisouly](https://www.youtube.com/watch?v=b2B0FBdzGis).[Not](https://www.youtube.com/watch?v=bgmc6-L81bE) [Kidding](https://www.youtube.com/watch?v=0eLgZvOtzy0)
78,2020-02-04 20:10:00,eygj7x,Scumprophet - Scumfuck and Hollow Prophet
79,2020-02-04 00:02:53,eygj7x,Oh my god I’ve been listening to this for like a week straight and I’ve turned into such an aggressive driver
80,2020-02-03 18:04:52,eyay1i,that is kinda racist
81,2020-02-03 19:12:16,eyay1i,"Interesting. So how long did it take for you to talk to every single black person in order to determine this? I've spoken with all the white people and we all agree, we don't really care because we feel no jealousy either. 
With that out of the way, all the other silly problems should now resolve quickly."
82,2020-02-03 18:08:55,eyay1i,"So you answer to racism with racism...

ok boomer"
83,2020-02-03 18:29:24,eyay1i,"So you’re basically saying I’d you’re african or African American you can’t look up to anyone that’s not.... hmmm this type of thinking is just as bad as any including 30-40s nazis   And no, they don’t have THE BEST music or stars.  That’s all objective from one person to the next.  There is no best (other than best voice for an actor, I gotta give that to Morgan feeeman)  yeah it’s cool there’s still those indigenous tribes, but let’s be honest about them, look at their Standard of living.  Most don’t even know what bows and arrows are.  Much less anything with an engine or electricity.  I mean I guess if we all sill lives like that there would be things like war, pollution..."
84,2020-02-03 18:06:58,eyay1i,"Ive met so many nerdy ass unathletic unsuccessful black kids it aint even funny. Way to play into a stereotype there kookamunga kracka killa. Why is equality so frowned on by guys like you? Im not saying europeans havent dpne terrible shit, but so have others and europeans have done some good shit and plus either way it doesnt help ANYBODY to keep dividing people right npw when we should be building a more unified future. You look dumber than a box of rocks. Sorry not sorry."
85,2020-02-03 18:06:04,eyay1i,Oh and guess what? I don't care.
86,2020-02-03 19:13:52,eyay1i,I cant talk to ever black person no. But I speak for the spirit if the black community.
87,2020-02-03 18:40:04,eyay1i,Who's a boomer?
88,2020-02-04 14:59:04,eyay1i,All subjective. Objective means fact not opinion (since he probably doesnt know)
89,2020-02-03 18:18:47,eyay1i,You know the funny thing? Black conditions became worse when segregation ended. I am for an African unified future and for us to work together and build our own towns and society's. Oh and btw I wouldnt throw the word success around so easily. Sorry not everyone cares about money.
90,2020-02-03 18:09:52,eyay1i,"you are like the feminists who say all men are rapists, and the fact that you don't care just makes you dumber...or sad."
91,2020-02-03 19:21:36,eyay1i,"With my smartassedness aside I have a serious question for you. I certainly understand having pride in ones self but why do so based on something visual that doesn't mean anything? Why look to separate black and community to create a segregation for ones self. My community doesn't refer to skin color, it's made up of neighbors, people living in close proximity to one another and taking pride in the community they help to build and sustain."
92,2020-02-03 20:03:39,eyay1i,You are a boomer.
93,2020-02-03 18:30:29,eyay1i,I said success not money. And if you would prefer totally racially separated towns ypu dont understand what humanity needs to have a future. We need one cooperative world. Nationalism and racism are the source of the worlds problems and this sort of tripe just brings more of that. Mankinds history has been full of opression by and to all colors from the start. The point is we have the chance to change that now because the future is in our hands. But you must not see a point in that. Youd prefer more of the same I guess.
94,2020-02-03 18:15:51,eyay1i,Feminist is a little harsh.
95,2020-02-03 19:23:07,eyay1i,Look all the china towns. The asian community is working together to make something bigger. What would be wrong with Africans and African Americans doing the same?
96,2020-02-03 18:38:30,eyay1i,Yes white nationalism. And there does not seem to be an end to that anytime soon. Sorry I have a view of a future and its black.
97,2020-02-03 19:54:34,eyay1i,"Nothing at all because anything that builds better communities is a step in the right direction but even with things like a China Town, a Jewish community and the many other ways we look to separate ourselves I think more people need to look to just build stronger communities regardless of our physical appearance. There is nothing about the color of my skin or my ancestry than inherently makes me better or worse can anyone else do I look to simply help others in my community."
98,2020-02-03 19:43:33,eyay1i,"Black nationalism is no better. You are racist and using racist logic because youre power hungry. It really blows my mind that somebody can say ""my race is best because racism is wrong."" I'm done with this thread youre retarded."
99,2020-02-04 14:57:59,eyay1i,Unlike how he said black people are successful at EVERYTHING they do. Obviously in contrast to other people (white people). Because why would he be jealous of whites when blacks are ALWAYS successful (which means he believes they are a superior race.)
100,2020-02-03 19:49:40,eyay1i,"1. I am not balck nationalist

2. Look at the supposed black nationalists in history vs the white nationalist and I dare you to tell me they are the same thing. People compare the Black Panthers to the KKK. All the black panthers were doing was defending the black community and providing services. What was the KKK doing? That's right handing burning down black buisnesses. You can compare good to something that's always been evil."
101,2020-02-04 15:45:56,eyay1i,And he is allowed to believe that he just can't discriminate against others based upon that. I just don't understand why so many people are so happily restricting themselves to a silly thing like skin color.
102,2020-02-04 13:54:12,eyay1i,Reinstating segregated towns in a post industrial society ends in race war inevitably. Youre a moron if you can't see that. Or maybe you are just afraid to come out and say thats what you want. Im not comparing anybody to the Kkk. What im saying is that if you are advocating ANYTHING other than EVERYBODY working together (that means blacks whites asians muslims jehovas witness atheists literally everybody) then the eventual result is conflict. Youre borderline retarded if you think saying black people should all stick with only eachother and the future is black and down with whitey cracker isnt just a new problem waiting to happen instead of a cooperative solution to the ones we face. Youre mad that black people in america live in ghettos alot? (And theres poor whites too) try being a Muslim in china getting ypur body parts harvested in prison camps. Get your shit together dude. The human race will be gone in two hundred years if the whole wprld dpesnt come together and halt global warming and what you are suggesting is that blacks create there own society from scratch instead of everybody workimg together to make this one better. That will hurt ypur people mpre than help. Your preocupied woth ypur own sufferring and for that I am sorry fpr our you and our ancestors. I hope you find some peace dude blessed be.
103,2020-02-04 17:01:24,eyay1i,"Well yeah its not like its something worthy of exile I mean its just cultural preference. Thats been going on since the beginning of time. It isnt right still, but if its confined to an idea then he should still be treated like everybody else for the most part. The only thing is ideas always turn into actions and effect the way you treat people."
104,2020-02-04 15:39:31,eyay1i,I never said reinstate segregation I'm just saying black people should start our own communities
105,2020-02-04 17:07:29,eyay1i,That last sentence does say it all.
106,2020-02-03 16:37:27,ey9qfm,"
Very short discussion posts are usually a sign of poor quality. Please try again with more in-depth text in your self post.

You will need to include text longer than 50 characters to get past the bot.

*I am a bot, and this action was performed automatically. Please [contact the moderators of this subreddit](/message/compose/?to=/r/Music) if you have any questions or concerns.*"
107,2020-02-03 14:40:14,ey82cm,"**Thank you for your submission. Make sure to follow the rules.**

**Check out our [FAP LOTTERY!](https://jerkofftocelebs.com/)**

**Don't forget to follow us on [Instagram](https://www.instagram.com/jotocelebs/) and [join our Discord Server](https://discord.gg/PrRFWsa)!**


*I am a bot, and this action was performed automatically. Please [contact the moderators of this subreddit](/message/compose/?to=/r/JerkOffToCelebs) if you have any questions or concerns.*"
108,2020-02-04 01:13:56,ey82cm,Sticking it in her holes guarantees you an STD
109,2020-02-03 13:32:23,ey7742,"/u/vredditdownloader

*I am a bot, and this action was performed automatically. Please [contact the moderators of this subreddit](/message/compose/?to=/r/perfectlycutscreams) if you have any questions or concerns.*"
110,2020-02-03 13:32:49,ey7742,"*beep. boop.* I'm a bot that provides downloadable links for v.redd.it videos!

* [**Download** via https://ripsave.com](https://ripsave.com/download?t=vuybeuhbope41&f=vuybeuhbope41_240.mp4)

* [Downloadable soundless link](https://v.redd.it/vuybeuhbope41/DASH_240?source=fallback)

* [Audio only](https://v.redd.it/vuybeuhbope41/audio)

First link is active for 6 hours. Mention me again if it is down

 ***  
[**Info**](https://old.reddit.com/user/VredditDownloader/comments/cju1dg/info/)&#32;|&#32;[**Support&#32;me&#32;❤**](https://www.paypal.me/synapsensalat)&#32;|&#32;[**Github**](https://github.com/JohannesPertl/vreddit-downloader)"
111,2020-03-28 12:36:54,fqjemh,"**Thank you for your submission. Make sure to follow the rules.**

**Check out our [FAP LOTTERY](https://jerkofftocelebs.com/) and [PORNHUB PAGE](https://jerkofftoporn.com/p/users/jerkofftocelebs)**

**Don't forget to [join our Discord Server](https://discord.gg/PrRFWsa)!**


*I am a bot, and this action was performed automatically. Please [contact the moderators of this subreddit](/message/compose/?to=/r/JerkOffToCelebs) if you have any questions or concerns.*"
112,2020-03-28 12:41:45,fqjemh,I’ve stroked to Miley every day for a decade
113,2020-03-28 16:35:43,fqj2xk,"Why did you take the time to make such a stupid post?  ""bullshit""?

You're an idiot"
114,2020-03-28 05:22:01,fqdyo0,Okay but anybody ever notice how Steve Carell and Michael Scott have never been seen in the same room
115,2020-03-28 05:20:30,fqdyo0,"Are u sure....? What about the fathe.... HOLY SHIT  YOURE RIGHT. I have been enlightened, it all lines up, IT ALL LINES UP"
116,2020-03-28 05:17:39,fqdyo0,"Wait...


OPs gotta point"
117,2020-03-28 09:14:35,fqdyo0,"*The Illuminati, The FBI, CIA, MI5, The Pope, Men in Black and Vladimir Putin want to know your location*"
118,2020-03-28 08:59:20,fqdyo0,I have a similar theory about Dwayne Johnson and the Rock
119,2020-03-28 06:08:38,fqdyo0,Blasphemy!
120,2020-03-28 06:54:32,fqdyo0,but their hair is different
121,2020-03-28 08:36:14,fqdyo0,no way
122,2020-03-28 11:57:24,fqdyo0,"I got one for you:

what if agent j and will smith are the same person?

they are never seen in the same room"
123,2020-03-28 07:23:49,fqdyo0,I thought you said haha Montana lol
124,2020-03-28 10:36:04,fqdyo0,My whole childhood is a lie
125,2020-03-28 07:00:11,fqdyo0,Impossible
126,2020-03-28 14:55:05,fqdyo0,We’ve never seen the Queen and God in the same room either...
127,2020-03-28 15:40:19,fqdyo0,Hmm... Something’s not quite right here
128,2020-03-28 16:26:37,fqdyo0,This can’t be true
129,2020-03-28 16:33:43,fqdyo0,"Nah, Hannah Montana is blonde"
130,2020-03-28 17:00:13,fqdyo0,Have you ever noticed how Will Smith and the Fresh prince of bel air look so similar?
131,2020-03-28 19:01:55,fqdyo0,Oh boy that’s funny
132,2020-03-28 20:55:16,fqdyo0,Theres this Joji guy though.. he looks just like retired YouTube star Filthy Frank
133,2020-03-28 21:27:38,fqdyo0,Thai is crazy but Clark Kent and Superman? Like I’ve never seen them together.
134,2020-03-28 10:39:55,fqdyo0,"~~he knows to much I must get rid of him~~

hello!! I would like to DM you!!,the federal-I mean hollywood wants to contact you!!!

~~yes I have his location sir~~"
135,2020-03-28 11:11:24,fqdyo0,I mean neither has Optimus Prime and Michael Jackson sooooo
136,2020-03-28 22:49:51,fqdyo0,Or him and Brick Tamland
137,2020-03-28 11:39:17,fqdyo0,What if shaggy and matthew Willard are the same person
138,2020-03-28 12:06:10,fqdyo0,Don't forget about MI6 and GCHQ
139,2020-03-28 19:16:48,fqdyo0,It's called changing their hair style
140,2020-03-28 22:24:35,fqdyo0,Get ready to face the wrath of Gru
141,2020-03-29 14:26:37,fqdyo0,I read this as I would like to dungeon master you....
142,2020-03-28 12:56:45,fqdyo0,No no he’s got a point
143,2020-03-28 11:54:50,fqdyo0,See previous comment
144,2020-03-27 21:42:07,fq51xf,"He was the biggest superstar and a heartthrob of Europe and Asia, she was a member of the hottest international number one all girls act, probably of all time. They both loved limelight and media, and media loved them back."
145,2020-03-28 00:06:22,fq51xf,[deleted]
146,2020-03-28 12:14:47,fq51xf,I think that was about the time rumours of Beckham cheating on his wife came out.. after which he got his wife's name tattooed on his hand in the devnagari script. We being Indians obviously ate up the story about a famous cheating star and a Hindi tattoo on a white person. 🤷‍♂️
