,Timestamp,SubmissionID,Comment
1530,2020-10-02 15:59:02,j3mi6b,r/emojipolice is having a seizure right now
1531,2020-10-02 16:39:35,j3mi6b,Those Emojis are giving me a headache. I gave up after the first paragraph.
1532,2020-10-02 16:40:41,j3mi6b,r/okbuddyretard
1533,2020-10-02 16:48:56,j3mi6b,This post gave me cancer.
1534,2020-10-02 16:52:31,j3mi6b,That gave me a headache trying to read it with the emojis there
1535,2020-10-02 17:15:04,j3mi6b,The emojis make this unreadable lmao
1536,2020-10-02 17:50:40,j3mi6b,"Y'know, maybe there is a good reason donkeys shouldn't talk"
1537,2020-10-02 18:16:44,j3mi6b,I had a fucking stroke trying to read this.
1538,2020-10-02 18:29:20,j3mi6b,This is top post of all time material.
1539,2020-10-02 18:40:54,j3mi6b,"I like Ye and I like his music (I didn’t like JIK tho lol)

I really feel bad for him. It’s obvious he’s off his meds and he has been diagnosed with BPD. I hope he starts taking his meds and gets better."
1540,2020-10-02 18:43:31,j3mi6b,God damn a karma whore
1541,2020-10-02 18:48:57,j3mi6b,Cant argue with the truth
1542,2020-10-02 19:19:48,j3mi6b,This is clearly a shit post. Should we really upvote to disagree? I don't think it warrants the karma.
1543,2020-10-02 19:21:23,j3mi6b,More emojis than a scam MLM scheme or fake GTA modMenu lmfao. I lovehate it.
1544,2020-10-02 19:24:54,j3mi6b,His first 3 albums were really really good. They work on multiple levels and have been entertaining me for 15 - 20 years. The only other album I can think of that has done that is the Chronic 2000. The albums after that are dogshit and Kanye as a person needs a lot of work. His mental illness does not excuse his behaviour.
1545,2020-10-02 19:25:27,j3mi6b,It’s fascinating how our culture has regressed
1546,2020-10-02 19:39:55,j3mi6b,This gave me cancer.
1547,2020-10-02 19:44:58,j3mi6b,r/hiphopcirclejerk actually believes this
1548,2020-10-02 20:24:21,j3mi6b,i am going to call the ducking internet police.
1549,2020-10-02 20:25:22,j3mi6b,Either you’re being sarcastic or this isn’t an unpopular opinion
1550,2020-10-02 20:32:05,j3mi6b,This gotta be satire
1551,2020-10-02 20:37:56,j3mi6b,i love kanye west and i honestly believe that he’s one of the greatest artists of all time
1552,2020-10-02 20:50:16,j3mi6b,Wait which subreddit am i on
1553,2020-10-02 21:09:12,j3mi6b,u/emojifier
1554,2020-10-02 21:10:36,j3mi6b,This didnt have the emojis yesterday what happened
1555,2020-10-02 21:15:59,j3mi6b,_Why so many emojis_
1556,2020-10-02 23:54:43,j3mi6b,Kanye is great
1557,2020-10-02 06:09:20,j3mi6b,"You gotta be the the only dentist for this opinion bruh. His music is good, but we all know he ain't nearly the best. Take my painful upvote"
1558,2020-10-02 06:09:50,j3mi6b,is this satire
1559,2020-10-02 04:45:40,j3mi6b,Which song did he sing through a wire
1560,2020-10-02 06:43:00,j3mi6b,Didn’t even read past the first sentence. I really like Kanye and he gets a bad rap but man he’s been putting out trash for years
1561,2020-10-02 07:01:48,j3mi6b,"Man I love kanye, but please.. have some actual arguments seesh. 

Also skipping Jesus is king lmao"
1562,2020-10-02 07:15:16,j3mi6b,"Paragraphs, Yeezy, paragraphs."
1563,2020-10-02 07:23:25,j3mi6b,Kanye chills with his proud boy friends with his maga hat on. Shame he is a rat
1564,2020-10-02 12:07:24,j3mi6b,ok now this is a real cringy pasta
1565,2020-10-02 05:42:08,j3mi6b,"didnt read, dont care, eminem still better"
1566,2020-10-02 06:04:53,j3mi6b,Downvoted because I agree. He is one of the most misunderstood people of our time and is vilified for being polarizing. That being said I didn't read your wall of text and I'm just addressing the title. It looks like you just argue for the musical greatness of his albums tho
1567,2020-10-02 06:39:17,j3mi6b,You really do need help.
1568,2020-10-02 06:49:03,j3mi6b,"Put some fucking space, skip lines, I'm not reading this brick, upvoted cause obviously you're a nut job though haha"
1569,2020-10-02 06:15:47,j3mi6b,"Old ye best ye. 

Seriously though, Graduation and MDTF are both good albums"
1570,2020-10-02 10:23:52,j3mi6b,"This could be a great copypasta.

You really trying to tell me ""all of y'all mario, it's all a game"" is smart? Regardless of whether his middle name is an anagram or not, it doesn't even come close. It's just dumb.

I preferred the Life of Pablo album by Dan Bull."
1571,2020-10-02 11:16:41,j3mi6b,"I don't care at all about his music, but no one who supports Trump can be a genius."
1572,2020-10-02 19:36:06,j3mi6b,"@.Mods why is this shit allowed? The point of this sub is to express/have a discussion about actual opinions, not this give a place for every useless 2 bit wanker to post an aggravated assault on the eyes?

JFC remove this bullshit already."
1573,2020-10-06 07:16:29,j3mi6b,"do you see the kanye youtube video he playing the piano? he only press one key and the people star screaming and hype him like he is fucking Beethoven but he does n´t , he just put a sample in different keys whit the same tempo, press the different keys and wow its a genius he knows how to create music, camon guys more music culture in your heads makes you better critics"
1574,2020-10-02 16:08:57,j3mi6b,Gay Fish forever ❤️
1575,2020-10-02 04:22:26,j3mi6b,"In your confusion I think you said that Kanye west made good music, which is absurde. Because no sane human being would write that without puking."
1576,2020-10-02 06:18:10,j3mi6b,"I, a black woman, agree that Kanye is a musical Genius"
1577,2020-10-02 13:00:40,j3mi6b,This is an emoji pasta now.
1578,2020-10-02 09:19:06,j3mi6b,Everyone is entitled to their opinion no matter how wrong it is.
1579,2020-10-02 08:11:19,j3mi6b,Good catch
1580,2020-10-02 08:29:52,j3mi6b,"Idk how much of a 10th dentist this is.  This opinion is so common, I mean I basically have it.  I do like how OP didn’t include JIK tho cuz it clearly doesn’t live up to the rest of his discog.  Also OP, you totally reached on the “Mario” line meaning.  It’s just Mario—> game.  I admit Kanye is a musical genius who can pull together great ideas from many to create magic, but his lyrics themselves generally don’t go that deep, especially as time has gone on.  If they do, it’s usually a simple line with a deep meaning.  It’s also really important to remember many of his great verses are basically Rhymefest or Cyhi the Prince or someone else writing.  His music is great, but it’s the great ideas of several."
1581,2020-10-02 06:28:20,j3mi6b,Yeah there is no way OP typed all that.
1582,2020-10-02 07:10:52,j3mi6b,"Well, no matter. Now it is one."
1583,2020-10-02 08:12:03,j3mi6b,I thought I was reading it on copypasta
1584,2020-10-02 07:15:30,j3mi6b,I just looked it up - nope.  It's genuine.
1585,2020-10-02 07:14:29,j3mi6b,"Maybe, cause he didn't mention Jesus is King which was last year. Or maybe because that's one of his worse albums idk"
1586,2020-10-02 07:53:23,j3mi6b,"To be fair, you have to have a very high IQ to understand Kanye West. The genius is extremely subtle, and without a solid grasp of theoretical music most of his albums will go over a typical listener's head. There's also Kanye's narcissistic outlook, which is deftly woven into his characterisation- his personal philosophy draws heavily from genius literature, for instance. The fans understand this stuff; they have the intellectual capacity to truly appreciate the depths of Kanye's music, to realise that they're not just genius- they say something deep about LIFE. As a consequence people who dislike Kanye West truly ARE idiots- of course they wouldn't appreciate, for instance, the humour in Kanye's existential catchphrase ""I'mma let you finish,"" which itself is a cryptic reference to Beyonce's best video of all time. I'm smirking right now just imagining one of those addlepated simpletons scratching their heads in confusion as Kanye's genius music unfolds itself on their airpods. What fools.. how I pity them. 😂

And yes, by the way, i DO have a Kanye West tattoo. And no, you cannot see it. It's for the ladies' eyes only- and even then they have to demonstrate that they're within 5 IQ points of my own (preferably lower) beforehand. Nothin personnel kid 😎"
1587,2020-10-02 10:51:09,j3mi6b,The genius and best artist of a generation things are from a South Park episode making fun Kanye West.
1588,2020-10-03 21:34:38,j3mi6b,I mean it will be copy pasta soon
1589,2020-10-02 11:37:24,j3mi6b,"I mean, somebody would have had to make it first, right?

Also OP is spot on"
1590,2020-10-02 16:16:07,j3mi6b,Oh I thot I was on r/copypasta
1591,2020-10-02 06:51:06,j3mi6b,that could be on reddit's end. I wrote a comment  on my phone and it formatted my line breaks out one time
1592,2020-10-02 05:55:15,j3mi6b,Well... can’t expect much from someone who thinks Kanye is a genius.
1593,2020-10-02 11:01:23,j3mi6b,I'm on mobile and I can see them on my end. Maybe op edited? Or op also in mobile. Not sure how it works
1594,2020-10-02 04:59:49,j3mi6b,"If it isnt, it shouldbe."
1595,2020-10-02 06:39:56,j3mi6b,"Dang, that would be one long copypasta."
1596,2020-10-02 10:51:32,j3mi6b,"Was really fucking late, I’m reading this back now and it’s some of the most retarded shit I’ve ever written"
1597,2020-10-02 14:47:12,j3mi6b,lol indeed
1598,2020-10-02 07:10:05,j3mi6b,It should be
1599,2020-10-02 07:51:50,j3mi6b,"I’m not a hip hop fan at all, but my kid has shown an interest a while back, so I searched up a few highly regarded albums to prompt him. I had a listen to My Beautiful Dark Twisted Fantasy (pls forgive typos) and I was blown away by the quality of it.  
Kanye is a very, very good artist. Pity he’s such a monumental asshole."
1600,2020-10-02 07:44:33,j3mi6b,underrated comment
1601,2020-10-02 18:44:30,j3mi6b,"This is the same logic conservatives use to dismiss liberal celebrities. Collin Kaepernick is a football player, what does he know about politics? Greta Thunberg is a 16 year old child what does she know about climate change? 

Discounting Kanye’s opinions because he’s not a politician or whatever is hypocritical. He has shit opinions, but they should be dismissed based on the fact that they’re shit not in the fact that he’s famous."
1602,2020-10-02 05:04:47,j3mi6b,You can tell by the lack of half decent grammar
1603,2020-10-28 06:20:55,j3mi6b,“He’s popular and I don’t like his fans so he’s bad”
1604,2020-10-02 10:58:47,j3mi6b,He ain’t a god but up I like his music a lot. Also I’m Hispanic
1605,2020-10-06 12:21:59,j3mi6b,"As an adult Kanye fan, most of us know he’s absolutely ridiculous. For the most part we’re a self-aware bunch. We just vibe with his music. It’s evident if you go over to r/Kanye. 

Sorry if this response is too late to be relevant!"
1606,2020-10-02 05:10:25,j3mi6b,What happened to that sub lmao
1607,2020-10-02 12:19:00,j3mi6b,Fixed the post you're welcome
1608,2020-10-02 06:14:10,j3mi6b,"Yeah, this post really could've ended after the first sentence."
1609,2020-10-02 11:23:51,j3mi6b,OP improved it.
1610,2020-10-02 12:06:50,j3mi6b,"you're seriously missing out, this is some gourmet shit"
1611,2020-10-02 08:31:02,j3mi6b,I read all of it. It's a beautifully crafted essay.
1612,2020-10-13 09:21:02,j3mi6b,It’s satire someone put this paragraph here earlier and they’re just making fun of it
1613,2020-10-02 11:17:34,j3mi6b,Kendrick Lamar is better than him.
1614,2020-10-02 14:24:34,j3mi6b,I can see a solid frickin argument for him being that. I'm not sure I agree with you.
1615,2020-10-02 15:10:54,j3mi6b,I wouldn't call him THE best but he's definitely one of the most talented artists of this generation
1616,2020-10-28 06:22:09,j3mi6b,LMAO TRUE.
1617,2020-10-02 07:34:12,j3mi6b,So you’re a Gay fish
1618,2020-10-02 06:14:15,j3mi6b,I really like Ye but you can tell the artistic vision isn't as flushed out as the albums you like. I think people kind of need to understand the history of hip hop as well as enjoy listening to it to see why some people call Kanye a genius
1619,2020-10-02 04:54:37,j3mi6b,Kendrick Lamar and Denzel Curry aren't dickheads and make better music
1620,2020-10-02 10:26:23,j3mi6b,???
1621,2020-10-06 07:14:07,j3mi6b,"Them’s fighting words. His newer music is pretty trash, but old Kanye pretty much made modern rap/r&b. Every other song was a top 10 hit. Not the best of a generation, but his blueprint on music is seriously underrated"
1622,2020-10-28 06:24:26,j3mi6b,People like him because he’s not just a boring ass MC that people praise. He makes different music and innovates in creative ways.
1623,2021-03-02 03:59:57,j3mi6b,My Beautiful Dark Twisted Fantasy
1624,2020-10-28 06:25:21,j3mi6b,"Fuck lyricism, people worship lyrics too much, Kanye actually makes interesting and innovative music that’s different."
1625,2020-10-02 12:13:49,j3mi6b,Nah I find deep lyrics boring I just want something that's funny and enjoyable. Production way more important
1626,2020-10-02 07:19:12,j3mi6b,"People on this site seem to despise Kanye West, the same way they used to seethe with rage over Kim Kardashian, so it might trick some into thinking he's actually unpopular"
1627,2020-10-02 07:51:14,j3mi6b,"On reddit he's pretty unpopular but yeah, in any community that even remotely enjoys hip hop this is not unpopular at all"
1628,2020-10-02 10:41:28,j3mi6b,"Op has to be trolling, probably some hiphopcirclejerk."
1629,2020-10-02 08:47:39,j3mi6b,For first listening would highly recommend Life of Pablo
1630,2020-10-02 13:29:31,j3mi6b,Fixed the post now
1631,2020-10-02 07:23:43,j3mi6b,"I tried to listen to his music because of I hear his name often, but basically I find his style of music to be terrible. He seems better than others of the same music genre, but for me it remains something I don't enjoy listening at all"
1632,2020-10-28 06:28:20,j3mi6b,"Jim Morrison is more overrated than Kanye. His voice is trash and his music is cheesy and boring. I like old classic rock, too, just Jim Morrison is unbearable."
1633,2020-10-02 12:14:35,j3mi6b,Absolutely.
1634,2020-10-28 06:29:10,j3mi6b,More like people shitting on Kanye.
1635,2020-10-02 11:18:38,j3mi6b,I hope we both die.
1636,2020-10-28 06:29:24,j3mi6b,Who is then?
1637,2020-10-02 14:42:06,j3mi6b,They were.. i saw this post last night and decided I didn't have time to read it. This morning I went to give it a shot and emojis everywhere 🙃
1638,2020-10-03 15:38:33,j3mi6b,"I don’t care about good lyrics dude. He usually writes most of the songs himself or has people in the studio to brainstorm with. There’s a couple songs he’s had written but I don’t really care because I don’t care for smart lyrics, it’s all about the instrumental for me."
1639,2020-10-28 06:29:47,j3mi6b,You haven’t listened to his music.
1640,2020-10-02 16:46:58,j3mi6b,"Wasn’t a copypasta at first, I changed it because people made fun of me"
1641,2020-10-02 05:05:05,j3mi6b,"From what perspective is that man smart? I, like an overwhelming majority of people, do not see what you are seeing. Maybe you can shed some light?"
1642,2020-10-02 06:19:12,j3mi6b,"It's entirely subjective. Considering his consistency, influence, and amount of classics it's not that hot of a take for someone to have him in their top 5's. I'm not sure how you can look through his discography and not acknowledge the quality. Also, most Kanye fans that I've seen really don't appreciate his antics and shit on him all the time for it so I wouldn't say he has a massive cult of personality. ."
1643,2020-10-02 04:51:15,j3mi6b,Jesus Christ that was extremely aggressive. What did he do to hurt you
1644,2020-10-02 05:32:21,j3mi6b,Damn did Kanye fuck your wife or are you just trying to be edgy?
1645,2020-10-02 05:44:01,j3mi6b,"Kanye is definitely one of the most influential rappers of all time lol. He's at worst ""not your cup of tea"""
1646,2020-10-02 05:47:16,j3mi6b,I know that taste is subjective but im sure you dont even listen to Kanye’s music you just hate him for his rants and his relationships with the kardashians
1647,2020-10-02 11:17:02,j3mi6b,Found Ray J's account.
1648,2020-10-02 05:14:24,j3mi6b,"i mean most of his albums are either good or very very meh. he definitely isn’t the best artist of all time though lmao. also just asking, considering you hate kanye, what do you think of people like kendrick lamar or denzel curry?"
1649,2020-10-02 06:48:50,j3mi6b,Ayo chill the FUCK out
1650,2020-10-02 05:49:59,j3mi6b,Kanye’s music is good idk what you’re on. Did he fuck your bitch or something?
1651,2020-10-02 11:01:16,j3mi6b,"You probably heard his skit ""I love Kanye"" lol"
1652,2021-03-02 04:04:52,j3mi6b,Listen to My Beautiful Dark Twisted Fantasy
1653,2020-10-02 11:26:25,j3mi6b,That's a more unpopular opinion than OP's.
1654,2020-10-02 12:16:49,j3mi6b,I like kendrick but I prefer production over lyrics so my pick goes to Kanye
1655,2020-10-02 13:26:12,j3mi6b,It wasn't at first but it was so shitty and everyone made fun of me so I just turned it into a pasta
1656,2020-10-02 14:20:46,j3mi6b,I think you should read this over and over again.
1657,2020-10-02 14:12:42,j3mi6b,was originally not a joke but people made fun of me so i just spammed emojis on it
1658,2020-10-02 14:14:27,j3mi6b,was not a joke at the start but i added emojis cause ppl made fun of me
1659,2020-10-02 15:58:12,j3mi6b,i can barely name any of his features i like his solo discog way  better
1660,2020-10-02 19:46:56,j3mi6b,"Wtf are you on about. 808s, MBDTF, and Yeezus is an amazing 3 album run and imo better than his first three."
1661,2020-10-02 05:04:31,j3mi6b,Through the Wire lol
1662,2020-10-02 07:23:37,j3mi6b,"*Kanye chills with his proud*

*Boy friends with his maga hat on.*

*Shame he is a rat*

\- sneaky-money

---

^(I detect haikus. And sometimes, successfully.) ^[Learn&#32;more&#32;about&#32;me.](https://www.reddit.com/r/haikusbot/)

^(Opt out of replies: ""haikusbot opt out"" | Delete my comment: ""haikusbot delete"")"
1663,2020-10-02 12:08:05,j3mi6b,Wasn't even a pasta originally but my post was so bad that I just decided to ruin it myself
1664,2020-10-02 06:09:27,j3mi6b,Ok Kyle
1665,2020-10-02 10:48:56,j3mi6b,"Smh my head, Eminem and half of Logic are the only good rappers  🙏🙏🙏"
1666,2020-10-02 05:51:28,j3mi6b,r/rapmorelikecrap
1667,2020-10-02 07:04:26,j3mi6b,eminem hasn’t been good in awhile though lmao
1668,2020-10-06 10:50:32,j3mi6b,That’s runaway! They don’t scream because of the performance they scream because it’s considered one of his best songs. I enjoy a lot of music I just happen to enjoy Kanye the most
1669,2020-10-02 05:31:35,j3mi6b,"Yea, and no normal adult would spell absurd with an e. It’s just music taste, it’s not something to puke over unless you’re a literal child and have nothing better to quarrel over."
1670,2020-10-02 04:52:21,j3mi6b,What do you listen to? Mozart?
1671,2020-10-02 04:42:22,j3mi6b,Haha hip-hop bad. Doesn't matter that he's a great writer and producer
1672,2020-10-02 09:07:48,j3mi6b,Ew
1673,2020-10-02 11:43:10,j3mi6b,Except this is a troll post
1674,2020-10-02 09:52:35,j3mi6b,"Christ did all Kanye fans skip English class or something, every single one in this thread just writes blocks of text."
1675,2020-10-02 15:56:38,j3mi6b,"Up as far as TLoP, I don't think Kanye put a foot wrong really. What I like about him is how he takes on new styles and he clearly has his ear to the ground and was ahead of most mainstream rappers with a lot of stuff. Even the stuff after that that didn't work, he was trying something.


In terms of rapping, no he's not fantastic but I would argue that's not really the point of Kanye. It's about fantastic production, fun songs and pulling together great guests. Regarding the lyrics, I completely agree about the ghostwriters. Nothing wrong with any of that, it's what Dr Dre built his career on, too."
1676,2020-10-02 07:47:46,j3mi6b,Adderall.
1677,2020-10-02 10:47:58,j3mi6b,"Look it up man, I seriously really just like Kanye"
1678,2020-10-02 13:02:07,j3mi6b,Someone had to. What makes you think it wasn't OP?
1679,2020-10-02 13:36:40,j3mi6b,he probably sent this to the emojifier bot which puts emojis all over any text you want
1680,2020-10-02 19:23:28,j3mi6b,"I mean, someone did."
1681,2020-10-02 12:55:13,j3mi6b,Hmmm I feel like this was posted in order for it to be copy pasta in the future; yes I know I’m Sherlock Holmes no need to thank me
1682,2020-10-02 19:22:12,j3mi6b,The birth of a copypasta
1683,2020-10-02 10:44:39,j3mi6b,"Because it wasn’t that good,"
1684,2020-10-02 10:50:22,j3mi6b,I like when he talks about bleached assholes over a funky beat
1685,2020-10-02 12:59:43,j3mi6b,*That’s* why I don’t appreciate his music. I’m stupid.
1686,2020-10-03 04:03:36,j3mi6b,Good job!  My feelings exactly.
1687,2020-10-02 11:34:03,j3mi6b,r/iamverysmart
1688,2020-10-02 11:12:04,j3mi6b,"He did actually say it, although in all fairness it was only a couple times and during a short period when he was even more Kanye than usual."
1689,2020-10-02 07:15:25,j3mi6b,"You gotta add 2 breaks in 

To get a line"
1690,2020-10-02 08:20:24,j3mi6b,On PC you can check the source message and I can confirm they tried to split it between each capitalised album title but only did a single line space causing no spacing to be made.
1691,2020-10-02 08:28:06,j3mi6b,Double space at the end of the line before you press enter. I’m so used to it now I catch myself doing it not on reddit too.
1692,2020-10-02 16:06:00,j3mi6b,You need to do double breaks
1693,2020-10-02 12:58:46,j3mi6b,It fucking reads like an emojipasta now wtf
1694,2020-10-02 12:34:03,j3mi6b,"For me its less about what is written and more about all the emojis.

Is it like, an ironic thing or something?"
1695,2020-10-02 10:08:08,j3mi6b,"If it wasn't, now it is."
1696,2020-10-02 07:30:05,j3mi6b,It is
1697,2020-10-02 11:17:00,j3mi6b,"His personality has massively improved since the start. Then he started to have mental health issues, sucks that he was just starting to become a much better person and then he was cursed with mental illness"
1698,2020-10-02 13:48:31,j3mi6b,hello r/emojipasta user
1699,2020-10-02 22:51:26,j3mi6b,Your not denying your 14
1700,2020-10-02 05:21:35,j3mi6b,"It’s the wrong one

/r/im14andthisisdeep"
1701,2020-10-02 06:55:04,j3mi6b,r/sheis14andiamdeep
1702,2020-10-02 05:20:14,j3mi6b,"Probably some pedos misunderstood the subs name...


(no that was just a very bad joke. I have no idea)"
1703,2020-10-02 13:49:08,j3mi6b,"it's an emojipasta. he probably posted it here just to be ironic, which he succeeded fantastically at."
1704,2020-10-02 12:11:21,j3mi6b,I took the feedback and built upon it
1705,2020-10-02 12:26:19,j3mi6b,Thanks
1706,2020-10-02 18:20:45,j3mi6b,"he's talented

not even close though"
1707,2020-10-02 04:57:40,j3mi6b,"I'm not talking about them being dickheads or being better or worse than Kanye, I'm just saying some people who trash Kanye would also trash other hip hop artists because they don't think hip hop is a legitimate form of music."
1708,2020-10-02 10:12:43,j3mi6b,Kanye’s discography is far better than Denzel’s and a little better than Kendrick’s although that could change in the future. Have you only listened to Kanye’s music since 2015? I just don’t understand how you could say Denzel makes better music and I love Denzel. His output in recent years has been much better than Kanye’s though.
1709,2020-10-02 15:27:16,j3mi6b,"Kendrick is arguable, but Denzel Curry? No lmao"
1710,2020-10-06 09:09:19,j3mi6b,"Nah, he's rated just fine. Definitely not seriously underrated! Plenty of fools constantly claiming he's a genius or the greatest when he ain't even close."
1711,2020-10-28 15:17:09,j3mi6b,"Worship lyrics too much? Dude not from what I'm hearing on the radio. There's a reason why lyrics are important. Lyrics makes a good beat into a great song. Like are you wanting really pretty wallpaper for your background or do you want to observe and experience Caravagios masterpiece? Both are cool and I'm not shitting on anyone, but I just prefer the latter.

Also, you wanna talk innovative, Flobots have that in spades. Theyre an experimental hip hop group. How many people have a live choir, trumpet, viola, drums, and guitar on their tracks? They not enough? There are plenty of other interesting and innovative artist that focus heavily on lyricism"
1712,2020-10-02 16:12:50,j3mi6b,"Man that's where we fundamentally disagree. Production is important but if I'm entirely about lyricism. People like Flobots and Immortal Technique are where I'm at. Talking about shit that affects us all. I could write paragraphs explaining their couplets. 

""...Handcuffs and statutes, strange fruit makes bad juice..."", is nothing short of genius.

Keep enjoying music."
1713,2020-10-02 11:01:29,j3mi6b,Kanye is an asshole and some people think it translates to his music. Others just hate hip-hop and Kanye is one the biggest hip-hop artists so is the easiest to hate.
1714,2020-10-02 13:27:40,j3mi6b,"Uh, OP regularly posts in /r/WestSubEver 

They sound like the really love Kayne.  Which is totally fine, but they seem to think we'll also love to hear everything about him."
1715,2020-10-02 13:30:39,j3mi6b,Shit now you've convinced me of his genius
1716,2020-10-02 17:21:05,j3mi6b,"Its fine if his music doesn't click with you. But objectively Kanye is far from a bad artist, considering his contribution to Hip-hop"
1717,2020-10-02 08:44:58,j3mi6b,whats “his style of music?” he’s done a lot of different things i dont think you can really say he has a specific style.
1718,2020-10-02 14:59:19,j3mi6b,"Just out of pure curiosity, what kind of music do you enjoy?"
1719,2020-10-02 08:22:25,j3mi6b,Which is fair
