,Timestamp,SubmissionID,Comment
885,2020-06-28 16:03:14,hhgtps,"[](/user/Anthonybrose)

Please post any comments *that are not a photoshop* as a reply to this comment and leave the top of the thread for original content.  

I, Bot, removed my first comment to keep this nest at the bottom of the page. 

---

[**Check out the  /r/photoshopbattles ""Best of 2019"" Results!**](https://www.reddit.com/r/photoshopbattles/comments/el17c0/)

---

Other subreddits for 'shoppers: /r/cutouts, /r/battleshops

[^Posting ^a ^cutout? ^Please ^read ^this.](/r/cutouts/wiki/index#wiki_flair.3A)

^(Helpful links for this image:) [^Other ^Discussions](https://www.reddit.com/r/photoshopbattles/related/hhgtps/psbattle_miley_cyrus_with_a_mullet/) ^| [^KarmaDecay](https://karmadecay.com/r/photoshopbattles/comments/hhgtps/psbattle_miley_cyrus_with_a_mullet/) ^| [^Google ^Image ^Search](https://www.google.com/searchbyimage?&image_url=https://i.redd.it/gfvenq3kbo751%2ejpg) 

---

*^(This is an automated response)* [^FAQ](http://www.reddit.com/r/apicontraptions/wiki/apicontraption_faq) ^| [^Send ^Feedback](http://www.reddit.com/message/compose/?to=apicontraption&subject=Feedback ___thingId___&message=[Link to post](https://www.reddit.com/r/photoshopbattles/comments/hhgtps/psbattle_miley_cyrus_with_a_mullet/\) 'I like feedback')"
886,2020-06-28 16:06:09,hhgtps,Pretty sure that's the guy who sleeps on a bench in my small town at night.
887,2020-08-20 15:10:19,idbtac,"I thought she was taking a break because she has the interviews from LA already completed. I haven't listened to the most recent episode, but did she say there wouldn't be episodes during the hiatus?"
888,2020-08-20 17:34:55,idbtac,"But even if the weeks were planned in advanced, I still wouldn’t let the hype of Miley Cyrus being on the podcast die off with two weeks of no content. I think this is ridiculous. Like I know everybody deserves a vacation but I wish I could get paid to put out an hour of content for 40/52 weeks 😂"
889,2020-08-20 18:13:26,idbtac,Y’all so bitter ); let homegirl live
890,2020-08-20 15:14:59,idbtac,"She did say no episodes, but she repeated once again that she only agreed to 40(?) episodes this year. I am assuming they agreed ahead of time which weeks she would be off and at that time didn’t know they would have Miley on right ahead of it"
891,2020-08-20 18:20:14,idbtac,"I don’t think it’s very bitter. It’s very true, extremely poor marketing ploy in my opinion as well."
892,2020-08-20 15:17:09,idbtac,Thank you for this info!
893,2020-08-20 14:38:34,idbgg5,"Hi everyone! I’m Bridgette Azul from Dallas, TX! I just love the new Miley Cyrus song, so I made a little lip sync video and thought I’d share here for anyone who may enjoy! 💋❤️ (@bridgette_azul on IG)"
894,2020-08-25 23:31:47,idbgg5,[deleted]
895,2020-08-25 23:34:10,idbgg5,Awe! Thank you so much! ❤️💋
896,2020-08-20 14:25:49,idb77s,"Hi everyone! I’m Bridgette Azul from Dallas, TX! I just love the new Miley Cyrus song, so I made a little lip sync video and thought I’d share here for anyone who may enjoy! 💋❤️ (@bridgette_azul on IG)"
897,2020-08-20 14:01:06,id9nnh,"I am 99% sure Miley has shit talked every single, song, and era everytime there is a new era starting. In a year she will be shit talking She is Coming, Nothing Breaks Like a Heart, and Don’t Call Me Angel."
898,2020-08-20 13:01:24,id9nnh,"“Younger Now” (the song) is still one of my faves of hers, so while I get what she’s saying, i still enjoyed the 2 singles from it before she cut off promotion for the album"
899,2020-08-20 13:52:51,id9nnh,"She’s definitely not wrong. We all know that, and we all knew that back then. And she’s not even saying this is something she’s ashamed of or bad by any means, right? It’s just completely off from everything she has done after she got control of her career.

Said that, I’d love her to just embrace her shit. We all do that, we all have our moments, whether it’s because of a bad relationship or anything. We’re all just human anyway. It’s a good album and reflects a moment of her life, and even if she sees it as a mistake, we are made by our mistakes too."
900,2020-08-20 13:07:05,id9nnh,"Here we go again. 

Has she officially denounced every single era of her career?"
901,2020-08-20 13:10:28,id9nnh,dead petz and younger now could have basically been a career killing one two punch if she wasn’t such a notable figure in the industry. if she released another album in the vein of bangerz as a follow up she could have had a similar trajectory to ariana’s career from sweetener to thank u next. she will always have enough money and name recognition to do decently in the industry tho. she’s someone who will still be performing tributes at the grammys in like 30 years.
902,2020-08-20 18:10:12,id9nnh,"this thread is cracking me up. but it actually makes sense what she’s saying. and saying that. slide away was kind of the best direction after her break up. it’s such a great break up song. 

younger now (the song) still slaps tho"
903,2020-08-20 14:13:01,id9nnh,"I think you guys should listen to what she’s saying. She got lost in Liam... she was doing everything for him, changing her behaviour for him, etc. I’ve experienced this myself when I’ve been in love and that’s not always a good thing. You start to change everything about yourself for this other person, to make them love you. So while this can sound like her typical “that’s not me” bs, I think this time she makes a really good point that I can relate to."
904,2020-08-20 13:57:52,id9nnh,"I mean, it really didn't. Malibu is still one of her best songs."
905,2020-08-20 12:58:50,id9nnh,"Younger Now definitely made sense in her career, it was her ""going back to my roots as a white singer by using accoustic guitars around the 7-year mark"" album (looking at you Gaga), it just wasn't that good of an album. If it didn't make sense career-wise, her label wouldn't have allowed for it to happen. Malibu put her back on the map. However, it is absolutely valide if she believes that it doesn't make sense to her personnally anymore, but the two shouldn't be confused."
906,2020-08-20 17:43:33,id9nnh,"you can tell who watched the video and who didn't. she's not ""shitting on"" Younger Now, she's saying after Bangerz and Dead Petz, Younger Now was kind of a random direction to go into, and that was heavily influenced by her relationship. find me evidence where she says it's bad or she doesn't like it."
907,2020-08-20 14:45:55,id9nnh,Is there anything more predictable than Miley shitting on her previous era when she starts a new one? It’s a tradition at this point. She says every previous album wasn’t representative of who she really is and the new one is the real her.
908,2020-08-20 14:03:24,id9nnh,"I do think what she's saying makes sense. But theres a fine line between ""losing yourself"" in someone else and being madly in love. I think it's hard to look back and say ""I was so in love!"" so instead you might think ""wow, I really lost myself in that relationship"". It can even be a bit of both. But love is a beautiful thing. Doesn't always last, but its freeing when you get to the point where you can look back and ENJOY those memories for what they were instead of shutting it down as a mistake."
909,2020-08-20 14:24:45,id9nnh,I don't mind when an artist says these things as long as she doesn't make people feel bad for liking and still listening to her past music. That's my only concern when it comes to moments like this but she doesn't seem to be making people feel bad for liking and listening to her other stuff so I think it's fine.
910,2020-08-20 19:10:36,id9nnh,"I do love her admitting to losing herself to Liam, because that’s what I was saying at the time. Younger Now is the same as her bun era where she was quiet on social media for a year or 2. 

She believes the way she acted was disingenuous from who she actually is an artist, and maybe even as a person.

I hope she never gets back with Liam, these problems may not be his fault but I do think that he is the contributing factor."
911,2020-08-20 13:54:18,id9nnh,"Girl, you've done it again. Constantly shitting the bar for us all."
912,2020-08-20 14:25:30,id9nnh,"Next Week: Miley Cyrus says ""Midnight Sky"" was pure trash"
913,2020-08-20 16:04:47,id9nnh,She does this a lot. I've always loved Younger Now.
914,2020-08-20 13:54:00,id9nnh,"Add her to the ""Which artist dislike their own songs"" list lol"
915,2020-08-21 04:23:16,id9nnh,I feel bad for the people who worked with her on that album. The amount of disrespect.
916,2020-08-20 15:27:33,id9nnh,"oh so an album is definitely coming now I'm sure

Also in five years she'll be saying the same about midnight sky 💀"
917,2020-08-20 15:17:57,id9nnh,"Miley girl, which era do you not end up hating? lmao"
918,2020-08-20 17:58:56,id9nnh,"Malibu is one of my favorite Miley Cyrus songs/moments. I was never a huge fan of Bangerz, so her revisiting her girl next door image/vibe was so exciting for me. I think she was also at her most beautiful during this era. Idk I liked it! I wish Younger Now was more like Golden Hour tho."
919,2020-08-20 20:28:56,id9nnh,Malibu is a career highlight tho
920,2020-08-20 22:04:08,id9nnh,"Well it seems it was not s moment most pleasing to her in her career, along with literally everything else she has released."
921,2020-08-21 06:04:00,id9nnh,"She needs to stop bashing her own damn eras.  *Younger Now* was a good album.  Girl needs to stand by her work.  At the time, it was what she needed to write."
922,2020-08-20 17:24:03,id9nnh,"serious question. why do so many fans think it's disrespectful for artists to distance themselves for previous work? i get it if the previous work is removed from streaming or otherwise made inaccessible, but if you can still listen to the music what's the big deal? saying that they don't love that era now doesn't mean that they didn't at the time, like how breaking up with someone doesn't cancel out the good times in the relationship (weird analogy but it's all i can come up with)."
923,2020-08-20 16:30:23,id9nnh,She always does this. I don’t understand why she can’t just realize that she evolved and changes and that it made sense for her to do the things she did in those times of her life?
924,2020-08-20 17:45:53,id9nnh,I loved this album 🤷🏻‍♀️
925,2020-08-20 19:28:28,id9nnh,Where I can watch the full interview
926,2020-08-20 23:09:54,id9nnh,lol what's new?
927,2020-08-21 01:55:02,id9nnh,"Thank god. Younger Now was a sever misstep, but her biggest issue has been her callous dissavowals of her past eras. She's talented and should have stayed on top longer, but her failure to embrace her past hurts her to this day. 

Dead Petz was a fun detour and I disagree with people who thought that it was a career killer. It was fun and made interesting. She really killed her good will with Younger Now and the disastrous interviews surrounding it. 

Hannah Montana made Miley a literal superstar. She never needed to disavow it because her fame exceeded the show itself. Was it band management? Bad agent? Bad record label? I still believe there is time for Miley to make a comeback, but she needs to remember what her successful to begin with. She already has the package, she just needs to be smarter about it."
928,2020-08-21 12:38:02,id9nnh,Inspired is still one of my favorite songs ever
929,2020-08-20 15:20:01,id9nnh,Doesn’t she just say this about everything that flops?
930,2020-08-20 14:57:44,id9nnh,"I hate that she says this. It’s so obnoxious. Like girl you didn’t hate it when the album gave you millions of dollars. And I’m sorry but that haircut is atrocious. 

It’s so hard for me to respect an artist who bashes their previous work. Ariana does the same thing with My Everything and DW and I’m like girl why. Those 2 albums solidified your career at least fake that you like them lol."
931,2020-08-20 15:58:14,id9nnh,"lol... it would have made sense if she didnt backtrack her image and ""growth"" so suddenly like a few months later"
932,2020-08-20 19:10:49,id9nnh,"I kinda dislike when people do this.

However I think everyone should voice their opinions and if you don’t like era or project you did then say it. I don’t think you should hold back. And this is 

It really kind of irks me when musicians disown their past works. Because even if you don’t like it, it’s still an era that made people fall in love with you and they might have a strong connection with. Hearing the musician not like it ruins it a bit

Like when Ariana said she hated a lot of tracks on My Everything. It makes it hard as a listener to revisit these tracks knowing Ariana didn’t like them. And some songs like Why Try were was made me love Ariana.

Like when Miley said she didn’t like Party In The USA and she never heard a Jay-Z song. It just made the song a little less special. 

And sure this is silly because I can still enjoy it even if the musician didn’t like it."
933,2020-08-21 08:13:57,id9nnh,"I’m glad she said it. As someone who has always loved miley being a rebel and leaning into her whackiness, seeing her be so plain and vanilla was gut wrenching. Hate the album."
934,2020-08-23 03:02:16,id9nnh,"I still love Malibu and Younger Now. The rest of the album was okay and was really a more of please get back me Liam record than anything else. It served its purpose I suppose.

Ilove this new slide away/midnight sky as its a perfect mix between country and pop miley with some rock. That is her perfect niche, tbh"
935,2020-08-20 14:30:55,id9nnh,.m
936,2020-08-20 14:16:50,id9nnh,I wouldn’t blame her for shittalking Don’t Call Me Angel tho
937,2020-08-20 17:12:31,id9nnh,as long as she leaves slide away alone she's fine
938,2020-08-20 17:53:44,id9nnh,"i know it’s kind of a joke at this point but is Miley reflecting on how she was blinded by love & doing basically anything for her partner despite knowing it wasn’t working & trying to translate that into her music-but failing-really “shit talking” her music? 

i know, she retracts her previous era’s a LOT lol but i can’t blame her for not thinking it’s a good representation of her. that whole time in her life was the beginning of the end of her relationship. it’s extremely sad. she thought she was so happy & was making an album full of songs of nostalgia & love but it was all surface level. nobody truly knows what went on between miley & liam but the way miley talks about it, you can kinda tell that she was trying to make things last & make things work despite knowing they weren’t going to make it. you can even hear that in the music. slide away is that sentiment.

anyway i know i just rambled on & im probably taking the comments a little too seriously but it makes me sad that people are gonna shit on miley for saying this as if she’s trash talking all that music she made when she’s not. she just is realizing that none of it was representative of that time. it was all a facade & of course it would upset her to look back on it"
939,2020-08-20 17:33:01,id9nnh,"although she isn't saying it's bad, just that the trajectory of her career was influenced by her relationship"
940,2020-08-20 19:05:21,id9nnh,"So you're the same person as 3 years ago? She didn't shit-talk. She doesn't feel as connected to that era because of Liam. Liam told her to clean her image and she wasn't as focused as other eras and btw, Liam always talks shit about Miley when he is the one doing drugs. That's why she didn't tour. In an interview, she said she was grateful for Hannah Montana and Bangerz. Check your facts before you comment."
941,2020-08-20 17:00:50,id9nnh,because she is awful and she knows it
942,2020-08-20 13:42:30,id9nnh,"Same here, that album for me hits so many good summer vibes and already evokes a little nostalgia for me."
943,2020-08-20 14:04:17,id9nnh,"Same, loved Younger Now. The sound suited her so well."
944,2020-08-20 16:32:37,id9nnh,Younger Now was an incredible song!
945,2020-08-21 04:38:47,id9nnh,she's just saying she doesnt like it because of Liam
946,2020-08-20 17:38:17,id9nnh,"she embraces her songs a lot at times (especially the Hannah stuff recently, but she also played a rockier version of Party in the USA on the Dead Petz tour) but i feel like her critiquing her music spreads way faster than her appreciating her old music"
947,2020-08-20 13:23:34,id9nnh,She's about to denounce Midnight Sky
948,2020-08-20 17:34:05,id9nnh,she's not really denouncing it as much as she's just saying sonically it was a left turn from where she was going
949,2020-08-20 14:19:24,id9nnh,"On one level, it's worthy of respect she did exactly what she wanted with *Dead Petz* and wasn't pressured into making a *Bangerz* 2 to sustain her success. However, she would be the biggest star in the world if she'd properly followed up on *Bangerz* with a pop album (just like you mention Ariana did), and it's such wasted potential.

I'm still waiting to hear the Miley music that sounds like country Lana with a choir on background vocals, that Mike WiLL played to a music journalist a few years ago."
950,2020-08-20 17:36:10,id9nnh,I actually liked that she preferred to make the music she wanted rather than the music she thought everyone else wanted. Dead Petz is the shit.
951,2020-08-20 13:07:00,id9nnh,Joanne made me a fan. 🤡
952,2020-08-20 13:12:46,id9nnh,I think what she means is that she was trying to be someone she is not during that era in order to stay happy in her marriage bc Liam did not like Miley being her crazy weird true self.
953,2020-08-20 14:20:34,id9nnh,*Younger Now* was much more cynical than *Joanne*. Gaga didn't sell out her previous electronic pop music just to sell her new analogue stuff like Miley did.
954,2020-08-21 04:41:21,id9nnh,"Exactly. She's just trying to detach from that era because it was very tied to Liam, but can't put it as clear as you just said it."
955,2020-08-21 06:28:20,id9nnh,"The thing is, Malibu was successful and probably would’ve debuted top 5 had it been released in the tracking week. Why did they just drop the ball on the rest of that rollout."
956,2020-08-21 01:58:14,id9nnh,"I disagree. It was a huge mistake. It has the weakest songs of her career. Miley has always sold lots of records, it was the first time she had legitimately flopped."
957,2020-08-20 14:16:11,id9nnh,She hasn’t left that list in ages
958,2020-08-23 03:03:13,id9nnh,"Honestly, this so much. It was a solid vanilla album that she did to win back Liam I felt and Malibu is a great song."
959,2020-08-23 03:09:43,id9nnh,"Its honestly so tiring, just say your growing as an artist, Miley."
960,2020-08-20 19:12:45,id9nnh,Nope. She dragged Bangerz much harder.
961,2020-08-20 15:13:25,id9nnh,"
>Like girl you didn’t hate it when the album gave you millions of dollars.

Younger Now made millions of dollars? Maybe in some other currency."
962,2020-08-20 16:13:38,id9nnh,"This feels like an oddly personal attack, especially the haircut part. Drag me for saying this all you want, but mullets are great and are rightfully becoming this year's trend.

Also, earning money from one of your projects doesn't automatically mean you cannot voice negative opinions about it later on. It's your own work after all and it often happens that people change their minds about what they've created in the past. What might seem like your best work when you share it with the world, might become your least favourite in the future. Whether that be because of personal events or whatever doesn't matter, it's fully understandable.

You can still like their work. It's really no problem..."
963,2020-08-20 17:20:41,id9nnh,"artists can not like their previous music but still appreciate what they did for their career. ariana didn't bash ME and DW, she said they were albums of hits made for her to boost her career, and that's why she isn't as attached to them. it makes complete sense that she'd prefer her later albums she had more of a hand in creating, and it doesn't mean you aren't allowed to like them. it's not that deep."
964,2020-08-20 15:53:10,id9nnh,"I didn't know she slammed DW. Seriously, that's the album that made me an Ariana fan. ""Into You"" is the perfect pop song. I wasn't much a fan of Thank You, Next. I feel it doesn't have longevity and was clearly chasing trends."
965,2020-08-20 18:38:25,id9nnh,It tanked what are you on about 😂😂😂😂
966,2020-08-20 19:51:42,id9nnh,">It really kind of irks me when musicians disown their past works.

there's a big difference between disowning past work and saying they don't vibe with it any more though. in this video, miley said that YN was a random direction after the two previous albums, and that it was heavily influenced by her relationship. that's not disowning her past work at all."
967,2020-08-20 21:50:48,id9nnh,Lana has tried to erase that song from existence I’m sure 💀
968,2020-08-20 14:21:41,id9nnh,I liked it
969,2020-08-21 07:53:54,id9nnh,that song was messy gold shhhhh
970,2020-08-21 01:23:59,id9nnh,"I'mma be honest, I can't speak for every artist, but just as someone who writes and produces, it's REALLY easy to want to disavow/ignore music I've made 2 years, 3 years, hell even 8 months ago. When you make stuff sometimes you're in a very specific frame of mind and when you're no longer there (because people change so quickly) it's SO easy to be like ""I don't resonate with that anymore, that's not me"". So I actually get why Miley would disavow each era as time goes on. Tack that with her previous relationship...oxytocin can make you do inauthentic shit..."
971,2020-08-20 17:30:27,id9nnh,Literally who asked? Please shut your hater ass up and gtfo.
972,2020-08-20 13:44:06,id9nnh,"2023, wait for it"
973,2020-08-20 17:47:46,id9nnh,I was only half serious.
974,2020-08-20 19:05:29,id9nnh,"To call Miley, someone who has been working since she was 12 and was more successful by 16 than most pop acts will ever be, “wastes potential” is ludicrous by every metric. 

By the time We Can’t Stop released, Miley Cyrus was a household name and could have retired from music.

The reality for someone as cemented as Miley in the music industry is she really doesn’t have to cater to radio, trends, or social media memes for people to buy the music. Not to say everything she does will go #1, but if she never had a hit again, it wouldn’t detract from her career."
975,2020-08-20 15:54:08,id9nnh,Her mistakes are better than my best efforts so
976,2020-09-03 07:45:47,id9nnh,"Late to this comment, but I agree wholeheartedly with everything you said! Loooove Dead Petz so much too, it has some of my favourite Miley songs of her career"
977,2020-08-20 13:27:30,id9nnh,"It's a good album, don't listen to them"
978,2020-08-20 15:34:41,id9nnh,"me too, you're not alone haha"
979,2020-08-20 13:57:14,id9nnh,"Personnally it was lost on me, but I don't exactly have strong feelings about it either"
980,2020-08-20 15:29:30,id9nnh,"Omg me too, like I loved some singles like Judas or GUY and I liked her antics but Joanne made me a fan. It's her best album"
981,2020-08-20 13:23:19,id9nnh,But she says this with every single album right?
982,2020-08-20 17:55:10,id9nnh,"Not going to invalidate anything she might feel or have felt during a relationship I know nothing about, but  what I was trying to express is that sometimes with Miley, it feels like because she is evolving as a person and having insights about herself which are different from album to album, she feels the need to dismiss the music she put out earlier and the career moves she made just because she personnally changed. No other pop star goes around diminishing or shrugging off their past eras like Miley does, which kind of breaks the popstar illusion. Though going a little bit deeper, I can see why she might have a hard time dissociating her popstar persona during each era from her own self, considering the fact that she spent a lot of her younger years acting in a tv show which played with the popstar identity on several levels (honestly who puts a teenage girl in a show where she plays a character named just like her, whose father is played by her own, and grooms her into a popstar while she herself plays a hidden-identity popstar...)"
983,2020-08-20 13:30:09,id9nnh,">Liam did not like Miley being her crazy weird true self. 

What evidence do you have to support this statement?"
984,2020-08-20 17:33:21,id9nnh,Let's say it was more of a comparison in terms of career move than it was an analogy.
985,2020-08-21 08:30:35,id9nnh,"Just as I explained, the record makes sense, it's just a bad album. If you want me to rephrase it, the idea of the era is coherent with her career, but it failed because the execution was poor, music-wise."
986,2020-08-20 17:17:50,id9nnh,"she didn't slam DW, OP is exaggerating. i don't remember her exact words but she's basically said that DW was deliberately made to be an album of hits to boost her career and the songs aren't necessarily personal to her, which is true. her feelings about My Everything are probably similar. sweetener is the album where she got more involved in the songwriting/production side so it makes sense that she'd feel more emotionally attached to sweetener/tu,n."
987,2020-08-21 00:21:28,id9nnh,I think her part is the best part in the song tho
988,2020-08-21 08:17:24,id9nnh,she tried manifesting to erase it
989,2020-08-20 17:54:14,id9nnh,"i LIKED it too lol

key word tho. it got stale after a month"
990,2020-08-20 20:26:46,id9nnh,"Tbr if an artist defaces their own music, it’s fair game for everyone else to pipe in with their own opinion. Miley does this every single time she has a flop era which is every single era since 2014."
