,Timestamp,SubmissionID,Comment
3768,2020-12-30 14:52:50,kn3frp,"Sorry, u/fulltimecatmassager, your submission has been removed:

**RULE TWO: All posts must be Nintendo news from the original source or discussion about Nintendo products.**

* News should be from the original source wherever possible. Please look carefully for the source, which can often be found in a link at the bottom of an article. Secondary sources or blogs are okay where they either add substantial information or an english translation.



You can read all of our rules [on our wiki](https://www.reddit.com/r/nintendo/w/about/rules). Please feel free to [message us](https://www\.reddit\.com/message/compose?to=%2Fr%2Fnintendo&subject=About my removed submission&message=I'm writing to you about the following submission: https://www.reddit.com/r/nintendo/comments/kn3frp/-/. %0D%0DMy issue is...) if you think we've made a mistake."
3769,2020-12-30 20:18:34,kn3f38,"Hey /u/fulltimecatmassager, thanks for contributing to /r/nottheonion. Unfortunately, your post was removed as it violates our rules:

**Rule 2** - Sorry, but this story isn't oniony.  

Please consider submitting your article to /r/offbeat or similar subreddits unless it truly reads like The Onion wrote it. The title and article itself must both be ""Oniony"". This can be highly subjective; you are encouraged to upvote articles that should be here and downvote those that should not. Moderators can also remove posts at their own discretion under this rule.

Please read the [sidebar](http://www.reddit.com/r/nottheonion/about/sidebar) and [rules](http://www.reddit.com/r/nottheonion/about/rules) before posting again. If you have questions or concerns, please [message the moderators through modmail](https://www.reddit.com/message/compose?to=/r/nottheonion&subject=&message=). Thank you!"
3770,2020-12-30 20:18:13,kn3f38,"Greetings, fulltimecatmassager. Unfortunately, your post has been removed from /r/nottheonion because our rules do not allow:  

* Content that doesn't have an oniony quality to it (rule #2).  Your submission would be better suited for another subreddit.  Just because you think the title is funny or ironic, that doesn't mean the article is right for /r/nottheonion.    

""Oniony"" means a story _legitimately seems more like satire than news_ at the time of posting.  Not just a funny title, and not something that's weird but not a rare sort of thing.  Many submissions here are more appropriate for /r/Offbeat, /r/WTFNews, /r/FloridaMan, /r/WeirdNews, /r/NewsOfTheWeird, /r/NewsOfTheStupid, /r/Funny_News, /r/WholesomeNews, /r/EverythingScience, /r/Morbidreality, a ragebait sub, or a political sub.  It may also be /r/NoShitSherlock or clickbait that belongs in /r/SavedYouAClick.  We don't mod those other subs so check their rules, but your post may belong in one of more of them.    

For a full list of our submission rules, please visit our [wiki page](http://www.reddit.com/r/nottheonion/wiki/expanded).  
  
If you're new to /r/nottheonion, you can check out [NTO101: An Introduction to /r/NotTheOnion](https://www.reddit.com/r/nottheonion/wiki/nto101) for more information on our rules and answers to frequently asked questions.  
  
This decision was made by human mods; the bot just does our dirty work.  If you have any questions or concerns, feel free to [message the moderators](http://www.reddit.com/message/compose?to=%2Fr%2Fnottheonion).  Please include a link to the post you wish to discuss, it doesn't autofill from here."
3771,2020-12-30 14:18:24,kn31bc,"Greetings, \/u/69venosaur!  Your submission from newsweek.com has been automatically removed because it violates Rule 11 (no blocked or redirected links).  **Submissions from websites that contain a paywall, such as newsweek.com, are not permitted.**  If you don't see a paywall, it may be that your source's paywall only appears after a certain number of articles have been viewed.  [For more information on Rule 11, click here.](https://www.reddit.com/r/nottheonion/wiki/nto101#wiki_rule_11.3A__no_blocked_or_redirected_links.)  

For a complete list of domains that are not allowed, [click here](https://www.reddit.com/r/nottheonion/wiki/autoremoval).  If you're new to \/r/NotTheOnion, you may want to check out [NTO101: An Introduction To \/r/NotTheOnion](https://www.reddit.com/r/nottheonion/wiki/nto101) for more information on our rules and answers to frequently asked questions.  

*I am a bot, and this action was performed automatically. Please [contact the moderators of this subreddit](/message/compose/?to=/r/nottheonion) if you have any questions or concerns.*"
3772,2020-12-30 15:59:08,kn2yg5,"This one has been solved before

https://www.reddit.com/r/synthrecipes/comments/90y35h/kanye_west_violent_crimes_synth_pad_that_plays_at/?utm_source=share&utm_medium=ios_app&utm_name=iossmf"
3773,2020-12-30 15:52:46,kn2yg5,deff would like to hear how to did this as well. in my extremely limited knowledge it sounds like sum type of organ with a chorus on it. maybe EQ'd sum of the top too. im new asl to sound design tho so take w grain of salt
3774,2020-12-30 21:11:29,kn2yg5,its just a pad with chorus bro
3775,2020-12-31 00:41:08,kn2yg5,What synths / plug ins do you have access to? The organ in logic with the Leslie sim and a bit of verb would get you close.
3776,2020-12-30 20:05:13,kn2yg5,"I saw that. 

Is it possible to make something similar without that device?"
3777,2020-12-31 00:43:25,kn2yg5,Currently I use ableton and have been using their main plugins like wavelength
3778,2020-12-31 00:44:02,kn2yg5,I’d look for some kind of organ / Leslie sim plug in
3779,2020-12-31 00:44:23,kn2yg5,Okay I will! Thank you
3780,2020-12-30 14:54:04,kn2pmm,"YOU DON'T HAVE THE ANSWERS, SWAY"
3781,2020-12-30 15:29:14,kn2pmm,[deleted]
3782,2020-12-30 17:22:51,kn2pmm,Sway almost took off his hat - Kanye is a special type of annoying.
3783,2020-12-30 18:05:58,kn2pmm,"Lmao to this day I’ll still quote the HOW, SWAY?!"
3784,2020-12-30 16:00:28,kn2pmm,I remember watching this in my dorm freshman year of college. It’s such an entertaining interview. It feels like a bridge to a lot of what Kanye started doing with the Yeezy brand.
3785,2020-12-30 17:03:14,kn2pmm,This the exact moment that the old kanye became the new kanye
3786,2020-12-30 15:12:06,kn2pmm,"3 all time quotablels in under 1 minute, legendary."
3787,2020-12-30 20:30:44,kn2pmm,Lmfao man I will never forget when this first came out “YOU AINT GOT THE ANSWERS SWAY” Lol and then he went and did Breakfast club haven’t seen him do a interview since 😭😭😭
3788,2020-12-30 17:02:38,kn2pmm,Love the second long snippet of this clip Jean Dawson uses on Pyrotechnics. IDK why but I woke up with this stuck in my head of all things and I was shocked to see it here.
3789,2020-12-30 15:11:46,kn2pmm,Kanye tends to do most things he puts his mind to. And most of his interviews make more sense around 5 years later.
3790,2020-12-30 16:41:16,kn2pmm,Still haven't heard of sways clothing brand
3791,2020-12-30 16:53:31,kn2pmm,This was the moment I started hating Kanye. No one berates Sway
3792,2020-12-30 15:13:21,kn2pmm,"Lol Kanye don't make any sense here. He needs someone else to finance him? Sway asks him, why can't you do it yourself, and Kanye says he can lose money bc he doesn't have the knowledge. Losing $13m isn't much when you're wanting billions. And why should anyone finance him if he doesn't have the knowledge and is too scared to put his own skin in the game?"
3793,2020-12-30 17:14:31,kn2pmm,reminds me of beetlejuice
3794,2020-12-30 17:52:58,kn2pmm,What song is it that has this sample on it again? Its in my head but i cannot fucking remember who its by
3795,2020-12-30 17:14:39,kn2pmm,Legendary
3796,2020-12-30 23:58:24,kn2pmm,"Friendly reminder many of yall stans thought this was normal behavior cause ""Yeezus album classic lulz"""
3797,2020-12-30 21:00:12,kn2pmm,Fuck kanye
3798,2020-12-30 15:03:52,kn2pmm,"He is obviously being an ass but i just love his energy here, i come back to this video so often for that reason alone lmao"
3799,2020-12-30 19:03:06,kn2pmm,Who would ever give a child like that their money? I know he's mentally ill/bi-polar but honestly I also just think he's a douchebag.
3800,2020-12-30 23:24:34,kn2pmm,kanye west is a lame
3801,2020-12-30 15:22:49,kn2pmm,nothing he said was wrong or disrespectful.
3802,2020-12-30 14:55:40,kn2pmm,"Lmao, IT AINT RALPH DOE!!!"
3803,2020-12-30 16:50:08,kn2pmm,"I’m asking YOU for the answer, it’s a question!"
3804,2020-12-30 20:58:16,kn2pmm,"DOO DAH, DOO DAH"
3805,2020-12-30 22:30:26,kn2pmm,**HOW SWAY?**
3806,2020-12-30 16:47:54,kn2pmm,Yeah all this true but let the child out from the hat sway
3807,2020-12-30 17:31:07,kn2pmm,"The most annoying part for me is that Sway makes unbreakable eye contact with Kanye that entire sequence and Kanye won't look at him.

Like man, you wanna go off on him and act like your opinion is important but can't even look the man in the eye while you're making your point."
3808,2020-12-30 17:27:54,kn2pmm,"Charlemagne has an interview with ye after yeezus was released where he gives it to ye straight. ""I think this album is garbage"" type stuff."
3809,2020-12-30 19:29:36,kn2pmm,he talks like a real guy that isnt sucking his dick. if u let anyone talk to you like kanye does you a straight soyboy.
3810,2020-12-30 19:57:23,kn2pmm,Not the VMAs?
3811,2020-12-30 22:56:56,kn2pmm,"I wish that song was better, it kinda ends the album on a underwhelming note. Still in my top 10 tho"
3812,2020-12-30 17:29:40,kn2pmm,That’s a terrifying thought. Will Kanye become president of the United States? What’s under Sways’ hat? Does Sway have the answers? Find out next time on Dragon Ball Z
3813,2020-12-30 20:18:10,kn2pmm,"I don't know about that. Kanye loves announcing shit that he has no intention of following through on. His video game, his cartoon, his how many unreleased albums. The man can't follow through."
3814,2020-12-30 18:25:20,kn2pmm," 🎶 im ahead of my time, sometimes years out / so the powers that he won’t let me get my ideas out 🎶

I really hope he isn’t ahead of the curve politically because I don’t like where his curve is going lmao"
3815,2020-12-30 19:58:31,kn2pmm,[deleted]
3816,2020-12-30 21:45:56,kn2pmm,Same. Honestly same.
3817,2020-12-30 17:53:25,kn2pmm,lol
3818,2020-12-30 16:27:39,kn2pmm,"Actually he makes plenty of sense. The only way to have a means of distribution and production widespread enough is to be funded by a larger organization because they own the factories. Kanye himself could never raise enough to elicit the type of distribution he would need to be a name brand, despite having the potential projections to do so. 

He was, and still is, in a race against time to achieve all of his goals while he still has his biggest bargaining chip which is being “Kanye West”."
3819,2020-12-30 16:17:44,kn2pmm,What was his net worth at the time of this vid?
3820,2020-12-30 16:30:49,kn2pmm,He makes perfect sense
3821,2020-12-30 18:28:17,kn2pmm,Yeezy also references this interview himself by rapping “but it ain’t Ralph though” on the song “Can’t Stop” by Theophilus London ft Kanye West.
3822,2020-12-30 19:23:22,kn2pmm,"It's something out the griselda camp. I wanna say it's off a wsg album

Edit: here you go https://youtu.be/VDRt0W7tWtY"
3823,2020-12-30 18:24:25,kn2pmm,pyrotechnics by jean dawson
3824,2020-12-30 20:33:50,kn2pmm,Adidas and Gap.
3825,2020-12-30 22:50:39,kn2pmm,People with money don't care if someone's a douchebag if it makes them money.
3826,2020-12-30 15:41:36,kn2pmm,I take it you’re talking about Kanye and if so that’s debatable lmao. At the very least it just reeks of an obnoxiously over-inflated ego.
3827,2020-12-30 16:25:54,kn2pmm,The way he was acting and refusing to even look in Sway's direction at all is extremely disrespectful. Shows his mental instability.
3828,2020-12-30 16:48:58,kn2pmm,You must have a lot of friends chedduhBob
3829,2020-12-30 16:21:37,kn2pmm,"What’s the name of yo clothing line, we don’t know!!!

HAHAHHAA"
3830,2020-12-30 20:12:48,kn2pmm,This is my all time favorite quote  from Kanye.
3831,2020-12-30 17:48:15,kn2pmm,[removed]
3832,2020-12-30 17:33:42,kn2pmm,and ye ignored tf out of him lol that vid is hilarious
3833,2020-12-30 18:24:22,kn2pmm,Yeezus is Kanye's best album.
3834,2020-12-30 21:08:50,kn2pmm,learn a new word incel
3835,2020-12-30 21:30:44,kn2pmm,"Why are people who use ""soyboy"" always such insufferable weirdos?"
3836,2020-12-30 21:16:09,kn2pmm,"Kanye very much has the power to fuck with most interviewers lmao it isn't being a coward it's more ""is my career worth it?"""
3837,2020-12-30 21:35:39,kn2pmm,"He put out two of his best albums after the VMAs, and that was even fairly in character for Kanye at the time."
3838,2020-12-30 17:54:11,kn2pmm,"i think if you look at the trends, a lot of things kanye does are ""ahead of his time"" and appreciated later. POTUS seems like a stretch though lol"
3839,2020-12-30 22:27:26,kn2pmm,"They said he couldn’t rap, and he became the best selling rapper in our generation.
They said he couldn’t make clothing, and his own brand has made him a Billionaire. 
He clearly can follow through, maybe not absolutely everything, but these are 2 enormous examples that he can."
3840,2020-12-30 20:22:01,kn2pmm,Lil wayne was on all that rocker bullshit in like 2011 tho...
3841,2020-12-30 20:44:29,kn2pmm,I don't think that was really a hot take in 2013
3842,2020-12-31 22:07:28,kn2pmm,"Nike or Adidas don't fucking own the fucking factories numbnuts, they contract out the work to local factories  where its cheapest. Your  fucking assumption could have been easily checked with a simple google search."
3843,2020-12-30 17:21:57,kn2pmm,If he's an artist why does he need distribution to create great art?
3844,2020-12-30 21:36:38,kn2pmm,"didn't he go broke at some point and receive millions of dollars from Jay-Z? this interview was probably during this time

from Kanye, there's ""'Cause if Jay a billionaire then I'ma never go broke"" from Saint Pablo.

from Jay-Z, there's ""But you got hurt because you did cool by 'Ye
You gave him twenty million without blinkin'
He gave you twenty minutes on stage, fuck was he thinkin'?"" from Kill Jay-Z"
3845,2020-12-30 17:30:36,kn2pmm,not really
3846,2020-12-30 18:37:41,kn2pmm,"unfortunately not the one im looking for, this song samples it in full pretty much upto Walt Disney, just wish I could for the life of me remember the song!"
3847,2020-12-30 23:48:08,kn2pmm,"Well damn, gotta downvote myself now"
3848,2020-12-30 16:30:26,kn2pmm,"How is it over-inflated if everything Kanye has ever said he will do he has done, and everything he has ever aspired to do he has been very successful at. 

It’s not egotistical to call yourself the best or to believe that you’re the best when you are."
3849,2020-12-30 18:21:16,kn2pmm,"Something I noticed in the letterman interview, when he was talking about his mom, growing up, and his past, he was really personal and looked at Dave directly and was generally very warm. It felt very human and normal. The second Dave brought up trump he started looking at the audience like he was making some sort of grand statement about the world and politics. It was weird like the second he needs to project something, namely something he’s facing pushback on, he shifts his body language away from the interviewer but when it’s about his experiences he’s more conversational. Happens here too about the fashion industry that he had been boxed out of at the time"
3850,2020-12-30 18:13:08,kn2pmm,"Yeah, I get that there’s definitely a lot of mental illness in there, and he was probably frustrated that whatever point he was trying to make wasn’t hitting, but it’s just a personal pet peeve of mine when people are going off but they’re looking at someone else/something else. It’s like motherfucker, don’t yell at me and say the shit you’re saying while also not saying it to me. 

It wasn’t even a tense environment until Kanye made it tense anyways."
3851,2020-12-30 18:18:46,kn2pmm,"Charl: Cause I think Yeezus was trash, it was straight garbage

Kanye: ""okay"" (Smiles)"
3852,2020-12-30 19:11:09,kn2pmm,This the type of shit people say to sound contrarian for no reason
3853,2020-12-30 20:12:28,kn2pmm,I agree. Ignore the haters
3854,2020-12-30 22:27:58,kn2pmm,Agreed but just because of my love for it's industrial sound.
3855,2020-12-30 18:37:24,kn2pmm,Lmao not by a mile
3856,2020-12-30 19:56:43,kn2pmm,Reddit moment right here
3857,2020-12-30 23:03:26,kn2pmm,"It's definitely my favorite, but best is debatable"
3858,2020-12-30 19:19:36,kn2pmm,It's a no from me dawg.
3859,2020-12-30 22:58:23,kn2pmm,"Yeezus is definetely New Kanye. New Kanye doesn't mean when he went from good to shit, it's when he stopped the classic stuff around MBDTF/WTT and started going super experimental/fashion focus and eventually sorta safe with the Christian albums."
3860,2020-12-31 00:42:45,kn2pmm,"I mean yeah before College Dropout, I'm sure people were telling Kanye to give up all the time. That's the story of like every famous person. And the Yeezy brand is a huge success I'll give him that. But, to act like Kanye follows through on most things is just wrong. There are like 7 different announced albums that haven't come out. How many times has he said an album's coming out this Friday and that hasn't' happened? Kanye has a huge ego that makes him think he can do anything when in reality he should just stick to what he's good at."
3861,2020-12-31 22:35:53,kn2pmm,"Wow you're unintelligent. Not only did you have the audacity to try and correct me, but you did it with wrong information. Yes, that's true in many markets these companies do contract out the work. BUT they can negotiate better terms because of volume and scale. The cost of production that Adidas has VS an individual entity like Kanye is an astronomical difference. 

But I'm assuming you're someone that has never even attempted to manufacture something in mass and are just speaking out of your fucking ass. As someone who HAS manufactured products en masse, you are in direct competition with corporations OVER those factories and so your rates are too high for your costs to make sense. In order to recoupe that cost you need to sell your products at a premium which Kanye did NOT want to do ""numbnuts"". He wanted his products to be accessible and affordable."
3862,2020-12-30 17:24:05,kn2pmm,"Huh?? 

Nobody gives a fuck about your clothes if no one can see them or buy them. You need distribution to move your products. That’s business 101."
3863,2020-12-30 17:49:29,kn2pmm,"What are you even talking about, man? Pictures of clothes don't do shit if you want to be a brand. You need distribution to actually make and send shoes around the world to sell. Without distribution, kanye is just 1 pair of shoes at his house"
3864,2020-12-30 20:01:19,kn2pmm,He’s not just trying to create clothes. He’s trying to make a clothing brand.
3865,2020-12-30 18:25:22,kn2pmm,What doesn't make sense. He says he doesn't have the money for what he wants to do and needs investors. What's so hard to understand about that?
3866,2020-12-30 16:41:17,kn2pmm,I'm still waiting for all of this to be materialized https://img.thedailybeast.com/image/upload/v1492119803/articles/2016/02/15/inside-donda-kanye-west-s-plan-to-rule-the-world-and-save-his-bank-account/161214-stern-kanye-donda-embed_f7dokr.jpg
3867,2020-12-30 16:58:42,kn2pmm,"Lol it is. You can be the best and not be egotistical, it’s called being humble."
3868,2020-12-30 17:05:35,kn2pmm,"\>  How is it over-inflated if everything Kanye has ever said he will do he has done 

&#x200B;

Yeah, who would have thought Kanye would win the 2020 election..."
3869,2020-12-30 22:56:52,kn2pmm,**That's great**
3870,2020-12-30 20:47:57,kn2pmm,[deleted]
3871,2020-12-30 23:08:59,kn2pmm,Yeah. That’s how I see his career too.
3872,2020-12-31 22:37:47,kn2pmm,"Nice paragraph of entirely a strawman. Nike and Adidas don’t own the factories where their items are produced. That’s a simple, undeniable fact, no amount of you straw-Manning will change that. You are really fucking dumb. Just learn to read."
3873,2020-12-30 17:25:03,kn2pmm,"He's screaming artist, not businessman. Art doesn't need distribution"
3874,2020-12-30 17:59:17,kn2pmm,That's art. Art doesn't need distribution. Making money needs distribution
3875,2020-12-30 22:26:17,kn2pmm,Capitalism without capital.
3876,2020-12-30 17:17:02,kn2pmm,dude you'd be surprised but a lot of it actually has even the hologram lol
3877,2020-12-30 17:27:39,kn2pmm,He has done a surprising amount of the things on this list already. And he’s not even close to finish. He’s in his 40s.
3878,2020-12-30 17:26:05,kn2pmm,There’s nothing wrong with calling yourself the best. If his being proud of himself offends you I think that speaks volumes about who you are more than it does him.
3879,2020-12-31 22:40:39,kn2pmm,They do own the factories because they control what those factories produce and anyone attempting to also utilize said factories competes with these corporations at rates they cannot possibly afford. Nothing of what you just said addressed anything of which I just disproved you with. Talk about a strawman.
3880,2020-12-30 17:29:25,kn2pmm,Do you know what record labels do?
3881,2020-12-30 17:57:13,kn2pmm,"So fast forward to 2020, Kanye was right and is now a billionaire. Just sayin."
3882,2020-12-30 17:27:37,kn2pmm,Oh jesus
3883,2020-12-30 18:03:27,kn2pmm,oh baby what is you doing
3884,2020-12-30 17:30:26,kn2pmm,You still have time to delete this comment before more people see it and rip you to fucking shreds
3885,2020-12-30 18:32:44,kn2pmm,"You my friend, are a dumbass. If the art requires multiple people to see it for the experience, then it needs distribution. Video games are art, but theyre interactive modes of art and require people to play them to be experienced, and for people to experience them you need to DISTRIBUTE it to those people (yes, even if it's given out for free and no money is made). Books are art, but they're interactive and need to be read to be experienced. In order to read a book, one needs to be DISTRIBUTED to you. Music is art, but in order to experience it, the song has to be DISTRIBUTED to you. Even posting a picture online is distribution. Have you ever in your life worked in anything related to the art world or do you just like making up opinions in your free time?"
3886,2020-12-30 18:21:33,kn2pmm,People still stan ye like this in 2020? gross lol
3887,2020-12-30 17:36:08,kn2pmm,This video is more than ‘being proud of himself’ it’s him imposing his superiority complex on someone in an unpleasant way. You can explain why you’re proud of your accomplishments without demeaning others like he is here.
3888,2020-12-31 22:42:22,kn2pmm,"No, by definition they don't own the factories. If you don't understand the difference then you really are a dumb fuck. You realize literally all Ive said is that they don't own the factories- which they don't. I have not even said a single other thing. Keep tryign to do mental gymnastics. They don't own the factories. Get that through your thick fucking skull. I never made an argument about whether Kanye could feasibly do the same by himself. Learn to read you imbecile."
3889,2020-12-30 17:39:42,kn2pmm,"He has this level of distribution. He's got record label deals.

Also you're talking about the business of art. He's just screaming about wanting to be able to create good art. 

Banksy creates great art without distribution. If he wants to make money that's fine, but then it's just different than talking about wanting to be an artist. He wants to be a business man then."
3890,2020-12-30 17:39:47,kn2pmm,That's ok
3891,2020-12-30 18:49:25,kn2pmm,"dude dont bother with guy, some people are and always will be daft as fuck."
3892,2020-12-30 21:47:37,kn2pmm,LOL this is exactly how the convo Sway and Kanye have in this interview goes
3893,2020-12-30 18:40:17,kn2pmm,"Banksy.

Yes I mean paid distribution that requires the shitloads of money he's asking for. He can get free distribution via the Internet like you said."
3894,2020-12-31 22:44:04,kn2pmm,You're arguing semantics of words instead of the actual argument. You're an idiot. Not going to argue with someone who hasn't even done what they are arguing for. Peace.
3895,2020-12-30 17:42:09,kn2pmm,"Record labels do not distribute clothing. Do you know how much money and resources it takes to produce and distribute a clothing brand on a global or even national scale? 

He didn’t want to be Kanyewest.com he wanted to be Louis Vuitton. And with the help of Adidas who gave him the distribution channels and infrastructure he needed, now he is."
3896,2020-12-30 18:47:42,kn2pmm,"Okay #1. ""Banksy"" is not some end-all-be-all counter argument to this. You know why we even know about him? Because other people distribute his work to us when they find it on walls. Also....just no. Banksy is about the most specific and ""not-like-how-the-ENTIRE-rest-of-the-art-world-works"" example you could have possibly found. That's like, a super-strawman. 

And then why did you never say that in your other comments? ANYWAYS that point is wrong too. How do you suggest I send you a handbag over the internet? Art that's meant for an audience requires an audience and different art mediums require different money investments to start out, and high end fashion is like, one of the top 3 most expensive ones. That's why we don't see an abundance of soundcloud IMAX filmmakers like we do rappers. Because some art actually requires money to get off the ground....I can't actually believe I have to explain this concept"
