,Timestamp,SubmissionID,Comment
1263,2020-06-27 15:53:27,hg7rbq,"Yeah I honestly can’t see it going much lower. I’d watch over the weekend and if it dips any over the weekend it’ll probably dip more on Monday and would be a good time to pick it up just in my opinion. I would imagine it’ll be an online and in store retail. 

As for Kim she’s always very supportive of Kanye and 100% will be wearing yzy gap at least a couple times out in public. 

I also found this which has some good details of the deal. One important thing is that Kanye is the sole owner of the Yeezy brand.

https://i.imgur.com/QvfarMh.jpg"
1264,2020-06-27 11:12:02,hg7rbq,Nah dude it’s not adidas clothes. Yeezy is partnered with adidas pretty much for distribution and media purposes. It seems like it’s the same way with gap. I think you should look more into the business model adidas has nothing to do with this
1265,2020-06-27 18:26:04,hg7rbq,Oh true I guess ye does have some stand alone clothes on his own line and they are cool and in style. I'm super curious from a consumer stand point to see what the styles look like and if it will fit the bill of GAP at all lol. Some of his designs are way out there and not traditional in any sense of the word
1266,2020-06-26 13:21:03,hg7e4u,It's his Yeezy x Gap collab that's why he's back
1267,2020-06-26 14:01:34,hg7bu6,It seems like this would downgrade the Yeezy brand.
1268,2020-06-26 15:16:20,hg7bu6,"'Let's go back, back to the Gap
Look at my check—wasn't no scratch
So if I stole, wasn't my fault
Yeah, I stole—never got caught'


The irony!"
1269,2020-06-26 13:20:12,hg7bu6,Kanye cant lose. Time to yolo
1270,2020-06-26 16:30:49,hg7bu6,"A lot of GAP hater on this thread. I would agree that their mall stores are becoming increasingly irrelevant, but they also own Athleta, Jack and Jane and Old Navy among other brands not based out of failing malls. And of anyone can raise retail from the dead....its Yeezus."
1271,2020-06-26 16:02:27,hg7bu6," Oh, now they love Kanye, ""Let's put him all in the front of the store"""
1272,2020-06-26 14:26:09,hg7bu6,JESUS GEAR WILL BE SOLD AT THE GAP
1273,2020-06-26 13:47:14,hg7bu6,[deleted]
1274,2020-06-26 14:26:35,hg7bu6,[deleted]
1275,2020-06-26 13:19:31,hg7bu6,"You son of a bitch, I'm in"
1276,2020-06-26 15:10:37,hg7bu6,Gap is still in business?
1277,2020-06-26 13:51:21,hg7bu6,Wouldnt it be smart to buy puts after the stark surge?
1278,2020-06-26 13:19:56,hg7bu6,Loading up let’s gooooooo
1279,2020-06-26 14:41:25,hg7bu6,TIME TO YOLO THIS TILL IT HITS $20
1280,2020-06-26 13:41:47,hg7bu6,"Thank you, Kanye. Very cool!"
1281,2020-06-26 15:52:40,hg7bu6,"Looks like shorting is back on the menu, bois!!"
1282,2020-06-26 18:38:41,hg7bu6,"Wait until Monday morning, it might spike again. If it does, I’m probably going to double down on puts."
1283,2020-06-26 14:20:34,hg7bu6,20c  7/17
1284,2020-06-26 14:28:57,hg7bu6,Does anyone really expect Kanye to stick with a 10-year deal? He seems like the kind of guy who tweets about how Pepsi is the best one minute and Coca Cola is the only thing he drinks the next.
1285,2020-06-26 14:02:04,hg7bu6,Appreciate the post. Wouldn't have seen this otherwise.
1286,2020-06-26 14:34:39,hg7bu6,Buy the dip 🙃
1287,2020-06-26 14:38:18,hg7bu6,Hope you sold!
1288,2020-06-26 15:21:35,hg7bu6,Purses for the new bagholders
1289,2020-06-26 18:45:40,hg7bu6,"buy calls, this will spike again when more normies find out"
1290,2020-06-26 14:32:37,hg7bu6,Definitely not too late I just jumped in and am up already
1291,2020-06-26 15:33:30,hg7bu6,Time to buy puts!
1292,2020-06-26 17:30:42,hg7bu6,And there she drills
1293,2020-06-26 14:09:54,hg7bu6,"Yeah but the success with Yeezy is the shoes, not the clothes.  Doesn’t seem like that great of a deal to me.  “Premium” brand at the gap?  Adidas sells clothes but he makes the deal with GAP?"
1294,2020-06-26 17:13:13,hg7bu6,"I really like the long term prospects here.  This is a brand changing partnership.  I think buy and hold is the move here or 1/2022 calls.  Gap is already at a discount because of Corona, if this clothing line is successful they got Kanye locked up for 10 years."
1295,2020-06-26 15:04:50,hg7bu6,"Got 32 $12 calls at $0.10  
""I ain't gay anymore,"" I say."
1296,2020-06-26 16:55:35,hg7bu6,GAP —> Gay and Proud —> Gay bears —> PUTS
1297,2020-06-26 18:53:45,hg7bu6,Kanye just jumped the shark
1298,2020-06-26 19:37:32,hg7bu6,Calls. His celebrity circle and many more will endorse and supoort and school kids will replicate. And they will check out other stuff from the store if it looks good.  After that GAP will be cool again and ppl my age will talk about how they wore GAP when they were kids and do it for nostalgia even tho they havent worn it after 2013. My friends said they will cop if it looks good. And it's all gonna be under $100. Look at his twitter and the trending.
1299,2020-06-26 20:41:15,hg7bu6,This was big brain move for ye. He collects millions off a desperate dying business that will more than likely be dead in a year. Then he’ll just go back to doing whatever he wants with yeezy
1300,2020-06-26 13:39:50,hg7bu6,"How far would we expect to this run? Looks like a decent run already, don’t want to FOMO and lose."
1301,2020-06-26 15:22:04,hg7bu6,"Load up on puts, one is a fad that ended years ago and the other makes shit clothes that employs a headache inducing font"
1302,2020-06-26 13:13:10,hg7bu6,"This post was flaired as DD so it's on the DD list. [Find more fresh WSB DD here.](https://ns.reddit.com/r/wallstreetbets/search?sort=new&q=flair%3ADD&restrict_sr=on&t=da)

Hey /u/wingless123 don't misuse DD flair. No shitposts, short and vague guesses, links as DD, etc. DD is for wall-of-text deep-dive Pepe Silvia shit. Please change the flair if this isn't DD. Mods have been notified of this thread.

[Submission Flair Guide](https://www.reddit.com/r/wallstreetbets/wiki/linkflair)

*I am a bot, and this action was performed automatically. Please [contact the moderators of this subreddit](/message/compose/?to=/r/wallstreetbets) if you have any questions or concerns.*"
1303,2020-06-26 13:37:34,hg7bu6,In thanks
1304,2020-06-26 14:41:35,hg7bu6,Did anyone catch that open options were frozen for GAP for 3 minutes at the open. When it opened I was throwing random sells to figure out why its not trading- then it opened and ofc my cousin  randomly called my cellphone causing my app to freeze and sell at a stupid low price just as I was raising my sell from $1.50 to 2 .FML 12c 7/17. Pissed. It hit 3$ high.
1305,2020-06-26 14:44:07,hg7bu6,"Holy fuck here we go this is kinda nuts lol
62M volume yeesus

65Mil now"
1306,2020-06-26 14:53:20,hg7bu6,"It’s cause he used to work there, and smoke blunts in the mall when he wrote his raps on break. 

GAP Calls."
1307,2020-06-26 15:38:02,hg7bu6,LOLOLOL
1308,2020-06-26 18:20:02,hg7bu6,all in zumiez calls
1309,2020-06-26 18:39:27,hg7bu6,yeezy kicks for $24.99
1310,2020-06-26 21:07:02,hg7bu6,Good boy. Treat Kanye
1311,2020-06-26 22:07:43,hg7bu6,"Gayfish

And

Proud"
1312,2020-06-27 01:19:43,hg7bu6,Yeah time to short GAP
1313,2020-06-27 02:12:40,hg7bu6,This will rally next week if SPY isn't a little bitch. Hopefully we see a PT upgrade soon.
1314,2020-06-27 03:07:58,hg7bu6,"Unless the price goes negative like oil futures, i will never buy a pair of yeezeys. Two years ago a relative gifted me a pair, i took them straight to goodwill and dropped them off.  Then i went and bought a new copy of All I Feel."
1315,2020-06-27 04:22:13,hg7bu6,"That's not the best moment, I heard an analyst say we'll stop wearing clothes."
1316,2020-06-27 04:49:48,hg7bu6,Gap won’t even last 10 years. puts on everything
1317,2020-06-27 05:41:03,hg7bu6,These clothes will be awful I'm sure
1318,2020-06-27 19:28:01,hg7bu6,Lmfao so GAP did a yolo on Kanye
1319,2020-06-27 21:59:33,hg7bu6,I thought Gap was the poor people store?
1320,2020-06-28 03:56:40,hg7bu6,Can’t pay rent how they gonna pay Yeezus
1321,2020-06-26 13:59:55,hg7bu6,[deleted]
1322,2020-06-26 14:08:14,hg7bu6,This is perfect because the Gap makes trash and Kanye is trash.
1323,2020-06-26 17:39:52,hg7bu6,"Irrelevant, overvalued artist, irrelevant overvalued brand."
1324,2020-06-26 13:25:34,hg7bu6,Check out my post from this AM. Already in. Let’s go
1325,2020-06-26 20:34:12,hg7bu6,"If you watch his interviews, he actually has talked for years about making stuff that people can afford. Despite the dumb shit he says and the media’s portrayal of him, he’s a brilliant person and while he has a big ego he’s really not a bad guy."
1326,2020-06-26 21:11:50,hg7bu6,"Nothing can save the gap,  yeezy only cares about passing up his porn star wife on the forbes."
1327,2020-06-27 01:57:58,hg7bu6,Great. Two things I don’t like together. Easy to avoid.
1328,2020-06-26 13:28:45,hg7bu6,How do you get options before open?
1329,2020-06-26 21:38:32,hg7bu6,Ill never buy my kids GAP again.
1330,2020-06-26 17:53:09,hg7bu6,When I woke up this morning I never would have thought I'd be thanking god for Kanye West before I went back to sleep tonight. My Gap calls printed because of that  jackass.
1331,2020-06-26 16:09:21,hg7bu6,"I really don’t think Kanye understands the way the hype that drives his own brand works. He keeps talking about how he wants everyone in the world to be able to own a pair of Yeezys and now he’s partnering with a budget brand for herbs. 

People want what’s exclusive and hard to get. A lot of his designs are borderline avant-garde and only fly because the hype factor. Nobody is buying his insane backwards rain boots if they’re sitting on shelves at the fucking Gap."
1332,2020-06-26 14:30:44,hg7bu6,For sure.  Gap is broke AF.  Lots of the celebrity lines do okay at lower dollar big box stores but I'd be very surprised if Yeezy is able to salvage a store that hasn't been relevant in a decade.  He's selling a life style and brand that is antithetical to the Gap and the kind of people who shop there and at the end of the day I feel like the kids would prefer used Supreme shit over the sweet Yeezy hoodie mom picked up on sale from the most boomer store ever.
1333,2020-06-26 14:38:38,hg7bu6,[deleted]
1334,2020-06-26 15:59:33,hg7bu6,fun fact Kanye used to work at GAP
1335,2020-06-26 17:05:48,hg7bu6," **Hello, hello, hello, hello, white America, assassinate my character** \- YEEZY"
1336,2020-06-26 16:57:00,hg7bu6,[deleted]
1337,2020-06-26 20:14:46,hg7bu6,"He managed to make Champion popular and that wasn’t even his. 

I remember when that shit was like $5 at Walmart. Now it’s hype? Lol"
1338,2020-06-26 16:55:16,hg7bu6,Yeezy brand is untouchable. This upgrades GAP brand.
1339,2020-06-26 15:09:23,hg7bu6,Wasn’t Kanye’s goal to have a similar model to TSLA? I thought Yeezy was supposed to be his attack on high priced designer brands.
1340,2020-06-27 00:17:58,hg7bu6,"It sure does but if they paid him enough then it’s worth it. Shit he’s already built it up, might as well milk it now and then sell it outright. He’ll be way richer and have to do zero work from then on."
1341,2020-06-26 15:09:47,hg7bu6,seems like this would downgrade the gap brand
1342,2020-06-26 17:59:57,hg7bu6,https://www.youtube.com/watch?v=vQ0u09mFodw&feature=youtu.be&t=185
1343,2020-06-26 23:54:54,hg7bu6,Keep in mind Old Navy is breaking off into its own company separate from GAP sometime soon.
1344,2020-06-26 17:19:02,hg7bu6,poopity scoop
1345,2020-06-26 14:10:14,hg7bu6,....1000%? What strike and expiry did you get and at what's your average price?
1346,2020-06-26 13:53:36,hg7bu6,You belong here
1347,2020-06-26 17:29:19,hg7bu6,It went to shit huh
1348,2020-06-26 15:08:50,hg7bu6,"I already started buying puts, look at the chart for Gap and they hardly ever sustain a run, this will be $11 again by Wednesday"
1349,2020-06-26 15:02:40,hg7bu6,😂
1350,2020-06-26 17:08:35,hg7bu6,7/10 12 P lets go
1351,2020-06-26 16:44:18,hg7bu6,[deleted]
1352,2020-06-26 17:38:10,hg7bu6,Aged like milk
1353,2020-06-26 17:08:46,hg7bu6,Buy puts and watch your money print.
1354,2020-06-26 13:52:20,hg7bu6,"No bc it’s Kanye west, do you know how big yeezy brands are??"
1355,2020-06-26 17:08:15,hg7bu6,"You’re either ballsy, stupid, or both."
1356,2020-06-26 17:49:19,hg7bu6,he sticks with tweeting in such a manner for at least 10 years tho
1357,2020-06-26 13:51:24,hg7bu6,"i dont know dude, if i do i wouldve been a millionaire"
1358,2020-06-26 17:10:05,hg7bu6,I bought $12 puts expiring Aug 07.
1359,2020-06-26 15:47:43,hg7bu6,i saw this too was so confused...... said my max loss was $0 i was about to pull trigger wouldve made more $$
1360,2020-06-26 22:26:55,hg7bu6,the real worth of these shoes
1361,2020-06-26 14:06:02,hg7bu6,Then you don't know too much about fashion in general. Kanye turned Adidas into the brand every artist tries to work with now to put out an exclusive shoe that they will sell out with a price tag higher than most pairs of Jordans. I doubt very seriously you understand what you are talking about.
1362,2020-06-26 16:10:32,hg7bu6,"Wise decision, letting emotions and personal biases get in the way of investments. The Yeezy brand is worth $3 billion FYI."
1363,2020-06-26 15:13:59,hg7bu6,"ah, true, but so are consumers"
1364,2020-06-26 13:38:40,hg7bu6,This idiot posted his play from YESTERDAY this morning 30 min before market open.  Worthless advice and no positions.
1365,2020-06-27 05:41:44,hg7bu6,Ok boomer
1366,2020-06-26 13:37:06,hg7bu6,Dont trade with robinhood and have money.
1367,2020-06-26 13:37:10,hg7bu6,Dear god
1368,2020-06-26 14:38:50,hg7bu6,Ya don't
1369,2020-06-26 18:59:03,hg7bu6,"He’s selling basics. Tees, hoodies, joggers. And they will buy that shit off of mall shelves just how they do all Yeezys even after they went to extremely exclusive to being what are deemed general releases, ie the malls get them."
1370,2020-06-26 15:11:56,hg7bu6,They started going downhill 15+ years ago. Every GAP I've seen has downsized in a mall or closed their doors
1371,2020-06-26 16:08:43,hg7bu6,My heart aches for gap lol. Them/banana are the only cheaper and affordable tall men's clothing stores that fit me relatively well. Need them to stay alive haha.
1372,2020-06-26 16:37:18,hg7bu6,Maybe. But I think I you're underestimating the yeezy hype. Trust GAP made a smart move
1373,2020-06-26 14:39:04,hg7bu6,Not sure what their total sales overseas are but for some reason GAP is quite popular in Asia at least
1374,2020-06-26 16:37:35,hg7bu6,"I think you underestimate the Yeezy stans, this stuff will definitely sell. I think he’s trying to emulate what Jerry Lorenzo does with Fear of God x PacSun. I personally won’t be buying any of this but I am sure many people will especially if it’s affordable. I don’t think this will salvage GAP as a whole, however."
1375,2020-06-26 16:48:20,hg7bu6,He’s been rocking pink gap polos since they thought it would hurt the rap game.
1376,2020-06-26 18:51:01,hg7bu6,"Thinking this over, I got to agree. Even though Gap's stock surged, like, %42 immediately after this was announced, I really think the hype over it is going to seriously wear off by 2021, which is when the line releases. Especially if it doesn't stand out and just looks like regular Gap clothes, and from the [one picture that Ye revealed of it](https://twitter.com/kanyewest/status/1276462079625445382), I'm not that confident."
1377,2020-06-27 01:25:39,hg7bu6,"If idiots can decide that champion is suddenly a cool fashionable brand logo, they can do the same with gap"
1378,2020-06-26 19:56:41,hg7bu6,Gap was pretty huge in the 90s. Brands like Champion (poor kids sweaters) and Ray-Bans ($20 gas station glasses) used to be struggling and now are extremely popular brands and now fucking expensive. You never really know with fashion.
1379,2020-06-26 17:25:55,hg7bu6,"Nah, he's going to turn GAP around. GAP is a super small / irrelevant brand right now, and I bet they are giving Kanye a lot of power. I bet it's a huge success story. (Like Apple's turn-around in the 90's)."
1380,2020-06-26 19:09:28,hg7bu6,Um GAP is up and coming. They're like the Phoenix rising. Just how phanny packs are cool again. GAP is the official clothing brand of MAGA.
1381,2020-06-26 14:40:53,hg7bu6,It's the Gap.
1382,2020-06-26 15:57:13,hg7bu6,"But Kim comes in and demands more Brrrrr, so he has to massive produce ugly wave."
1383,2020-06-26 15:18:42,hg7bu6,Isn't that what h&m and target does too? Collaboration with a designer in hyper limited runs. Shit usually goes out the door in seconds.
1384,2020-06-26 16:45:38,hg7bu6,Spaceship
1385,2020-06-26 17:07:31,hg7bu6,lets go back back to the GAP
1386,2020-06-26 18:07:57,hg7bu6,I would buy an ugly sweater from him.
1387,2020-06-26 17:47:34,hg7bu6,I'd vote for him
1388,2020-06-26 17:01:58,hg7bu6,How? GAP is fucked. This is a ray of hope for them
1389,2020-06-26 18:49:59,hg7bu6,Best outro of any song ever
1390,2020-06-27 00:33:31,hg7bu6,"Fake news since Jan. 

https://www.cnbc.com/2020/01/16/gap-shares-jump-on-announcement-it-will-not-spin-off-old-navy.html"
1391,2020-06-26 18:33:41,hg7bu6,https://www.youtube.com/watch?v=E6sUU2wrrKs
1392,2020-08-27 20:32:57,hg7bu6,Lol
1393,2020-06-26 17:06:35,hg7bu6,"I bought a $12 put and made it a month and a half out to be on the safe side. Gap will definitely go down, but with all the trend shoppers in RobinHood, it’s not unlikely to think it will rise more next week."
1394,2020-06-26 13:53:45,hg7bu6,So you would still fomo...?
1395,2020-06-27 05:40:33,hg7bu6,"Idiotic, 1000 IQ, Cosmic Bolls ( Only holding til 10 d tho )"
1396,2020-06-26 14:09:14,hg7bu6,Yeah I missed out fuck my ass
1397,2020-06-26 14:19:03,hg7bu6,You don’t find it weird that this is a deal with Gap and not Adidas?
1398,2020-06-26 16:13:48,hg7bu6,"I trade industrials and pharmaceuticals (it’s not going well), was just shitting on Kanye and the Gap because every gap product I’ve ever owned has disintegrated within months. Maybe I need to read the care instructions."
1399,2020-06-26 15:31:20,hg7bu6,"Disagree I will post DD, Kanye cool thanks for coming to ted talk"
1400,2020-06-26 13:48:16,hg7bu6,"Wow, do you need to be spoon fed everything?"
1401,2020-06-26 13:43:29,hg7bu6,I have 1k liquid. What should I trade with?
1402,2020-06-26 20:15:25,hg7bu6,The store you sell in definitely matters. Off White and Louis Vuitton wouldn’t be what they are if they sold at JC Penny. You can’t be a two-tier brand that sells hype-wear and also sells basics at The Gap. You’re going to lower the profile of the brand if you’re selling alongside Tony Hawk and Adam Levine.
1403,2020-06-26 17:01:32,hg7bu6,"They're not gonna sell the shit at Gap, they just closed down their overpriced male athletic brand B-corp while keeping the female equivalent. How much you want to bet they revive a similar thing as a for profit enterprise and use it to bring relevance to their online platform?"
1404,2020-06-26 16:21:21,hg7bu6,"Same, their khakis/chinos are super nice imo and are the only pants that I’ve ever thought fit me perfectly"
1405,2020-06-26 17:28:42,hg7bu6,"Banana is the shit yo. Comfy ass clothes that fit well, look good, and last a long time."
1406,2020-06-26 18:15:01,hg7bu6,"As someone who is 6’3” with a 32” waist, I don’t agree at all. I don’t own anything from the Gap. 

Just go to Target. Their stuff is of equal or better quality and is cheaper. Amazon shopping online with free returns is easy. Uniqlo is perfect for us. 

🤷‍♂️"
1407,2020-06-26 17:28:29,hg7bu6,Eddie Bauer carries talls
1408,2020-06-26 19:14:15,hg7bu6,RW and Co bro.  Although we almost lost them to bankruptcy
1409,2020-06-29 20:16:14,hg7bu6,Marks and Spencer FTW!
1410,2020-06-26 21:04:13,hg7bu6,Europe too
1411,2020-06-27 05:37:41,hg7bu6,"You mite be out of loop with the fashion these days lol 

( Gap / Kanye both no )"
1412,2020-06-27 14:45:37,hg7bu6,Champion doesn't have hundreds of shitty leases in dying malls.
1413,2020-06-26 14:50:27,hg7bu6,[thats why i  gotta charge the prices that i charrrge](https://www.youtube.com/watch?v=nxIvg0y6vCY)
1414,2020-06-26 14:54:01,hg7bu6,So fucking what??
1415,2020-06-26 17:58:50,hg7bu6,"Have you ever seen the videos of the riots at Herald Square H&M for their Balmain collaboration? 

People want to be able to say they have the label and hope there are no follow up questions"
1416,2020-06-26 20:01:58,hg7bu6,Let’s not get crazy
1417,2020-06-26 18:25:55,hg7bu6,cuz kanye is the biggest fucking tool i can name
1418,2020-06-26 19:33:17,hg7bu6,Runaway has questions
1419,2020-06-27 00:36:14,hg7bu6,"Oh shit lol no way, my bad never saw the news"
1420,2020-06-26 17:33:42,hg7bu6,[deleted]
1421,2020-06-26 18:30:10,hg7bu6,It already hit under $12.00 today. If I get 50% gains today I'll burn a day trade and then rebuy puts if it bounces Monday
1422,2020-08-27 20:33:20,hg7bu6,Lol
1423,2020-06-26 13:54:08,hg7bu6,I posted this... I got in already bro
1424,2020-06-26 14:19:32,hg7bu6,Not too late
1425,2020-06-26 14:28:39,hg7bu6,"No, because the ""clothing  line"" is with GAP the Shoe line is still with Adidas."
1426,2020-06-26 14:29:52,hg7bu6,"No because Adidas only manufactures Yeezy shoes, all Yeezy clothing has been independent until now."
1427,2020-06-26 14:11:36,hg7bu6,No shit man
1428,2020-06-26 13:45:44,hg7bu6,"I think what he’s trying to stay is don’t trade... like at all... if you want to deal with highly leveraged derivatives without understanding something complex like *the hours they trade* lmao. Take it, it’s sound advice"
1429,2020-06-26 13:45:07,hg7bu6,robinhood or webull also the guy below me has decent advice.
1430,2020-06-27 05:43:22,hg7bu6,"Built his brand to nearly 3 bill, commenter on Reddit  ' I don't think he knows what he's doing or understands how his business works ' 

LOL"
1431,2020-06-26 17:27:47,hg7bu6,"This. 

Gap is not cheap. Their clothes are mad expensive for being an upperclass Walmart brand."
1432,2020-06-26 17:14:27,hg7bu6,They need to quit acting like rugby stripes and gap logo hoodies are fresh.
1433,2020-06-26 18:31:52,hg7bu6,"Uniqlo quality has always been terrible for me. Like, lasts several washes terrible. 

Target just doesn't fit me well. I'm 6'5 and 250 with a regular inseam of 34 (long torso) and for some reason only gap/banana chinos fit well.  Don't shop for clothes at Amazon so I can't compare."
1434,2020-06-26 17:29:40,hg7bu6,they've stopped credit card returns and only returned for store credit. not about that.
1435,2020-06-26 19:17:45,hg7bu6,Never heard of em. Will look it up thx
1436,2020-06-26 15:09:29,hg7bu6,i will not let my family starve.
1437,2020-06-26 15:42:38,hg7bu6,"You're comparing Adidas and Supreme to the Gap.  

Even if this line sells out - do you think that's worth a 30% bump?  Consider the headwinds from Corona and the fact that every single retailer is offering massive sales right now to clear inventory.  Nordstrom Rack is offering 40% off everything in their stores (Seriously go if you have one near you)- why the fuck would you go to the Gap?"
1438,2020-06-26 18:34:01,hg7bu6,Well you’re right up there then. Regardless of what you think of him personally this is good for GAP.
1439,2020-06-26 19:37:56,hg7bu6,Come on frank ocean puts new slaves over the top.
1440,2020-06-26 17:39:20,hg7bu6,Anyone who bought calls at all this week is fucked. It’s been a brutal ride.
1441,2020-06-26 13:57:50,hg7bu6,"Yeah sure congrats bro and fuck you

Dont you think there will be a pullback after all the fomoing?"
1442,2020-06-26 14:34:41,hg7bu6,"He pretty much turned adidas around, they saw what he was capable of bringing in, why wouldn’t adidas want the clothes"
1443,2020-06-26 14:33:44,hg7bu6,"Yeah I know, but adidas makes clothes as well, why wouldn’t he run with them?"
1444,2020-06-26 20:26:50,hg7bu6,Gap is hella cheap. They always issue 40% off coupons sometimes you gotta wait a week or two. They got great prices and quality is good. I buy all my clothes from there. They definitely arent trending but that's clothes are. Out with the old in with the new. It will be the same with Lulumone a few years down the line. Something new always will come
1445,2020-06-27 03:08:26,hg7bu6,Rugby stripes are still fresh if you can pull off that pre 2000's look
1446,2020-06-27 04:55:01,hg7bu6,"You don’t know how to wash clothes. I’ve got Uniqlo oxford shirts and heat tech undershirts that are 4-8 years old.

Wash on cold and dry on low, or better yet hang dry. Dryers destroy clothes."
1447,2020-06-26 20:15:17,hg7bu6,I'm into Mavi pants. Great fit for my long legs and thicc thighs. Pretty durable too.
1448,2020-06-26 20:51:44,hg7bu6,"That sucks shit, I'm all about ""renting"" clothes."
1449,2020-06-26 21:39:05,hg7bu6,Barf. They actually have good outdoor clothes flannels etc
1450,2020-06-26 19:27:51,hg7bu6,Canadian company but they ship to the US.  I'm in my 30's and its been my go to for pants for probably a decade.  Great quality and sweet deals
1451,2020-06-26 17:06:34,hg7bu6,most ridiculous line ever.
1452,2020-06-26 16:51:51,hg7bu6,"After getting fucked on SPY 315C 7/17, I'm in on GPS 13P 7/17. No fucking way is this going to stay up as high as it is."
1453,2020-06-26 20:01:09,hg7bu6,Aite time to head to the Nord
1454,2020-07-19 02:55:00,hg7bu6,truuuu
1455,2020-06-26 17:51:11,hg7bu6,"My MDB $217.5/$220 call debit spread 'boutta print this evening.

My other ones (T, TWTR)...not so much. At least those ones are for 7/17 though. But way OTM now..."
1456,2020-06-26 13:59:10,hg7bu6,"I don’t think so, with all the hype this can shoot up to 20$ I believe. Don’t listen to me tho I suck at this game"
1457,2020-06-26 15:41:36,hg7bu6,"Because adidas is not big in clothing, they are big in there shoes."
