,Timestamp,SubmissionID,Comment
0,2020-02-05 17:04:59,ezbkgm,confirmed wavy
1,2020-02-05 14:48:35,ezalqy,Help me
2,2020-02-05 14:49:08,ezalqy,"Click [here](https://www.reddit.com/message/compose/?to=notifier-bot&subject=ezalqy&message=Click%20%27send%27%20to%20be%20notified%20if%20OP%20marks%20%27%5BTOMT%5D%5BMEME%5D%20Kanye%20west%27%20as%20solved.%20You%20should%20receive%20a%20confirmation%20PM%20soon.%0A%0A----------%0A%0AMake%20sure%20the%20message%20subject%20says%20%27ezalqy%27%20before%20sending.%0A%0AOfficial%20reddit%20app%20users%20might%20need%20to%20type%20something%20in%20the%20message%20body%20before%20the%20send%20button%20is%20enabled.%0A%0AThis%20bot%20is%20still%20in%20beta%2C%20sorry%20if%20you%20come%20across%20any%20bugs.%20PM%20u/adityapstar%20if%20you%20have%20any%20questions/comments/complaints.) if you'd like to be notified when this post is solved.

^^Type ^^'ezalqy' ^^in ^^the ^^message ^^subject ^^if ^^it ^^hasn't ^^already ^^been ^^filled ^^in."
3,2020-02-05 15:04:20,ezalqy,Was it this [Tupac meme? ](https://me.me/i/2-000-years-from-now-the-church-of-tupac-will-say-14022500)
4,2020-02-06 10:18:10,ezalqy,Very similar
5,2020-02-05 02:09:40,ez1qh9,"Does this post belong in r/iamveryrandom? Please reply to this comment with either '**random**' or '**not random**'. (OP's vote doesn't count.)

[Discord](https://discord.gg/fMZGVhn)"
6,2020-02-05 14:06:43,eyxv75,🔥🔥🔥
7,2020-02-04 20:15:19,eyw47r,He was driving a motorcycle in that but were you talking about Bound 2?
8,2020-02-04 20:12:47,eyw47r,Or Otis with jay z?
9,2020-02-04 20:10:05,eyw47r,"Click [here](https://www.reddit.com/message/compose/?to=notifier-bot&subject=eyw47r&message=Click%20%27send%27%20to%20be%20notified%20if%20OP%20marks%20%27%5BTOMT%5D%20A%20Kanye%20West%20video%20where%20he%20is%20driving%20a%20car%20and%20the%20video%20is%20kind%20of%20long%27%20as%20solved.%20You%20should%20receive%20a%20confirmation%20PM%20soon.%0A%0A----------%0A%0AMake%20sure%20the%20message%20subject%20says%20%27eyw47r%27%20before%20sending.%0A%0AOfficial%20reddit%20app%20users%20might%20need%20to%20type%20something%20in%20the%20message%20body%20before%20the%20send%20button%20is%20enabled.%0A%0AThis%20bot%20is%20still%20in%20beta%2C%20sorry%20if%20you%20come%20across%20any%20bugs.%20PM%20u/adityapstar%20if%20you%20have%20any%20questions/comments/complaints.) if you'd like to be notified when this post is solved.

^^Type ^^'eyw47r' ^^in ^^the ^^message ^^subject ^^if ^^it ^^hasn't ^^already ^^been ^^filled ^^in."
10,2020-02-04 20:11:43,eyw47r,Heartless?
11,2020-02-04 20:29:51,eyw47r,"“Follow God”?

https://youtu.be/ivCY3Ec4iaU?t=30s

There’s also his song Paranoid where he’s just rapping but Rihanna is driving:

https://youtu.be/irBP5FnksKc

Is this a Kanye music video you’re referring to or something else?"
12,2020-02-18 18:20:53,eyw47r,DRIVE SLOW
13,2020-02-04 21:57:04,eyu1je,This is prolly the worst thing I’ve ever heard earl verse still fire tho
14,2020-02-05 01:14:59,eyu1je,this is so horrifically bad
15,2020-02-04 19:29:48,eyu1je,This feels right. I don’t know how but it do.
16,2020-02-04 17:39:59,eysgnq,"I listen mostly to metal, followed by rock and electronic subgenres. Music is essentially my fuel.

Metal: goth, prog, folk, symphonic, heavy and industrial

Rock: prog, alternative, hard, post-punk and electro

Electronic: synthwave, cyberpunk/dark electro, witch house, electro swing and drum & bass

I also love listening to video game OSTs, or ambient music when I'm reading. But I'll listen to anything regardless of genre if I like that particular song, most just happen to fall under the umbrella of metal genres."
17,2020-02-04 19:45:43,eysgnq,"Metal: Especially Metalcore and Nu Metal but I listen to a lot of the genres.

Rock: Usually Hard rock and 90s punk rock.

Rap: Very little, mostly Eminem and Tech N9ne.

Everything else: Video games soundtracks, some classical (mostly violin.) and very few exceptions in other genre like Ed Sheeran when I'm in that mood and need something soft.

I'm very quiet and introverted so music is kind of my door into the other side, hard and loud."
18,2020-02-04 20:15:17,eysgnq,"Classical, especially composers from the romantic period, like chopin, Tchaikovsky, rachmaninoff"
19,2020-02-04 17:00:40,eysgnq,"Muse, A perfect circle, Deftones, NIN, and Depeche Mode. 
City & Colour, Hozier and Chelsea Wolfe. 
Metalcore- Parkway Drive, Killswitch Engage
Anything other than country or black metal. 😂
I also really love instrumental bands."
20,2020-02-04 17:34:23,eysgnq,Jazz
21,2020-02-04 21:52:37,eysgnq,"Post-rock (try Sleep Dealer - The way home, or Yndi Halda or Mogwai)

Metalcore (not much right now, but August Burns Red, BMTH...)

Indie Rock (early Muse, early Arctic Monkeys, The Strokes...)

Synthwave

Aurora (artist, not genre, she's good, really, watch a live)

Shoegazing/Slowcore (Cigarettes after sex, Sleep party people...)

Nintendocore (yes, it exists. Try Anamanaguchi)

I was forgetting Radiohead, how could I."
22,2020-02-04 19:59:02,eysgnq,"What i find interesting is that there are people who dont love music.  I couldnt live without it (and subsequently; flow states).  My favorite genres are electronic, metal, avante garde & neo classical.

For the last couple of years ive been following an electronic genre of music coming out of France. (and surrounding areas) This music is considered a form of progressive house.  Its like a melodic ethereal prog house though.  This is some of the best ive ever had the pleasure of listening too.  My first rave was in '93 - ''94 so im old.  Ive also attended a lot of clubs on the east coast.  \[My favorite of all time being Studio 6 / Tru in AC\] .  For those that dont know, electronic music style is typically very regional.If you havent listened to this newish type of music check out some of these musicians.**DJ's:**Ben CWlad RoerichClement BertolleFillizzz

**Producers:**   Eddy    Barbour      Teho        Einmusik      Moja XX

Dominik Eulberg      Mees Soleme      Vladimir Platine        Guy J

Jibe spitz           Ben Bohmer

**Here's others i like for reference:**

**Neo Classical:**  ( Max Richter, Olafur Arnolds, Nils Frahm and similar)

**Avant Garde:**  Radiohead, sigur ros etc

**Chillstep (or sim)**Loscill, haelos, jamie xx, kiasmos & anything else from Hungry Music label

**Metal & progressive rock**  (with clean vocals or death with growls and clean vocals)

Iron Maiden, Dream Theater, Fates Warning, Mastadon, Iced Earth,  Ghost, Maonowar, Fates warning, Arjen Lucassen, Nightwish, Belakor, Gojira, dark tranquility, Nevermore, Rob Zombies stuff, A7xSteve Wilson & porcupine tree

Misc: Rhye, glass animals, tame impala, the acid"
23,2020-02-04 21:36:54,eysgnq,My music taste ranges from power metal to Disney soundtracks. From classical music to hardstyle. But mostly edm. Recently I acquired a taste for drumm n' bass.
24,2020-02-04 18:58:31,eysgnq,Whatever doesn't suck.
25,2020-02-04 18:04:02,eysgnq,"I get the idea of making connections thru music. I think there should be a music dating app, a Tinder of music. But the ""what kind of music do you like"" opener is kind of a pet peeve question for me. My tastes are wide open but my standards are super picky so the answer is ""I only listen to the very best kinds of music"". Sounds like dick response but it's sort of true. 

Doesn't everyone listen to all genres and have favorites that move them?  I may gravitate away from some scenes but if a track has a fun hook, tastefully original melody, gut-punching lyrics, passionate emotional delivery, I add it. I listen to ALL music looking for that."
26,2020-02-04 18:25:10,eysgnq,"Psychedelic rock, Funk, Binaural, LO-FI, old school rap, Indie."
27,2020-02-04 20:01:48,eysgnq,"I think music is a generational thing and maybe a racial/ethnic thing more so than a personality thing.


I listen to mostly grunge and stoner rock."
28,2020-02-04 20:15:45,eysgnq,"Music is a big part of my life and when I like a band I'll listen to their whole discography for months then change it up and listen to something else. Mostly it's alternative rock, metalcore, and emo-ish stuff. 

My favorites are The Strokes, Death Cab for Cutie, A Day to Remember, Fall Out Boy, Say Anything, Taking Back Sunday, The Black Keys, Cake, TOOL, My Chemical Romance, and Red Hot Chili Peppers."
29,2020-02-04 20:10:43,eysgnq,"I listen primarily to heavy metal, rock and lyrical or underground rap.  Not a huge fan of pop or today's country music, but my tastes span all genres.  

I grew up with classical music, movie OSTs, golden oldies, and country.  By the time I was finally allowed (yes, allowed) to listen to other types of music in middle school, I found myself immediately drawn to whatever sounded like it required a lot of musical talent.  I'll tell ya, the drums in Avenged Sevenfold's Blinded in Chains shook me.  I became friends with mostly fellow metalheads in highschool - enter Dummy Borgir, Amon Amarth, Slipknot, Devildriver (personal fav), Children of Bodom, etc.  

Then rap took hold with Eminem.  I was in a Marshall Mathers III fan club, complete with magazines and posters.  Enter Tech N9ne, Madchild, Ekoh and Chris Weeby, etc.

All the while, I can still be found sipping whiskey listening to Andrea Bocelli, E.S. Posthumous, or the soundtrack to Dragon Age Inquisition, or Skyrim, or Assassin's Creed. 

Sometimes along a sunny highway, I love smooth electronic music with jazzy notes like the stuff of Big Gigantic or Gramatik.  Maybe a little bluegrass and folk like Miner, Nathaniel Ratliff and the Night Sweats, Shakey Graves, Nahko and Medicine for the People, Caamp and Brandi Carlile etc. 

My music tastes really depend on my mood, and change quite erratically.  Which I think says something lol 
One minute I'm screaming the lyrics to The Fury of Our Maker's Hand by Devildriver, and the next I might throw on some CCR.  Who knows?  Lol"
30,2020-02-04 22:14:41,eysgnq,"I'm a singer and dabble in guitar & piano. I love performing but it can be tough to keep up with all the meeting strangers on a regular basis. I've been in bands ranging from punk-pop to heavy metal and a few indie/R&B side-projects. I listen to a wide range of music, basically anything but country and rap, though there are a few exceptions to both of those genres. Lately I've been getting into instrumental prog like Plini and Polyphia, then also just about anything with a good vocalist; Emarosa, I The Mighty, The Color Morale, Periphery."
31,2020-02-04 22:50:42,eysgnq,"Mostly stuff from the 90’s although over the years I have listened from classical to some modern stuff when it was around 2010. Haven’t been able to get into any new bands from after then. So an eclectic mix of grunge bands like Alice In Chains, Soundgarden and shortly after that Tool.  But among my favorites are also artists like Tom Waits, David Bowie, Misfits, Kyuss, The Beatles, Faith No More to Video Game OST’s (Jeremy Soule’s work I love, alongside the OST’s from Dark Souls/Bloodborne/WoWarcraft). Although I’ve listened to everything from Wagner, Bach and Vivaldi, through to Green Day, Death, Darkthrone while jamming to some N.W.A. I mostly like everything as long as it has some goddamn passion. Or makes me laugh. 

Maybe important to mention I was a professional musician, I’ve played around 1000 gigs in all kinds of different venues from one person to thousands of people. So the effect it has had is quite substantial. So I’m still somewhat in shock when I’m somewhere and one of those “Do they still know 90’s music” videos pops up and some kids don’t even seem to know November Rain."
32,2020-02-04 23:07:47,eysgnq,Skyrim soundtrack!
33,2020-02-04 18:39:10,eysgnq,"Considering I am a TRUE intj, I listen to the Command & Conquer soundtrack, the theme song from House, and the score from Pi."
34,2020-02-04 17:44:59,eysgnq,Cold wave
35,2020-02-04 18:53:29,eysgnq,"Metal: Parkway Drive, Avenged Sevenfold, Atreyu, The Used, August Burns Red, Bring Me The Horizon, Alesana, Killswitch Engage, Alice in Chains, Tool, Underoath, Chevelle, Crossfade, Three Days Grace, Interpol, Silverstein, Rammstein, System of a Down, Linkin Park, Metallica, and many more.

Alternative: Modest Mouse, The White Stripes, Queens of the Stone Age, Nirvana, Cage the Elephant, Silversun Pickups, Tegan an Sara, and Smashing Pumpkins.

Classic Rock: Neil Young, The Doors, Electric Light Orchestra, The Rolling Stones, Rod Stewart, Billy Joel, Alice Cooper, and Lynard Skynard.

Country: Johnny Cash, Willie Nelson, and Waylon Jennings.

Classical: Frederick Chopin, Pyotr Tchaikovsky, and Wolfgang Mozart.

Rap: Goes by a song-by-song basis."
36,2020-02-04 17:08:03,eysgnq,"I do this exact same thing when I’m making new friends or if I’m interested in a guy just to kinda see what he vibes with. Like I was getting to know this guy who liked the really hardcore rap where the lyrics are just a turnoff and the guy was a turnoff cause he was kinda narcissistic like very self centered. As far as music I like I enjoy dance music from house & techno to drum’n’bass to old school dubstep and all in between and I like chill out music from trip hop to lofi hip hop. Sometimes depending on my mood I’ll listen to alternative rock, new age funk, r&b and tons of other stuff that has a chill vibe to it. If I’m listening to anything rap it’s for the beat/instrumentals. I have like 13 different genre playlists on my Spotify and my SoundCloud is mostly used for edm that’s not on Spotify or YouTube. I love music and exploring to find new music :) I love the feeling of finding a new song and getting goosebumps from it."
37,2020-02-04 20:06:43,eysgnq,"Me personally. I'm not much of a person for music. The only artist I properly listen to is eminem.

My main music listening style is more game soundtracks and movies and tv shows. Game of thrones has some pretty great music as does star wars. Sicario has 3 songs which I love like alejandro's song, the beast and soccer game. Though I listen to a lot more independant aritsts than signed ones but even still not religiously"
38,2020-02-04 20:21:55,eysgnq,"Growing up as a kid I loved rock n roll because that’s what my dad listened to and I was always around it. As I went through highschool I got a little into rap and hip hop but I found it getting repetitive and todays rap feels so brainless to me now. (my opinion, based on what I’ve heard) 

More recently though, I’ve been introduced to EDM/dubstep music from my college friends. All my life prior to being introduced I thought it was just weird. I thought dubstep was just uncomfortable and I wouldn’t want to be seen listening to it. After acclimating to it (it took time to get used to, for me at least) I find myself only listening to Dubstep/EDM And I’m unable to go back to rap/hip hop, but I can go back to Rock if I want.
Some artists I like are: Excision, Zomboy, Space laces, Getter, Dion Timmer, Megalodon, Spag Heddy, Ivory, Wooli, Virtual Riot... and many more. 
I’ve put a lot of thought into why I like certain music and not others and I think it really comes down to a few things:
1. The song needs strong sub-bass frequencies. Without it there’s no concrete foundation for the song and it sounds like garbage
2. The song needs to spark my imagination to some degree. This is hard to explain, but for many of my favorite songs, my mind makes little visuals, almost like a little movie for each song. 
3. The song cannot have those annoying screechy ass sounds that some edm songs have, I can’t stand them."
39,2020-02-04 20:25:20,eysgnq,"For me it's symphonic metal like xandria, epica, kamelot, or nightwish. Using metaphors to paint a much bigger picture is usually a win for me

Unsure what genre hurt is but I like the raw emotion in their songs as well

Finally I despise rap, country, and most american pop due to lyrics"
40,2020-02-04 21:33:48,eysgnq,"Most of my musical taste centers around industrial, but cover a lot of territory and try to have a pedestrian understanding of different genres. While I don't like everything, I give most things a whirl if they sound like something I should know about.

As far as life impact, I did my graduate work in popular music. My partner is an avant garde classical performer, and we learn a lot from one another because we approach it from two different angles. She's from the western art field and I'm from a social sciences/ethnomusicology field.

I'm not a musician, personally, but I've helped with academic work in dance music. I book folk and singer songwriter bands for my local community festival. It's basically my social capital that I can exchange with others. I don't have a lot else."
41,2020-02-04 23:17:06,eysgnq,"Metal and rock subgenres: folk rock, symphonic metal, epic metal (Queen, Skillet, Theory of a Deadman, Sabaton, Neffex...)

Sometimes I listen to classic music and electronic subgenres: melodic dubstep (even if I don't tend to like dubstep, I found that when it's melodic it forms a curious and interesting combination), glitch hop, electro swing, French house.
I like the combination of the new and the old.

On occasions I listen to remixes of game/movies music."
42,2020-02-04 23:43:54,eysgnq,"when people ask me this question I feel uncomfortable. Music is something I only like to listen to alone, it’s something I enjoy personally discovering."
43,2020-02-05 03:56:23,eysgnq,"Trap/rap, electronic, and old Mexican corridos/cumbias. My favorite in each is Playboi Carti, Knife Party, and Ramon Ayala."
44,2020-02-04 18:20:23,eysgnq,"Music is very important to me but I always find it hard to answer that question because I listen to almost every type of music. I don't limit my music taste to any specific genres or bands, I listen to what I want to listen at that moment. I don't have favorite bands or songs, though there are some bands and artists that I like a lot but they change often because I love discovering new music and my taste in music changes all the time."
45,2020-02-04 17:26:54,eysgnq,Aboriginal rap
46,2020-02-04 18:35:16,eysgnq,"I love music. My whole family celebrates music. I actually didn't end up with the natural singing abilities of my folks and had to teach myself to hold a tune. I ended up with perfect pitch regardless.

My music tastes are vast. My preferences come in seasons. But once I love a sound I never forget it. I like Daft Punk, Odesza, JME, Stormzy, Jess Glynne, Prince, Earth/Wind/Fire, Queen, Ray Charles, Electric Light Orchestra, Pachelbel, Galantis, Calvin Harris, Elton John, Johnny Cash, Lauryn Hill, The Beatles, The Beach Boys, Mamas&Papas, LSD (Labrinth, Sia, and Diplo), Sir the Baptist, BJ the Chicago Kidd, , Bruno Mars, Outkast, Crookers, Baltimore Club, Justin Timberlake, Jon Bellion, Awolnation, RATM, MEUTE,  Backstreet Boys, Leon Bridges, C2C, Swedish House Mafia, Scooter, Eisbrecher, Alt-J, Florence and the Machine, Chet Faker, FKJ, The Lumineers, Justice, Parov Stelar, Petit Biscuit, and Coldplay...

# That's off the top of my head. And I can't forget my deep appreciation for Electro Swing (Swingrowers, Electric Swing Circus, Gramatik, Caravan Palace, 11 Acorn Lane)."
47,2020-02-04 18:55:29,eysgnq,"I can enjoy everything from opera to trash metal. But mostly Deep Purple, Korn, Ramstein, Prodigy and Skrillex."
48,2020-02-04 20:12:07,eysgnq,"I mostly enjoy classical rock, and metal. I don't know what that tells you."
49,2020-02-04 20:12:46,eysgnq,"Firstly, the types of music we listen to is only indicative of a small part of ourselves. Everything we do to express ourselves is only an outlet, welcome to basic behavioral profiling you may already know it, but in case you dont, everything about you provides sustenance towards profiling.

If your talking to someone, their taste in music is only one part of a much larger whole. 

Ask them about the lottery, their dreams, idols, etc. The further out there you make the subject the more honesty you'll likely encounter. Most people might have cookie cutter answers for popular questions, but not really for ""what if"" or ""what would you do"" types. So their answers even if untrue, is genuine thoughts. 

As for my music tastes, I despise rap, country, and most metal type of music.

I greatly enjoy folk, chant, classical and symphonic music's, and stuff like that."
50,2020-02-04 20:22:44,eysgnq,"Radiohead, John Coltrane, Neko Case, Jaco Pastorius, The Gathering, Air, Tool, Do Make Say Think"
51,2020-02-04 20:37:27,eysgnq,"That's a prime question for me. I was always a music lover, particularly always get obsessed about bands for some reason. Befriended a lot of people through shared music taste and met some bands too. 

I'm not picky but it just happens that most of the music I like is punk. Lots of rock music, occasionally steampunk or dark cabarett, a bit of metal, bit of rap or DnB. A nice side effect of punk is that a considerable aspect of it is certain views that unite the people that create and listen to it, so it also gives you a lot of things in common.

Seeing Muse as one of the top votes is funny because I used to be a hardcore Muse fan. I do prefer the first 3 albums, not that big of a fan of the poppier n electronic direction they took later on. 

Selection of jams I enjoy

[Future of the Left](https://youtu.be/qkTvISL53HQ)

[Shellac](https://youtu.be/dO-npemrWwY)

[The St Pierre Snake Invasion](https://youtu.be/DzXgao0j7Ig)

[A Frames](https://youtu.be/Uo9tOAUCHbc)

[Days n Daze](https://youtu.be/iRF1vHd4xl8)

[Sleaford Mods](https://youtu.be/Z3kwE4Dog7w)

[Bad Religion](https://youtu.be/12kcpP-8jfM)

[Slaves](https://youtu.be/VmtU-bLyReU)

[Mindless Self-indulgence](https://youtu.be/B0AX81gv5aM)

[System of a Down](https://youtu.be/hOlvVWrbeaM)

[Vennart - Dick Privilege](https://youtu.be/ZE4JTf7qOWk)"
52,2020-02-04 20:38:06,eysgnq,"Pavement, Grateful Dead, Wilco, Elliott Smith, Dylan, Buffett, Grandaddy, Conor Oberst, Phish, Coltrane, Joni, Neil, Steve Miller, Built to Spill, Townes Van Zandt, GBV, RHCP, Kacey Musgraves, Todd Snider, Kevin Morby, Ron Wood, John Lennon.  I’m an INFP."
53,2020-02-04 20:43:34,eysgnq,"I love music when I need some drive I listen to indie/rock, electronic, but in majority I listen to Tame Impala and Jungle  you should all check them out they have some major good vibes..."
54,2020-02-04 20:51:17,eysgnq,"I listen mainly to Owl City and other projects by the same guy. A lot of Lo-fi hip hop, J Cole, Logic, Kendrick, Stormzy, and some Drake. I like instrumental music like classical jazz artist Bill Evans."
55,2020-02-04 20:52:41,eysgnq,"For me, Literally everything.  Each sound, lyric, and cultural association can evoke a range of emotions (at least for me).

\-Conscious rap (Joey Bada$$, Kendrick, J. Cole, Denzel Curry).  I enjoy this for the lyrical content and the urban vibe.

\-1990s hip hop.  For similar reasons as Conscious rap, but it feels more ""vintage""

\-Mainstream hip hop (Lil Tjay, Dababy, Future, Young Thug, Uzi).  Although it can get repetitive and it's not deep, I love the production.  High energy, melodic, great for getting hype before a workout or pregaming

\-Rock (Floyd, Led Zeppelin, Steely Dan, The Eagles, Phil Davis, Red Hot Chili Peppers).  I love the non-linear song structure, and the electric guitar is an ear orgasm.  Sounds next level beautiful when cooked.

\-House/EDM.  Paradoxically, I love the linear song structure here.  I think the hard, pounding beats can just be so satisfying and intense sometimes.  Sounds fucking amazing when on Adderall.

\-Spanish/Reggaeton (Shakira, Daddy Yankee, Wisin, Enrique Iglesias, Santana).  Puts me in a summer-is mood.  I know lots of Hispanic people and I've spent 4 weeks in Spain as well as some time in Mexico, so I like how the music reminds me of those awesome vacations

\-Nirvana.  Grunge is lit.

\-Reggae (Bob Marley, Dennis Brown, Barrington Levy, Shabba) just cuz it contrasts with the normally high intensity music I'm always pounding

\-""Country-ish"" (The Wallflowers, Jon Pardi, Stone Temple Pilots, Lynyrd Skynyrd).  I have family in the midwest, and the vibe of the music just reminds me of big open fields and cows and long highway road trips"
56,2020-02-04 21:12:59,eysgnq,"I'm a colombian from the city of Santiago de Cali (aka a world's salsa capital). I grew up listening to salsa and other tropical genres like merengue, vallenato and reggaeton. Then, my fathers put me into this school where kids listened to pop, rap and rock, (Nu metal was in its prime) so I picked up a lot of SOAD, Linkin Park, Michael Jackson, Britney Spears, Nirvana, Eminem, 50 cents, etc..
When I was 12, my family moved to another country. There I picked even more metal, but also picked EDM, and popular teenagers pop (Katy Perry, Lady Gaga, T-pain, David Guetta, etc). In college I got into Tupac, Metallica and other classics.

I just mentioned the popular artists or bands that I had in the top of my mind. I kinda listen to almost everything. What does that tells you about me?"
