,Timestamp,SubmissionID,Comment
3012,2020-11-09 03:30:04,jqnl1p,"> She voted against the relaxation of divorce laws
> 
This shouldnt make a worst of list lmao"
3013,2020-11-09 04:11:57,jqnl1p,Ah thanks for this completely unbiased explanation ya twit
3014,2020-11-09 03:37:18,jqnl1p,Party time?
3015,2020-11-09 08:36:26,jqnl1p,"As many years as it takes. And then, if one day she leaves you, smile and know in your heart that one day, *she'll come 'round.*"
3016,2020-11-09 03:28:57,jqnl1p,Nothing...yet
3017,2020-11-09 03:59:01,jqnl1p,Dooooo. du-da-du du-da-du du-da-dududu dddduuu. It's Pizza Time.
3018,2020-11-09 05:16:20,jqnl1p,Uncle ben dies
3019,2020-11-09 04:49:42,jqnl1p,[This.](https://youtu.be/lpvT-Fciu-4)
3020,2020-11-09 12:43:07,jqnl1p,A proud boy pops up and starts demanding to see the children in your basement.
3021,2020-11-09 19:42:02,jqnl1p,Your health meter goes up?
3022,2020-11-09 04:08:04,jqnl1p,"Buy 1984 style bug for your house, like alexa, google, whatever. Then replace all bulbs with smart rgb bulbs. Then replace regular plugs with smart plugs. Do some linking and create a routine in the Alexa app, or whatever listening bug you have app. Set it up so when you say a phrase it makes the house do things. Like when we say goodnight, all the lights and televisions shut off and alexa tells a really bad joke. Super easy and fun. Not all that cheap though."
3023,2020-11-09 03:13:11,jqnl1p,Oh gosh no. She is my all time best friend. She even stuck around when i set up the “annoy wife” mode.
3024,2020-11-09 03:55:55,jqnl1p,OPs wife agrees.
3025,2020-11-09 02:47:27,jqnl1p,"Yeah, a few years before she started going nude. Dark times."
3026,2020-11-09 03:09:24,jqnl1p,Right?  We old bro.
3027,2020-11-09 03:38:14,jqnl1p,"In different terms, u/wsb-narrator, when this song came out: $AMZN was $81, $TSLA hadn’t had their IPO yet, and 10,000 bitcoins could only buy 2 pizzas"
3028,2020-11-09 03:10:10,jqnl1p,Seems earlier than that right?
3029,2020-11-09 04:41:20,jqnl1p,"Lady Gaga, Katy Perry, LMFAO, honestly didn't realize how much 2009 popped off"
3030,2020-11-09 05:45:34,jqnl1p,Bruh I cannot emphasize how much that personally slapped for me. Thank you for sharing
3031,2020-11-09 04:11:35,jqnl1p,If you said this in front of me I would slap you. Weird Al will ALWAYS be cool.
3032,2020-11-09 04:06:01,jqnl1p,"I don't think I'd watch it again, but I kinda loved it back then... I never told this anyone but my biggest guilty pleasure movie ever is the Hannah Montana movie. In 10th grade or so I had a very busy week studying but I didn't want to, so I watched that movie like 9 times in that week, idk how I did it, but it's true. Idk why but I loved it"
3033,2020-11-09 06:56:15,jqnl1p,AIN'T NOTHING BUT A MISTAKE
3034,2020-11-09 18:19:43,jqnl1p,"""Oh my god I forgot about that part"""
3035,2020-11-09 02:13:27,jqnl1p,bye bye bye
3036,2020-11-09 02:32:40,jqnl1p,"Nodding my head, like yeah."
3037,2020-11-09 03:40:37,jqnl1p,"That was amazing, thanks!"
3038,2020-11-09 05:26:35,jqnl1p,The one about climbing a mountain was pretty catchy
3039,2020-11-09 04:45:33,jqnl1p,"True lol, even if people aren’t Miley fans it always brings back nostalgia so it’s a win win lol"
3040,2020-11-09 18:32:24,jqnl1p,"Like I get it, but also it seems like it would make more sense to be specifically about metal songs, rather then all songs."
3041,2020-11-09 10:23:24,jqnl1p,"Arrrr, matey, it indeed bothers be way more, ye scurvy dog."
3042,2020-11-09 04:44:47,jqnl1p,I didn't know that one but i'm not a Green Day scientist to confirm. Just a casual Gen Xer feeding of nostalgia. Jesus of Suburbia is in American Idiot. I love it.
3043,2020-11-09 04:46:24,jqnl1p,Didn't realize they released an album this year... I guess I know what I'm doing tomorrow
3044,2020-11-09 10:54:57,jqnl1p,Green Day does have Ha Ha You’re Dead which got some similar vibes to it.
3045,2020-11-09 14:01:10,jqnl1p,"Here's a YouTube link for anyone else wanting to hear it!     
[See You Later Fuckface - the Queers](https://youtu.be/G5OVEmtsj24)"
3046,2020-11-09 14:42:14,jqnl1p,It worked while I was driving my car up from the Bahamas.
3047,2020-11-09 13:34:32,jqnl1p,Because I couldn't see the song title without clicking.
3048,2020-11-09 19:44:42,jqnl1p,Saving a click means people don't have to click and leave the page to find the information. Has nothing to do with clickbait.
3049,2020-11-09 10:29:35,jqnl1p,"Song was actually written about George W Bush, so pretty related."
3050,2020-11-09 09:17:42,jqnl1p,Nice! Although I don’t think Detroit itself was close lol
3051,2020-11-09 03:26:24,jqnl1p,"That is an amazing song that should be charting right now. And you’re absolutely right, there’s still plenty of protest and change to be done. Hopefully these things can be done with less tension and more respect from now on"
3052,2020-11-09 03:15:34,jqnl1p,Username checks out.
3053,2020-11-09 06:32:24,jqnl1p,Or maybe edit your comment? Tf
3054,2020-11-09 03:00:06,jqnl1p,"To be fair, he did do the whole “Kung flu” and “China virus” thing which definitely escalated racism against Asians. Although it is very hard to keep track of all his different scandals."
3055,2020-11-09 05:03:05,jqnl1p,"Yea I think they were talking about the wall, since it was a pre-election song and Nipsey said ""it wouldn't be the USA without Mexicans."" I don't think Trump was talking about banning Asians at that point, although he might've been saying anti-China things i can't remember. Also, when I see people talk about American race relations they usually frame it only in terms of white vs black or white vs black vs Mexicans."
3056,2020-11-09 13:21:18,jqnl1p,Wowowowowow! i'm guessing you're team N'Sync back in the days lol!
3057,2020-11-09 05:32:38,jqnl1p,How is it irrelevant? The whole thread is about these songs being played because joe won the presidency lol
3058,2020-11-09 06:45:45,jqnl1p,"You

Have poor reading and research comprehension skills."
3059,2020-11-09 06:46:38,jqnl1p,There. I added quotes to help you out.
3060,2020-11-09 17:26:27,jqnl1p,I did not. I am stupid and I apologise.
3061,2020-11-09 23:07:06,jqnl1p,"I do.  I hear a lot of crying about voter fraud, but I'm still waiting for someone to provide some evidence."
3062,2020-11-09 03:00:53,jqnl1p,Lol classic Carly Rae fan behavior. Power to ya
3063,2020-11-09 02:12:14,jqnl1p,"Both of these songs are related to the election, and have nothing to do with either artist."
3064,2020-11-09 02:13:11,jqnl1p,"You are way off point, apply it politically and call me maybe has literally no relation"
3065,2020-11-09 04:12:04,jqnl1p,He's on the golf course lol
3066,2020-11-09 03:31:52,jqnl1p,"She was still on the show for a bit. And no they didn't, pretty sure she got into it for the easy money since she has no issue with the lifestyle. Poor woman has gone downhill since she got into it."
3067,2020-11-09 16:57:26,jqnl1p,Well related to your post they have been trying to make Girl Meets World's Sabrina Carpenter into a pop star.
3068,2020-11-09 04:18:57,jqnl1p,"Yes, which is related to Trump Defender Syndrome,  or TDS-2"
3069,2020-11-09 18:11:05,jqnl1p,The ones screaming about fraud without any evidence.
3070,2020-11-09 16:08:45,jqnl1p,Wait... do you think TDS is an original joke?
3071,2020-11-09 13:43:10,jqnl1p,[deleted]
3072,2020-11-09 03:56:13,jqnl1p,[deleted]
3073,2020-11-09 04:56:40,jqnl1p,"I'm Canadian lol

Sorry that I read more than headlines"
3074,2020-11-09 08:16:04,jqnl1p,"Arizona, among others, is going to be recounted at the pace it's on. And if Trump's legal team can target invalid mail-in ballots, that will negatively affected Biden. Throw in the yet-to-be called North Carolina and Alaska (which Trump is winning handily) and all of a sudden Trump is at 243. Georgia is confirmed to be subjected to a recount. Again, courts pending, it could also swing for Trump putting him at 259.

Then, it comes down Pennsylvania and its 20 votes. The Supreme Court provisionally allowed ballots to be counted if they arrived before Friday, Nov. 6, and were postmarked before Election Day, Nov. 3, and ordered late votes to be segregated. When Justice Samuel Alito was informed that the state had not segregated the late votes, as Pennsylvania’s secretary of the commonwealth [had advised](https://local21news.com/news/local/supreme-court-tells-pa-counties-to-segregate-any-ballots-received-after-8pm-on-electi), Alito [made it an order](https://www.westernjournal.com/justice-alito-steps-orders-pa-votes-received-8-p-m-election-day-secured/) on Friday.
Biden currently leads by 37,000 votes in Pennsylvania. The number of late-arriving ballots likely far exceeds this total (the state has not published this information). Justice Alioto and a Court majority may throw out the late ballots, likely delivering the state and victory to Trump at 289 electoral votes.

You have to remember that while everyone was busy making fun of Trump over the last four years, he's been stacking the courts with over 200 judges, and it just so happens his two Supreme Court appointees (Kavanaugh and ACB) were part of [Bush's legal team](https://www.abc57.com/news/supreme-court-is-about-to-have-3-bush-v-gore-alumni-sitting-on-the-bench) that won him Florida and the 2000 election. All the people in this thread probably weren't even alive in 2000 lol

So now we have a media apparatus (that got ever single other thing [catastrophically wrong](https://www.cnbc.com/2020/11/07/election-pollsters-2020-reckoning.html) about the election, whether through incompetence or malice,) telling you not to worry about the election results going to the Supreme Court."
3075,2020-11-09 03:57:29,jqnl1p,Lol nice.
3076,2020-11-09 04:43:57,jqnl1p,"Yeah, fuck off. The only joke here are the cultists crying because they fucking lost. Maybe pull one of those fucking plastic flags off your lifted truck to use for a hanky."
3077,2020-11-09 03:41:11,jqnl1p,Your username is ironic.
3078,2020-11-10 04:41:16,jqnl1p,You sound like a homophobic piece of shit.
3079,2020-11-09 04:16:25,jqnl1p,[deleted]
3080,2020-11-10 14:29:07,jqnl1p,"Cool, now do dead industries and opioids"
3081,2020-11-09 04:34:53,jqnl1p,LOL... you think you're going to ratfuck a win out of the Supreme Court. Good luck with that dumbass. Most of the lawsuits have been thrown out already.
3082,2020-11-09 04:41:26,jqnl1p,lol he already did you fucking loser
3083,2020-11-09 03:51:54,jqnl1p,American voters chose Joe Biden. Trump is a loser. Get used to President Biden and Vice President Harris.
3084,2020-11-09 03:51:08,jqnl1p,LMAO
3085,2020-11-09 16:14:44,jqnl1p,Trump beat it into your head for a year that if he loses it’s fraud. You got played. Come back to reality.
3086,2021-03-02 13:09:59,jqnl1p,how’s that one working out for you
3087,2020-11-09 10:08:25,jqnl1p,"Are you suggesting that the supreme court is biased and therefore should be completely modified to not be biased? 

How much are you hoping for voter suppression in Georgia so Democrats don't win the Senate?"
3088,2020-11-09 04:39:39,jqnl1p,"> NPC

You’re using a years-old catchphrase that somebody else made up for you to accuse other people of being incapable of original thought.  You are a bad joke."
3089,2020-11-09 10:05:43,jqnl1p,"15 cases and going away like magic no? Gone in the summer? Something something Easter?

Why do you defend a disgusting pathological liar?"
3090,2020-11-09 04:33:24,jqnl1p,"> You giving Trump credit for saving hundreds of thousands

No, you are, cultist."
3091,2020-11-09 03:54:15,jqnl1p,"Don't act like the worst is over, he's still hasn't contained Covid-19 and numbers are still rising."
3092,2020-11-09 03:43:20,jqnl1p,Biden is your president.
3093,2020-11-09 04:25:06,jqnl1p,"True, but still, like I said some of us just prefer owning songs."
3094,2020-11-09 05:12:43,jqnl1p,"I mean, you’re wrong. I listen to *NSYNC whenever I want. The difference is that I’ve owned their music since it came out."
3095,2020-11-09 01:57:36,jqnl1p,Tim Pool in particular and the collective of alt right pundits are legit terrified at this prospect
3096,2020-11-09 02:24:32,jqnl1p,Isn't that like a 70 million name list?  That sounds like a lot of work.
3097,2020-11-09 04:28:42,jqnl1p,Oh buddy. Are you still upset Q hasn’t called you back yet?
3098,2020-11-09 04:30:09,jqnl1p,Trump was impeached for withholding military aid from Ukraine in order to benefit his Presidential campaign.
3099,2020-11-09 04:25:16,jqnl1p,Man they dropped that farce once the impeachment was over yet you still believe it. Lmao
3100,2020-11-09 16:32:44,jqnl1p,"Nah, you just plot to kidnap governors and shoot up churches and schools"
3101,2020-11-10 01:16:59,jqnl1p,"Yeah I'm not saying that they're 100% different but you really consider both parties being pro-big government to be ""wild""?

> has said seriously prejudice statements one of which was on Sway in the Morning

Are you talking about the ""you're not black if you don't vote for me"" thing? Honestly, who gives a fuck? It was tasteless for sure but it hardly stacks up to the litany of morally repugnant shit that has fallen out of the orange buffoons mouth.

> The difference is who is brave enough to challenge it.

I voted in favor of Ranked Choice Voting but I also voted for Biden because I knew no third party had a snowballs chance in hell in this election.

Whats really ""wild"" is how libertarians can't see the forest for the trees"
3102,2020-11-09 02:58:58,jqnl1p,"Well yes, but holy fuck trump is so much worse"
3103,2020-11-09 15:29:29,jqnl1p,Oh I’m absolutely not worried! Just celebrating the clean win!
3104,2020-11-09 05:31:48,jqnl1p,Not really. The whole thread is alluding to these songs being played at such a rate because biden won.
3105,2020-11-09 05:30:34,jqnl1p,I mean trump was a democrat for most of his life...
3106,2020-11-09 01:42:07,jqnl1p,I don’t feel threatened or harassed though. Can I report something for being pitiful or sad?
3107,2020-11-09 02:37:57,jqnl1p,"Hahaha, that didn't take long."
3108,2020-11-09 05:10:30,jqnl1p,You mean lil pimp
3109,2020-11-09 17:07:24,jqnl1p,You support an insurrection against the US . You deserve no quarter.
3110,2020-11-09 11:18:29,jqnl1p,"You need evidence to win a court case, hun. ;) 

Literally everything Trump has tried to claim has been debunked."
3111,2020-11-09 09:12:28,jqnl1p,">Biden being a total POS when it comes to supporting legitimately racist policies specifically targeted towards black communities

Yeah,  not even democrats think he's perfect. He's just better than the opposition"
3112,2020-11-09 05:51:00,jqnl1p,Also apparently good at voting.
3113,2020-11-09 04:32:40,jqnl1p,[deleted]
3114,2020-11-09 04:02:19,jqnl1p,"Whoa these are all phenomenal.

""Stress of presidency immediately ages Biden 10 years"" God that's good"
3115,2020-11-09 03:38:43,jqnl1p,"I, for one, am looking forward to the return of Diamond Joe."
3116,2020-11-09 05:03:35,jqnl1p,It single-handedly propelled Biden to the Presidency.
3117,2020-11-09 03:55:36,jqnl1p,Big Mood: https://politics.theonion.com/jubilant-reaction-to-trump-defeat-quickly-soured-by-new-1845551327
3118,2020-11-09 09:50:26,jqnl1p,"""Media condemns Biden for baseless claim that nation will come together once election is over.""

These are all on point"
3119,2020-11-09 11:52:07,jqnl1p,I do love the Onion's cool uncle version of Joe Biden.
3120,2020-11-09 13:02:29,jqnl1p,"As much as I love all the onion articles on Biden, it really saddens me that they won't be returning to their Diamond Joe character. I would've killed for some President Diamond Joe articles"
3121,2020-11-09 16:59:51,jqnl1p,"I miss the old ""Diamond Joe"" articles"
3122,2020-11-09 04:23:23,jqnl1p,NGL that is one sweet looking car
3123,2020-11-09 05:12:44,jqnl1p,"I thought the URL directory said joseph_hiden, which would've been pretty great since that's one of the items he was being attacked on"
3124,2020-11-09 06:34:46,jqnl1p,Joe dirt
3125,2020-11-09 20:33:24,jqnl1p,"More from The Onion:

## [Trump Files Lawsuit In Pennsylvania Alleging Election Officials Totally Disregarding His Feelings](https://www.theonion.com/trump-files-lawsuit-in-pennsylvania-alleging-election-o-1845587740?_ga=2.234963969.1627051510.1604953901-694427686.1604953901)"
3126,2020-11-09 06:15:57,jqnl1p,hi
3127,2020-11-09 17:37:14,jqnl1p,"So many sources of silly to obsurd comedy have willed into existence a dystopian future.

It's not funny anymore...."
3128,2020-11-09 07:27:34,jqnl1p,"Oh my god 

[This One Is My All Time Favorite Now. ](https://politics.theonion.com/jubilant-reaction-to-trump-defeat-quickly-soured-by-new-1845551327)

“One moment we’re celebrating our nation’s repudiation of Trump, and the next Biden is declared the winner—what a buzzkill” HAHAHA"
3129,2020-11-09 16:00:45,jqnl1p,"""Jubilant Reaction To Trump Defeat Quickly Soured By News Of Biden Win"" lol"
3130,2020-11-09 18:57:48,jqnl1p,"I used to agree, but I wonder if the Onion didn't do some damage by making ol' Uncle Joe a likeable character, because he's really kind of a gross old racist."
3131,2020-11-09 14:42:26,jqnl1p,"Ah yes, the Four Seasons Total Landscaping debacle. Literally was going to post this. Felt like sketch comedy. SNL in shambles."
3132,2020-11-09 12:16:35,jqnl1p,And was originally just the movie and music reviews section of the onion
3133,2020-11-09 09:21:52,jqnl1p,Oh my god that makes me feel so goddamn old. :(
3134,2020-11-09 08:41:29,jqnl1p,"Trump’s ego is so fragile and insecure, that he rather let his team go forward with a ridiculous press conference at some shady dirt parking lot, vs just admitting there was a slight miscommunication and reschedule the press conference at another location/date/time??  Seriously take a moment and think how clinically sick this guy really is."
3135,2020-11-09 08:31:26,jqnl1p,"I asked before but nobody gave me an answer-


When did Dildopolis open a second location?"
3136,2020-11-09 17:23:17,jqnl1p,"You forgot to mention that the election was called for Biden, literally seconds before Rudy took the podium, and that Rudy seemed to learn this via a reporter's question, and then proceeded to freak out right there."
3137,2020-11-09 18:31:50,jqnl1p,"You're missing the best part, though. It wasn't just the same day, it was literally *as* Giuliani was presenting the latest dubious evidence of supposed election fraud in front of the assembled press.

As a reporter informs him that the election has been called by the networks, [Giuliani asks the reporter ""Who was it called by?""  Reporter: ""All of them.""](https://twitter.com/cspan/status/1325130373144043520)

The timing was perfect, and Giuliani's reaction suitably unhinged."
3138,2020-11-09 17:07:02,jqnl1p,"> rigger

Whoah no need for the hard R bro"
3139,2020-11-09 18:49:19,jqnl1p,I have a hard time believing it was a genuine accident.  It's just too nuts.
3140,2020-11-09 19:30:44,jqnl1p,Historical
3141,2020-11-09 17:55:45,jqnl1p,"This is wonderful, thank you"
3142,2020-11-09 18:25:43,jqnl1p,I love this.
3143,2021-02-18 14:36:12,jqnl1p,"Yes, thank you for the clarification my friend"
3144,2020-11-09 05:25:08,jqnl1p,The Shallot
3145,2020-11-09 07:30:36,jqnl1p,"Those two unadorned ""it""s don't do anything for my comprehension."
3146,2020-11-09 03:58:55,jqnl1p,It's a thing.
3147,2020-11-09 15:10:25,jqnl1p,Jealousy
3148,2020-11-09 15:05:51,jqnl1p,"It was only Farage, 

It was only Farage."
3149,2020-11-09 03:06:11,jqnl1p,Turning saints into the sea
3150,2020-11-09 02:44:08,jqnl1p,CHOKING IN YOUR ALIBIS! *throws up*
3151,2020-11-09 03:18:48,jqnl1p,That is a very silly but very sensible mistake.
3152,2020-11-09 19:43:23,jqnl1p,Thanks <3
3153,2020-11-09 02:30:09,jqnl1p,"And we can sing it drunk! 

Always a plus!"
3154,2020-11-09 03:00:14,jqnl1p,[deleted]
3155,2020-11-09 06:26:10,jqnl1p,"Pretty much the British version of that yeah. Like I don’t think I’ve ever heard anyone describe a song as their jam, but I’ve heard “absolute banger” or “mate this is a fucking tune!” Countless times."
3156,2020-11-09 13:49:29,jqnl1p,"Naa, for starters it’s actually a good song..."
3157,2020-11-09 04:42:41,jqnl1p,"Doesn't it just make you feel good and proud to be human for a minute to watch all of those people coming together and having fun over a silly song?

There's a longer cut of the video somewhere on YouTube too."
3158,2020-11-09 02:55:21,jqnl1p,"These are the crowds that gather in the streets after a night out in England, looking for someone to go home with."
3159,2020-11-09 02:57:37,jqnl1p,Now you know how to lure us into a trap.
3160,2020-11-09 16:53:28,jqnl1p,I love when they all seem to gravitate towards the vehicle like the music is pulling them in
3161,2020-11-09 09:04:13,jqnl1p,[deleted]
3162,2020-11-09 14:14:51,jqnl1p,"Don't Stop Believin' was a pretty big hit in the UK too  (got to 6 in the charts 29 years after being originally released, with no official re-issue or promotion)."
3163,2020-11-09 16:55:14,jqnl1p,You're correct on all points but Americans also sing Sweet Caroline whenever possible
3164,2020-11-09 14:29:19,jqnl1p,"I'm really going to miss the pissed up Christmas singalongs this year, it's always such a lovely thing. Last year we got dragged to Reflex at like 4pm on a Saturday in early November and for some reason they played all I want for Christmas is you - the place was absolutely rammed and everyone was blind drunk, and it was just the most crazy and wholesome thing ever to see the place erupt with Christmas joy even though Christmas was miles off. You can't do that on Zoom 😭"
3165,2020-11-09 08:55:23,jqnl1p,This is just a saturday night in the uk (pre-pandemic)
3166,2020-11-09 03:13:15,jqnl1p,"Yeah, I was going to post an explanation myself, in my comment, based on this video I’d seen.  But I couldn’t really remember what they’d said...  Watching it again, that’s because they didn’t really say much at all!"
3167,2020-11-09 03:34:59,jqnl1p,"Agreed -- but I have to say, when they're good, they're so much fun to watch! Like Lindsay Ellis's videos."
3168,2020-11-09 03:07:40,jqnl1p,It’s Home Alone 2 the bar was not that high okay. Give the man a break. It went so poorly he was relegated to reality TV if it makes you feel any better.
3169,2020-11-09 03:11:39,jqnl1p,Charity thief would have been better.
3170,2020-11-09 23:10:20,jqnl1p,"This! I read one that said

""Former Parks and Rec star Joe Biden has been cast as President of the United States. He will replace former Home Alone 2: Lost In NY star Donald Trump"""
3171,2020-11-09 03:09:21,jqnl1p,"Windmills do kill birds, but it's at a rate of hundreds per year. Cats kills birds in the millions per year."
3172,2020-11-09 03:08:13,jqnl1p,"https://youtu.be/M11SvDtPBhA

Since no one has linked it yet

https://youtu.be/Eo-KmOd3i7s"
3173,2020-11-09 03:16:21,jqnl1p,"Yes, but what's the cancer rate now?"
3174,2020-11-09 03:51:33,jqnl1p,Paging Don Quixote...!
3175,2020-11-09 04:50:07,jqnl1p,😂😂😂
3176,2020-11-09 03:48:38,jqnl1p,A windmill gave Alex Trebek cancer 😔
3177,2020-11-09 03:37:12,jqnl1p,Thousands of helpful young people show up to help a senior citizen move. https://imgur.com/ogkafUu.jpg
3178,2020-11-09 03:28:04,jqnl1p,I seent it.
3179,2020-11-09 03:10:04,jqnl1p,"No! Frig off, gosh."
3180,2020-11-09 03:09:52,jqnl1p,"I am not! Rural Iowa doing similar headlines to Irish regional papers? I am shocked. 

They're going on my list of enemies."
3181,2020-11-09 03:31:25,jqnl1p,"that's just rural USA period. I grew up in the middle of nowhere, indiana and a lot of otherwise well spoken people all had the seen/saw quirk in their speech."
3182,2020-11-09 03:21:47,jqnl1p,I feel personally attacked here.
3183,2020-11-09 03:30:44,jqnl1p,Leave us alone
3184,2020-11-09 03:33:16,jqnl1p,"The apprentice was a TV thing though? Aren't they mostly scripted to hell and back? And have teams and production crew etc.

I suppose from a purely ""how successful was it?"" perspective it was a success but I'm referring to himself as a person. It seems like he has more failures than success stories."
3185,2020-11-09 03:46:09,jqnl1p,"**""Home Alone 2""** was also successful."
3186,2020-11-09 03:14:14,jqnl1p,That is to say I saw him
3187,2020-11-09 03:17:14,jqnl1p,"Yeah, there was a local paper that ran a silly headline and I saw it."
3188,2020-11-09 03:07:18,jqnl1p,"Aye, I'm very much assuming the headline was referring to the current election cycle rather than the previous one."
3189,2020-11-09 03:02:53,jqnl1p,"He lost by 3 million, our electoral college is (historically) built for slave owning racist ass southern states to not rebel against America"
3190,2020-11-09 03:04:51,jqnl1p,"Yet lost the popular vote. If every vote were weighted equally, 2016 would have been yet another in a long line of failures for him."
3191,2020-11-09 03:09:17,jqnl1p,There is such a thing as failing upward and it is infuriating to behold
3192,2020-11-09 03:13:46,jqnl1p,"I wonder if there’s another election he lost, possibly very recently. Oh well, as far as I’m aware there’s no way to find out."
3193,2020-11-09 02:39:40,jqnl1p,No You!
3194,2020-11-09 14:58:19,jqnl1p,"Oh cool, thank you. I didn't even notice. Wow, 9 years... what have I been doing with my life? LOL"
3195,2020-11-09 02:56:59,jqnl1p,Literally the same with Indiana. It's fucking incredibly stupid that it isn't legal on a federal level and I don't even like or use Marijuana.
