,Timestamp,SubmissionID,Comment
2614,2020-10-09 23:59:17,j8850e,DL Link : [https://drive.google.com/drive/folders/1AXU4aP4kz6uozN0QPgIcX4d9FkGSTDjs?usp=sharing](https://drive.google.com/drive/folders/1AXU4aP4kz6uozN0QPgIcX4d9FkGSTDjs?usp=sharing)
2615,2020-10-09 23:47:32,j8850e,sure ill set one up give me 5 minutes
2616,2020-10-10 01:24:42,j8850e,thank you bro
2617,2020-10-09 22:16:36,j87l46,"Plz don’t fucking do it for yeezy. He’s my favorite artist, but let’s keep it at that.

Make a vote that counts, Republican or Democrat."
2618,2020-10-09 21:54:09,j87l46,"Honestly wondering how you can reach voting age while still being this stupid. If you vote for Kanye West as president you are just flat out stupid, stick to appreciating the music"
2619,2020-10-19 17:13:53,j87l46,Some people need to stay in their lane and ye is one of them
2620,2020-10-09 21:46:22,j87cu7,"yes this is indeed Gifted by N.A.S.A featuring Kanye West, Santogold, Lykke Li

nice 👍"
2621,2020-10-09 20:26:11,j86coq,No way
2622,2020-11-09 15:55:43,jr048z,"Original post: [Kanye west is not a genius and he is delusional.](https://reddit.com/r/unpopularopinion/comments/jqwql1/kanye_west_is_not_a_genius_and_he_is_delusional/) 

Body: [removed]

----

^[Bugs](https://www.reddit.com/message/compose?to=%2Fr%2FNoLockedThreads)"
2623,2020-11-09 18:44:46,jr048z,"Not unpopular, and true"
2624,2020-11-09 15:08:41,jqz95k,"* /u/collegescaresme has 13 confirmed trades.

---

* **Only send payments via PayPal Goods and Services. Do NOT use PayPal Friends and Family or any other form of payment (e.g. Venmo, Zelle, etc...).** This will protect you from any potential scammers.
* [Click here to learn how to leave feedback.](https://www.reddit.com/r/VinylCollectors/comments/cpy02o/psa_new_trade_confirmation_bot_is_online/)
* Users swap reputation can be found in the user flair. If you're unable to see it or want more detailed information, click SEND on [this message.](https://www.reddit.com/message/compose/?to=VinylSwapBot&subject=Feedback_Check&message=u/collegescaresme)

---


*I am a bot, and this action was performed automatically. Please [contact the moderators of this subreddit](/message/compose/?to=/r/VinylCollectors) if you have any questions or concerns.*"
2625,2020-11-09 15:49:27,jqz95k,"Fetti on vinyl > Wap 


GLWS OP!!!!"
2626,2020-11-10 00:04:57,jqz95k,"DANG, disappointed I missed Fetti! That's the pressing I'm looking for, but the lowest listing on Discogs doesn't ship to the US. Mind if I ask what you sold it for?"
2627,2020-11-09 19:06:01,jqz95k,Pm'd for Kids See Ghosts and Pimp a Butterfly
2628,2020-11-09 20:13:10,jqz95k,Wap?
2629,2020-11-10 00:07:30,jqz95k,$170. You might be able to make an ISO post in this sub and find a seller.
2630,2020-11-10 02:41:54,jqz95k,"Fetti Wap is a rapper. WAP is an acronym which stands for wet ass pussy.

My comment was an attempted play on words to suggest that this highly sought after vinyl would be better than some WAP. Pure hyperbole."
2631,2020-11-09 21:38:07,jqz95k,Wap
2632,2020-11-10 03:05:27,jqz95k,Ah gotcha. Thanks for the breakdown
2633,2020-11-09 15:23:51,jqywwn,That IS Kanye West!
2634,2020-11-09 14:47:43,jqyvgx,"This submission has been removed as your elaboration was less than 160 characters (roughly two or three standard sized sentences). If you wish to resubmit the post, make sure you include an elaboration/explanation to your post that is has more content. Please read Rule 2, and the rest of them while you're at it. 

Note that Reddit's character count is unreliable as they count spaces, whereas I'm programmed to not count spaces and there's nothing the mods can do about it.


*I am a bot, and this action was performed automatically. Please [contact the moderators of this subreddit](/message/compose/?to=/r/unpopularopinion) if you have any questions or concerns.*"
2635,2020-11-09 14:24:11,jqyab4,That’s my boy jamie ‼️‼️
2636,2020-11-09 14:31:09,jqyab4,"Oh my god. That was huge. Shit you had alot of perseverance.

I love how much you love Iridescence. It's my go to BH album when I wanna listen to a whole concept/mood. It's probably my #1 as well, though I dont like picking favourites.

I tend to forget about Sat 2 and listen to Sat 3 more. 

But I gotta disagree with ATT, I totally get why the boys dont technically claim it as one, and why you think it's just ok. It is essentially a demo. But it's a bloody good demo and I love Michigan/Palace/Infatuation. 

I dont find Sat1 to have many outstanding tracks, though GOLD has grown on me again. But like you say. HEAT is a fucken banger. It's the stand out track on Sat 1.

Ginger is a hard one for me to rank cause you gotta be in the right mood for it, and when you are, its brilliant. But if your not, it changes your emotion. J think lyrically its outstanding. Joba on BIG BOY and LOVE ME FOR LIFE  is some of his best work. 
ST.PERCY is my overall favourite track on it.

Anyway thanks for the in depth review."
2637,2020-11-09 17:21:13,jqyab4,DEADASS WE HAVE THE SAME EXACT RANKINGS AND OPINIONS. I agree with everything you said 100%.
2638,2020-11-09 17:50:55,jqyab4,My thoughts EXACTLY. Nicely done!
2639,2020-11-09 16:58:51,jqyab4,Love the review!! I don’t agree with everything but you explained it really well and it was fun reading it. Btw the person whispering on fabric is Merlyn
2640,2020-11-09 17:19:25,jqyab4,"The reason that Ameers voice sounds the way it does is because he layered multiple takes of his verse

Edit: just read all the way through. I love that you went into detail on the verses and the beats themselves"
2641,2020-11-09 19:20:21,jqyab4,i would rank saturation 3 as first because i just like the constant energy from it
2642,2020-11-09 20:43:08,jqyab4,There are some great songs on All American Trash. The issue is that they aren't in their standard formula and this could be considered an overall bleak project.
2643,2020-11-09 22:38:37,jqyab4,ameer voice effect on stupid? what? he has none
2644,2020-11-09 17:34:16,jqyab4,"Oh holy shit you're right
That's sounds absolutely nothing like him but I still love it"
2645,2020-11-09 14:01:26,jqy3fg,"Hi, we have a [moratorium](https://www.reddit.com/r/AskReddit/comments/j44ppb/moratorium_on_questions_related_to_us_politics/) on questions related to US Politics until further notice and your post has been removed. Please try a political subreddit or use /r/FindAReddit to find an applicable subreddit for your post.

*I am a bot, and this action was performed automatically. Please [contact the moderators of this subreddit](/message/compose/?to=/r/AskReddit) if you have any questions or concerns.*"
2646,2020-11-09 14:42:13,jqxna1,haha look at this loser biden supporter i bet he doesn't even know the lyrics to devil in a new dress
2647,2020-11-09 15:12:27,jqxna1,Kanye won prepare the West Wing dotard 😎
2648,2020-11-09 15:14:31,jqxna1,🤬🤬i only listen to real musics like taylor swift and eminem fuck youure dress devil song
2649,2021-02-10 23:30:15,jqxiwc,yooo
2650,2021-02-10 23:30:31,jqxiwc,u/profanitycounter
2651,2020-11-09 15:23:06,jqwql1,"Thank you for submitting to /r/unpopularopinion, /u/bookey8. Your post, *Kanye west is not a genius and he is delusional.*, has been removed because it violates our rules:


Rule 2: Do not post low effort/satirical posts.

Please make sure your post title is your opinion (not the topic you're discussing), and the text beneath is a clear explanation and justification of your opinion. If you cannot write at least a few sentences on the matter, you may want to have more of a think about it. If that's all in order...

Any opinion that is not well thought out, or is incoherent, internally contradictory or otherwise nonsensical is subject to removal.

Finally, any satirical/troll posts, as funny as you must be, are not tolerated. There are subreddits for that, this isn't one of them.

If there is an issue, please message the mod team at https://www.reddit.com/message/compose?to=%2Fr%2Funpopularopinion Thanks!"
2652,2020-11-09 13:47:18,jqwql1,"If this is unpopulor, please kill me"
2653,2020-11-09 12:30:09,jqwql1,He's a gay fish.
2654,2020-11-09 13:46:35,jqwql1,He is on another level. Hes bipolar and goes on and off his meds. Thatll make anyone a bit kooky in the head.
2655,2020-11-09 13:47:31,jqwql1,"Watching him on that Joe Rogan podcast last week showed me that, the man straight up doesn't know what's going on"
2656,2020-11-09 12:33:27,jqwql1,This is common sense
2657,2020-11-09 14:04:46,jqwql1,DON'T LET ME GET IN MY ZONE
2658,2020-11-09 13:48:08,jqwql1,The only person this is unpopular with is Kanye west.
2659,2020-11-09 12:53:24,jqwql1,I think the biggest Ye fans know that he isn’t the sharpest tool in the shed.
2660,2020-11-09 13:53:31,jqwql1,I don't think this is an unpopular opinion.
2661,2020-11-09 14:05:21,jqwql1,People mistake the word genius. He can both be a musical genius and need help. It is no secret that he suffers from Bipolar disorder. I’m sorry you had to deal with the arrogant Kanye camp. But I’m telling you there is no denying he’s a musical genius who needs mental help. A lot of geniuses suffer from mental illness
2662,2020-11-09 14:01:35,jqwql1,"Musically, he is quite genius. The way he utilizes the human voice and pioneered in a lot of things that are now commonplace. 

Mentally, I feel like a lot of people feel the need to comment on his health without understanding all that West himself has said about it in his music. Those ""I AM A GOD"" highs are often fueled by ""I want to harm myself"" lows., but people seem to think the first half is all that is to his in reality bipolar psyche. 

I'm a fan of his records, and seeing him definitely makes me sad. I want the dude to get some therapy or something that can further help him think about the way he approaches something and mentality because bipolar disorder is tough stuff man. 

I remember Mariah Carrey, and the way she talked about further being able to understand and control, for lack of a better word, the way she thought and approached things, as well as incorporating helpful drug and medication into it, and something like that would really benefit Kanye. 

Lastly, this isn't really an unpopular opinion? People saying he's a genius are 99% of the time referring to his creative abilities. Most people are aware of his public appearances and usually categorize him as an idiot but idk."
2663,2020-11-09 14:11:01,jqwql1,"From my experience whenever people call Kanye a genius it's in reference to him being a musical genius, which is reasonable. He definitely is one of the best producers in rap history, but he is by no means a genius in anything but producing."
2664,2020-11-09 14:11:19,jqwql1,"I mean he’s certainly a musical genius, he wrote or was a producer on multiple best-selling albums and changed how rap was made by his use of sampling."
2665,2020-11-09 13:57:39,jqwql1,Smart enough to admit defeat in the election....
2666,2020-11-09 14:12:49,jqwql1,"He is a musical genius, a generational trend-setter, and once upon a time, he was an upstanding role model.  Yes he needs help though."
2667,2020-11-09 14:01:56,jqwql1,"He’s got mental issues.. that’s it.. he’s not super smart or delusional, he’s struggling and trying his best to cope, if anything I sympathise with him.. he needs help and it’s sad to see that he’s not getting it"
2668,2020-11-09 13:24:17,jqwql1,You can insert many a name here.
2669,2020-11-09 13:32:27,jqwql1,You don't say
2670,2020-11-09 13:35:51,jqwql1,"Insanity and genius is a thin line. Kanye is able to channel that craziness into music.

I personally think insanity is chaotic intelligence and genius is ordered intelligence.

Kanye does have chaotic moments."
2671,2020-11-09 12:31:50,jqwql1,"His family basically said the same thing, not sure why people are not dropping him. His clothes and shoes are ugly af too and there is absolutely nothing original about any of them."
2672,2020-11-09 13:14:08,jqwql1,"So you’re telling me that Atlanta’s very own and finest, Kanye Pablo Yeezy Yeezus the Louis Vuitton Don West is not a genius and is not right in the head? 

You need some help, man"
2673,2020-11-09 13:58:06,jqwql1,"I mean. He went from being $50 mil in debt, to having a net worth of $1,3B USD, so he is kinda smart regarding making money."
2674,2020-11-09 14:15:33,jqwql1,"He is not a genius in the elon musk or Einstein sense.

He is a musical genius though. Anyone remotely involved in the hip hop or rap genre could not reasonably deny his genius.

Not his lyrics, because his lyrics can be really fucking hit or miss. His ear for production is still some of the best in hip hop, or better yet, it used to be. 

People that don't listen to him are probably just aware of his antics, but to deny the influence he has had in music would be just exceptionally arrogant."
2675,2020-11-09 14:07:58,jqwql1,Where in the hell is this unpopular ?
2676,2020-11-09 13:33:19,jqwql1,"i mean, yeah lol"
2677,2020-11-09 13:58:31,jqwql1,South park was faster on the trigger
2678,2020-11-09 14:20:09,jqwql1,"Musically, he is a genius. Really depends on your definition of the term."
2679,2020-11-09 15:02:28,jqwql1,You can be a genius AND also be delusional.
2680,2020-11-09 14:15:39,jqwql1,"I think genius comes in many forms. Kanye is a musical genius if there ever was one. He has such a huge body of work and he’s been incredibly influential on music. 

In all other aspects, yeah he’s definitely not a genius"
2681,2020-11-09 13:07:31,jqwql1,"""Kanye for Jaw Re-Wired Shut"" has my vote..."
2682,2020-11-09 14:17:05,jqwql1,This is the definition of a popular opinion. Where are the mods
2683,2020-11-09 13:26:10,jqwql1,"Who the hell do hang around to think this isn't a popular opinion. OP, you need new friends."
2684,2020-11-09 13:53:45,jqwql1,Define genius? He is a genius in music production. What do you mean by genius
2685,2020-11-09 13:25:05,jqwql1,His wife is in a coven of real witches who control him with mk ultra. Prove me wrong
2686,2020-11-09 14:06:03,jqwql1,"Those two things do not exclude one another.. musically he is pretty close to a genius. But socially, intellectually, ethically etc. he is absolutely delusional."
2687,2020-11-09 14:02:32,jqwql1,This isnt an unpopular opinion its widely acknowledged he goes off his meds because he says it stops him from being creative and he goes bonkers
2688,2020-11-09 14:10:20,jqwql1,He is a troll after all.
2689,2020-11-09 14:17:30,jqwql1,"Kanye isn't a genius in general, hes a musical genius specifically. A lot of his songs ant albume were very influential and ahead of their time. Also hes bipolar which explains his behavior for the most part"
2690,2020-11-09 14:21:36,jqwql1,I couldn’t tell you the last time I saw an unpopular opinion on this sub.
2691,2020-11-09 14:22:40,jqwql1,"I mean, he's definitely a musical genius, but has severe personal and mental health issues that he needs to sort out. Sure there's probably a small subset of stans who truly believe he's a genius through and through, but even among his fans this opinion is nowhere near unpopular, let alone among the common population."
2692,2020-11-09 14:28:31,jqwql1,"He is a genius, but not a genius in the sense you think. He is a genius when it comes to music, when it comes to production, when it comes to promotion, and when it comes to getting his message out. He is not a genius when it comes to common sense, history, politics, or anything a musician shouldn’t really need to let their opinion on. And, from personal experience knowing people who work with him, the man does not want help. He’s actually a very normal guy, it’s just in the public he tends to act crazy. He’s a genius until he’s in the public eye, he was a genius until he lost his mom and fiancé, he was a genius until things started going wrong. He’s a genius, but he’s not a genius in the way you thing.

Also no, your opinion is not “unpopular”. Find a better sub for this"
2693,2020-11-09 14:31:35,jqwql1,"""May make good music""??? Why don't you do it then? A lot of people trying to triviallize accomplishment to suit their arguments SMH."
2694,2020-11-09 14:31:46,jqwql1,"In music, he's a mf god. In every other things, not even a bit"
2695,2020-11-09 14:32:57,jqwql1,You are mad because you didnt understand a joke huh
2696,2020-11-09 14:34:56,jqwql1,"sorry, this is actually a very popular opinion. Its common knowledge now that hes fuckin crazy, has been for a while. Whats your next unpopular opinion? That Trumps an asshole?"
2697,2020-11-09 14:40:18,jqwql1,"Kanye West is absolutely a *musical* genius. It's difficult to make a convincing argument against that claim. His work has changed the landscape of modern hip hop on multiple occasions. Period.

He's also a deeply troubled person whose delusions of grandeur are a symptom of his mental illness. It's unfortunate for him that his massive fame exacerbates that issue and that every word he says is splattered on the front page of newspapers and magazines. 

But as Kanye himself said... ""name one genius that ain't crazy."""
2698,2020-11-09 14:44:33,jqwql1,"Do other people call Kanye a genius?
I've only heard him calling himself a genius."
2699,2020-11-09 14:50:38,jqwql1,"Hey, he's the most impactful artist of our time, or something like that. His words, not mine."
2700,2020-11-09 14:51:17,jqwql1,"When he compared himself to Shakespeare, I actually got pissed off."
2701,2020-11-09 14:52:15,jqwql1,"Not unpopular, any person with a slightest amount of sense will know the Kanye is not a genius. He is delusional but because of his mental health, I have bipolar myself so I can somewhat understand. He is also apparently off his meds which will only make him worse. It’s a shame because I love his music and I’m inspired by his creative process but that’s as far as it goes. I don’t idolise him like some idiots do."
2702,2020-11-09 14:53:05,jqwql1,The Kanye stans are brainwashed it’s annoying listening to them rave on about a lunatic.
2703,2020-11-09 14:54:28,jqwql1,"He's a dumbshit with a god complex. He writes okay lyrics, which is only at par with the best of hip-hop. His tunes and melody suck."
2704,2020-11-09 14:54:39,jqwql1,"Calling him insane isn't productive, it's just rude and insensitive to his mental illness. The udder disrespect for people with mental illness in this comment section is revolting and makes me sick to my stomach."
2705,2020-11-09 14:55:00,jqwql1,"Hey OP, just to be clear, Kanye is a fucking idiot, and so is Joe Rogan."
2706,2020-11-09 14:56:37,jqwql1,He makes good music?
2707,2020-11-09 14:57:10,jqwql1,He isnt insane dude is dumb AF and doesnt like black people lol.
2708,2020-11-09 14:59:28,jqwql1,Honestly i dont even think he makes good music either xD
2709,2020-11-09 15:00:22,jqwql1,"Alright now, in unison. 

*sings*

""This sub is dead."""
2710,2020-11-09 15:01:58,jqwql1,"He isn't delusional,  he's a fucking idiot."
2711,2020-11-09 15:02:30,jqwql1,"The guy is not a genius, he has some serious mental issues and the people around him would rather use that to stir up drama than allow him to get the medication he so desperately needs."
2712,2020-11-09 15:03:09,jqwql1," I prefer the term ""narcissistic asshole"" to describe West."
2713,2020-11-09 15:03:42,jqwql1,I’m waiting for him to run for president at the age of 70 while on his third wife. Maybe his slogan could be “Make America Great Again”?
2714,2020-11-09 15:03:53,jqwql1,People who think Kanye is “revolutionary” or some type of under appreciated genius are just justifying their shitty taste
2715,2020-11-09 15:05:04,jqwql1,"It’s just people that are doing the stupid “to be fair, you have to have a pretty high IQ...” trope to try to make themselves feel smart"
2716,2020-11-09 15:05:12,jqwql1,"Wait people were being serious when they said that. I always took the whole, “he’s on another level,” thing as a joke."
2717,2020-11-09 15:05:50,jqwql1,"People call him a genius cause he is a self made billionaire , although some fans really exaggerate the level og genius"
2718,2020-11-09 15:05:53,jqwql1,He's bipolar and borderline. He's really messed up
2719,2020-11-09 15:22:10,jqwql1,Also his music is mediocre and unoriginal at best.
2720,2020-11-09 15:04:10,jqwql1,Kanye is what happens when you take an exceedingly average person and convince him that he’s a genius.
2721,2020-11-09 14:08:32,jqwql1,This is unpopular? Lol
2722,2020-11-09 14:14:51,jqwql1,"I think that people mean that he is a genius in the music industry, and somewhat in the fashion industry. I disagree that he is a genius overall, but I think that he is still a smart man. He has many mental health issues, and often this makes him look less with it than he actually is. However you feel about his music, you absolutely cannot deny the affect he has had on music and hip hop. 808’s and Heartbreaks set the stage for hip hop and pop singers who didn’t have perfect singing voice, and he allowed these people to know it’s alright to use auto tune. He almost used it as an instrument in his music, often distorting it to sound less like his voice, like in runaway off of MBDTF. He is also a major part in opening the door for men in hip hop to express negative emotions. Before 808’s hip hop was all brovado, but now a days, new “emo rappers” and even popular rappers like drake say that this is their most influential album of all time. He is also an amazing producer who has an uncanny ability to make amazing beats, and is constantly pushing the idea of hip hop forward. Simultaneously, he has been attempting to expand his yeezy brand. He has sold millions and regardless of how u feel about the look of them (personally not my favorite, but I understand why people do like it), you have to acknowledge the importance of this. Sure he can be an asshole, and Is sometimes crazy, but the amount he has changed the hip hop and pop genre is amazing."
2723,2020-11-09 14:15:13,jqwql1,"I think the problem is with people like you who take him so seriously. The Kanye you see in public is a character, how far away or how close that is to the person behind this character is unclear. But I see what he does as art in a way. He is a single person, a public figure who constantly accomplishes controversy. You would think that at some point people would be tired and could‘t be shocked anymore. But he always follows through with something new. His fashion, music, family, political endeavors seem to shock people again and again. He marries a woman who is only known for a sex tape, but he defends her against all attacks and declares here as his true love, he releases clothes that cause media outrages for weeks. He sides with the most controversial president yet only to then run himself for president. He get‘s massive responses to his tweets. He has a drastic turn towards religion which also caused heated debates among fans and critics. And that‘s not even mentioning his music, which, unarguably is extremely artistically valuable, at times controversial, self reflective while deceptive and imo among the most important musical work of this century. And I think Kanye as this public figure holds a mirror up to the society around him. He didn‘t make Trump president, he isn‘t the first person who has their very own take on what it means to be christian, he is not the one who brought the fashion industry to where it is and so on. That‘s why the responses are so strong. He‘s one guy, he doesn‘t matter. You can ignore him, but the things you hate about him are always there, he just put‘s them in a spotlight."
2724,2020-11-09 14:24:28,jqwql1,He’s a musical GENIUS
2725,2020-11-09 13:49:38,jqwql1,He’s an idiot who can make music. He’s not the first and he won’t be the last
2726,2020-11-09 14:09:30,jqwql1,I’m not sure I can live in a world where this isn’t a known fact
2727,2020-11-09 14:09:43,jqwql1,This ain’t unpopular
2728,2020-11-09 14:09:44,jqwql1,"a little column a and a little column b.

i don't know if id say genius. but he seems pretty creative."
2729,2020-11-09 14:10:11,jqwql1,The man is batshit crazy. The JRE podcast was amazing in that regard. It exceeded my wildest expectations. Listening to Posty on shrooms for 3 hours was less out there.
2730,2020-11-09 14:11:22,jqwql1,"honestly, I think that he went through some kind of mental health episode. Instead of recieving treatment he was idolized by media and his mania enforced. And here he is, with some terrible god complex. Give the man some therapy, for the love of god."
2731,2020-11-09 14:11:28,jqwql1,"Because he is a musical genius, all of his manic and mental health disease  are labelled as ""artistic direction"" and his fan rationalize his erratic behavior. If the dude was working any other field without these kind of ""weird artist"" stereotypes, he would be called for what he is: a sick man."
2732,2020-11-09 14:11:52,jqwql1,OK I’m going to listen to that podcast now. I’m biased head of time but I will try to have an open mind. .... OK I went and looked ... that’s a three hour investment. I’ll just stay biased and vote with you.
2733,2020-11-09 14:12:01,jqwql1,Uhm I thought was the popular opinion
