,Timestamp,SubmissionID,Comment
1724,2020-11-09 06:58:47,jqpkto,"No I agree that's what the republicans will try to do, but I'm not so sure they'll succeed. The democrats know it's coming and are mostly sick and tired of ""rules for thee but not for me"" from the republicans. I can't say for sure, unfortunately there are a few democrats who will probably make noise about wanting to keep it, but most of the ones who would be primed to raise that objection might still go along with it if there's some time pressure stopping them from finding an alternative solution. Say, for example, much needed economic stimulus? It may force democrats to make a decision and I'm cautiously optimistic about how that would turn out. We also will need to lobby our senators and assure them that it is actually what the voters want."
1725,2020-11-09 07:31:19,jqpkto,"oh, no doubt, but like, twitter memes are funny and reddit is relatively ok for subtopics."
1726,2020-11-09 04:55:51,jqpkto,Well I stand corrected!
1727,2020-11-09 05:43:56,jqpkto,"The taxes will come from the middle class, not the wealthy.  When do rich people ever get taxed?"
1728,2020-11-09 06:19:07,jqpkto,I feel so bad for laughing as long as I did at that.
1729,2020-11-09 05:51:35,jqpkto,A bruno powroznik classic
1730,2020-11-09 06:01:13,jqpkto,STEVE JOBS IS DEAD
1731,2020-11-09 06:16:52,jqpkto,Where were you when Thatcher is kill?
1732,2020-11-09 06:20:09,jqpkto,DING DONG THE WICKED BITCH IS DEAD
1733,2020-11-09 06:41:45,jqpkto,That’s messed up.  Funny though
1734,2020-11-09 05:57:14,jqpkto,Hence why the song charted.
1735,2020-11-09 06:13:12,jqpkto,"Amazingly so, yes"
1736,2020-11-09 06:43:40,jqpkto,"""somehow""

Capitalism (tm)"
1737,2020-11-09 12:08:57,jqpkto,[deleted]
1738,2020-11-09 04:22:30,jqpkto,Leaving someone at a Buckys is probably a felony. At least find a Casey's or Kum & go.
1739,2020-11-09 05:41:27,jqpkto,Love you too bro
1740,2020-11-09 06:20:58,jqpkto,As an Oklahoman it’s my favorite part of my drive to Dallas
1741,2020-11-09 06:03:40,jqpkto,"Texas Buc-ee’s got some national recognition for best restrooms ever too. We sure they’re not the same? Lol or one of the similarly named chains Buc-ee’s either has or is planning to sue....

Edit: [Oh nvm, they already tried... twice.](https://www.google.com/amp/s/omaha.com/money/nebraska-beats-texas-buckys-defeats-buc-ees-in-court-fight-over-convenience-stores-similar-names/article_7036b784-a0d9-574a-be52-fb18fef8bc1b.amp.html)

Wow, one within 15 miles of Buc-ee’s in Houston? Petty."
1742,2020-11-09 06:34:59,jqpkto,Pet moose. All season type of animal.
1743,2020-11-09 06:50:56,jqpkto,"Yeah, and it could also be anyone in the world. Anyone could make that joke and just replace ""Canada"" with ""[insert country]"""
1744,2020-11-09 06:29:56,jqpkto,He's so vain he probably thinks this post is about him.
1745,2020-11-09 06:54:35,jqpkto,"They won’t change the filibuster rules. It’d help them now, but become a dangerous weapon in the hands of a Republican majority. There isn’t enough democrat support. It’s not going to happen.

Therefore, anything passed will need to be poisoned by Mitch first."
1746,2020-11-09 07:09:41,jqpkto,"[CNN details it much better than I can](https://www.cnn.com/2020/11/08/politics/democrats-mcconnell-veto-biden-agenda/index.html), and I don’t see a dramatically different Democratic Party than we did in 2016. Sure, we have some progressive members of Congress, but it’s not enough. Biden is too moderate. He’ll bend. I’ll take him over Trump any day, and he’s what the country needs to at least correct the course. But he’s not the one to advance the agenda. He’s not going to fight McConnell the way we want him to. The path of least resistance is to compromise, and that’s what we’ll get.

We put out the fire. That’s not nothing, but I don’t have the hope that we’ll make actual progress."
1747,2020-11-09 06:26:39,jqpkto,*That's* the point.
1748,2020-11-09 06:38:03,jqpkto,r/jlenoconel Buck up. Buttercup.
1749,2020-11-09 06:23:44,jqpkto,WALT DISNEY IS DEAD
1750,2020-11-09 06:46:56,jqpkto,"Yeah but don't tell it out loud, you may end up being labeled as socialist scum if you point out there's something wrong with the system"
1751,2020-11-09 06:47:51,jqpkto,Crony capitalism =/= free market capitalism
1752,2020-11-09 18:35:23,jqpkto,"Whooosh.
You missed the point. The concern is that taxpayers will have to bail out public pension schemes.
My question was an attempt to get some answers."
1753,2020-11-09 06:15:22,jqpkto,Buckees is heaven
1754,2020-11-09 06:29:10,jqpkto,"idk what bucees you’ve been to but no caseys can even come close

i’m not sure corn country even has an equivalent"
1755,2020-11-09 06:57:49,jqpkto,But I don’t get it the republicans were passing votes with a 50-50 tie?
1756,2020-11-09 09:56:24,jqpkto,"I don't know. I'm not confident, but I think with the political moment right now there's a decent chance the democrats say ""fuck it"" and just start passing some stuff.

Although I still think what I thought back in 2017, the democrats should've philibustered something awful the republicans wanted to do and forced them to kill it. If you're not going to use it there's no point in having it and if it's going to be destroyed you can at least make them have to pull the trigger. I still don't know why none of them did that."
1757,2020-11-09 06:58:00,jqpkto,Why is the bad shit of capitalism labeled crony but socialism doesn't get the same treatment?
1758,2020-11-09 15:17:38,jqpkto,"Money will always congregate in the hands of fewer and fewer people over time in a capitalist system, crony or otherwise."
1759,2020-11-09 06:29:21,jqpkto,Their slushie selection is bullshit and you know it
1760,2020-11-09 06:31:05,jqpkto,138 and Q usually smells like burnt plastic and the one on 84th north of I 80 has lukewarm beer. Pathetic
1761,2020-11-09 07:04:28,jqpkto,"Like, I'm from Iowa and I can readily admit that neither Casey's nor any other gas station comes close.

I will, however, defend Culver's as superior to Whataburger until the day I die."
1762,2020-11-09 07:00:17,jqpkto,"Democrats tend to play fair and only filibuster when absolutely necessary. Republicans don’t care and will obstruct every little thing. It’s about the long game. But not letting Biden get anything done, they can paint him and the rest of the party as ineffective in the next election."
1763,2020-11-09 06:33:01,jqpkto,"you thinkin of buckys were talkin about bucees

does nebraska have anything good or is it just a pit stop on the way from bucees country to culvers country"
1764,2020-11-09 07:07:07,jqpkto,i’ll give you guys caribou over starbucks but does culver’s have honey butter chicken biscuits at 4am when you’re smashed or high
1765,2020-11-09 06:42:02,jqpkto,"Nebraska has the two best fast food restaurant chains in the world, Runza and Don & Millie's. We also have the 6th best education system in the country and the #1 zoo in the world. Add in the best beef in the nation and we are doing alright."
1766,2020-11-09 18:23:49,jqpkto,Better. They've got cheese curds and custard.
1767,2020-11-09 07:59:18,jqnql4,**I LOVE THE MILEY!!**
1768,2020-11-09 02:04:56,jqnl1p,"This is written like an Onion article, but for real life."
1769,2020-11-09 02:07:52,jqnl1p,Meanwhile Mr. Brightside has never left the British charts....
1770,2020-11-09 02:00:41,jqnl1p,This is some of the best reporting I’ve seen in a long time
1771,2020-11-09 01:59:46,jqnl1p,"*For similarly mysterious reasons, “Bye Bye Bye,” in which NSYNC bids farewell to a cruel puppetmaster driving their lives relentlessly into the shitter, has meanwhile broken into the Top 200 in just the last hour.*

Truly a historic day for early 2000s boy bands who have very specifically titled songs."
1772,2020-11-09 02:24:17,jqnl1p,"My local public radio station request show yesterday:

“Oh Happy Day” Edwin Hawkins Singers
“Celebration” Kool & the Gang
“Give the People What They Want” The O’Jays
“Power to the People” John Lennon
“Orange Crush” R.E.M.
“Tears of a Clown” Smokey Robinson & the Miracles

Shout out WXPN! I can honestly say I have never cracked up listening to Orange Crush before yesterday."
1773,2020-11-09 02:36:15,jqnl1p,"This reminds me of how ""Ding Dong The witch is dead"" was suddenly being downloaded off of iTunes by everyone when Margaret Thatcher died.

And just as richly deserved."
1774,2020-11-09 02:04:56,jqnl1p,That miley song is the jam.
1775,2020-11-09 01:31:50,jqnl1p,I wonder why
1776,2020-11-09 02:36:32,jqnl1p,"The ""you about to lose yo job"" video mix is my favorite.......

Edit: Heres the video

https://m.youtube.com/watch?v=wKopSVjM-Oc"
1777,2020-11-09 03:08:51,jqnl1p,"Party in the U.S.A. is such a banger that I refuse to call it a guilty pleasure cause I'm not guilty at all, even as your stereotypical looking metal head."
1778,2020-11-09 02:03:23,jqnl1p,[removed]
1779,2020-11-09 03:37:34,jqnl1p,My kid keeps playing See You Later Fuckface by Green Day.
1780,2020-11-09 01:57:47,jqnl1p,"After a decade or so, we listened to both this weekend. Maturity against adults is a game that’s trending (Cards Against Humanity for kids) and those songs were answer cards."
1781,2020-11-09 02:13:59,jqnl1p,"Mojo Nixon's ""Donald Trump can suck my dick"" meanwhile is being ignored."
1782,2020-11-09 03:06:23,jqnl1p,I wouldnt be partying in the USA just yet with us hitting all time high covid-19 cases...
1783,2020-11-09 03:24:25,jqnl1p,"""For some reason"""
1784,2020-11-09 02:49:16,jqnl1p,Wish Ray Charles would get in again with Hit the Road Jack.
1785,2020-11-09 02:56:21,jqnl1p,[deleted]
1786,2020-11-09 01:58:31,jqnl1p,[deleted]
1787,2020-11-09 03:17:42,jqnl1p,"Also great Miley Cyrus is no fan of Trump anyways, so it fits even more."
1788,2020-11-09 02:45:38,jqnl1p,What about YMCA?
1789,2020-11-09 03:33:46,jqnl1p,"Haha, I definitely listened to both of these during my dance party for one yesterday, along with Cee-Lo Green’s “Fuck You” and “Here Comes the Sun.”"
1790,2020-11-09 01:56:19,jqnl1p,[This video](https://youtu.be/ozk0ATYOTW4) gave me a good laugh today
1791,2020-11-09 02:40:02,jqnl1p,"we were this close to David Bowie's ""I'm Afraid of Americans"" charting"
1792,2020-11-09 01:46:05,jqnl1p,No love for YG?
1793,2020-11-09 02:28:57,jqnl1p,Weird I wonder if something happened
1794,2020-11-09 03:55:33,jqnl1p,Party in the USA still has one of the catchiest riffs in a pop song
1795,2020-11-09 06:57:12,jqnl1p,Party in the USA is legitimately a wonderful pop song. It’s the epitome of a classic.
1796,2020-11-09 07:21:36,jqnl1p,"If anyone's wondering why ""Bye Bye Bye"" is peaking now it's post breakup song from an abusive relationship. 90s kids will know."
1797,2020-11-09 02:26:45,jqnl1p,I heard bye bye bye coming out of a car as I crossed the street today. it all makes sense now
1798,2020-11-09 03:03:48,jqnl1p,"Weird Al's ""Party in the CIA"" also on the rise"
1799,2020-11-09 02:27:52,jqnl1p,BTS arrested by ATF because they're dynamite
1800,2020-11-09 03:05:38,jqnl1p,"Uh, because they are absolute bangers?"
1801,2020-11-09 03:14:50,jqnl1p,"I was born in 1994, and grew up with *NSYNC....I never realized that was how they spelled it."
1802,2020-11-09 03:17:31,jqnl1p,"I'll just leave this here.
https://youtu.be/WkZ5e94QnWk"
1803,2020-11-09 03:55:45,jqnl1p,"""Hit the Road Jack"" - Ray Charles https://www.youtube.com/watch?v=_txAdifulHg"
1804,2020-11-09 06:57:30,jqnl1p,I think America is trying to get its happy back
1805,2020-11-09 02:34:36,jqnl1p,how are her fingers holding up that peace sign
1806,2020-11-09 04:18:14,jqnl1p,"LMAO AV club reporting the real facts we need right now. 

I’ve been playing a lot of YMCA, Kids in America, and Stayin’ Alive. My “Bye 45” playlist is pretty stacked."
1807,2020-11-09 05:51:56,jqnl1p,"Bottom of the article, after an ad:

>In other news: YG and Nipsy Hussle’s “FDT” has now also entered the iTunes Top 10, because, seriously: Fuck Donald Trump."
1808,2020-11-09 09:17:33,jqnl1p,This is the *Ding Dong the Witch is Dead* of the US
1809,2020-11-09 02:19:07,jqnl1p,"A bunch of drunk girls pulled up to the apartment across the street last night, seemingly drunk blaring party in the USA, but I had to just sprayed champagne so what can I say."
1810,2020-11-09 03:04:39,jqnl1p,[deleted]
1811,2020-11-09 04:47:19,jqnl1p,Thats only because the mail in songs havent been counted yet
1812,2020-11-09 02:07:23,jqnl1p,"We need 2 Live Crew's ""Get the F*** Out of My House"" to chart."
1813,2020-11-09 03:31:15,jqnl1p,"Okay, but Miley Cyrus’s Party in the USA is a banger."
1814,2020-11-09 03:53:23,jqnl1p,Fdt
1815,2020-11-09 09:30:45,jqnl1p,Bruh I remember watching the inauguration of Obama in my social studies class and this fucking song was played by my teacher.
1816,2020-11-09 13:07:44,jqnl1p,"🎵Put my hands up they're playing my song, the orange guy's going away!🎵"
1817,2020-11-09 14:55:50,jqnl1p,The entire USA has been partying and saying bye bye bye to the incompetent fake bake.
1818,2020-11-09 18:46:27,jqnl1p,Probably has a lot to do with One Pump Trump.
1819,2020-11-09 01:04:07,jqnl1p,Perfect.
1820,2020-11-09 03:58:29,jqnl1p,"Ngl I played Party in the USA Saturday Morning while drinking champagne.

Fuck trump."
1821,2020-11-09 03:34:18,jqnl1p,First 2 songs I put on [my playlist](https://open.spotify.com/playlist/3JFqYRQa8gdzCisFs9U4o3?si=qDQgxF6LSbKiAS2rYqcCgQ)
1822,2020-11-09 03:38:57,jqnl1p,"My favorite is from the album Tommy by The Who:

“I have a feeling ‘21 is gonna be a good year...”"
1823,2020-11-09 03:43:09,jqnl1p,Thanks tiktok
1824,2020-11-09 04:11:33,jqnl1p,"Coincidentally, we’ve been listening to Party in the USA because my 2 yr old tinkled in the potty and I lied to my kids about the lyrics."
1825,2020-11-09 04:25:45,jqnl1p,"I definitely played party in the USA and shot off fireworks this weekend. Glad to know I wasn't the only one who played that song. I heard plenty of other fireworks of course, lol"
1826,2020-11-09 04:38:54,jqnl1p,Hmmm a mystery for sure.
1827,2020-11-09 04:42:57,jqnl1p,The US knows why
1828,2020-11-09 06:24:44,jqnl1p,[deleted]
1829,2020-11-09 07:56:23,jqnl1p,It’s just cuz of tiktok.
1830,2020-11-09 13:03:17,jqnl1p,Probably because of Donald Trump losing the election.
1831,2020-11-09 13:34:04,jqnl1p,"In two weeks the trending song will be ""Where is my mind?"" by the Pixies."
1832,2020-11-09 14:54:29,jqnl1p,for some reason
1833,2020-11-09 15:01:48,jqnl1p,Sounds like Anthems people are playing to Donald losing.
1834,2020-11-09 02:10:14,jqnl1p,That article was a joy to read. 10/10.
1835,2020-11-09 02:33:07,jqnl1p,"Gee, I wonder why."
1836,2020-11-09 02:37:36,jqnl1p,"Oh shit, the house across the street was blasting this yesterday. I'm in a red state, so it was a nice surprise after months of drunkenly crawling the streets, screaming at the trump supporters to come out and physically fight me."
1837,2020-11-09 03:29:22,jqnl1p,"Being down on BLM plaza today, there was a lot of Bob Marley, Michel Jackson, Marvin gay, Latin music, and European techno.

I heard the rap song:  “fuck donald Trump” on repeat coming from trikes.

I did here Miley once.  Did not hear “bye bye bye” but it would have been a crowd pleaser."
1838,2020-11-09 03:28:38,jqnl1p,Tell me why
1839,2020-11-09 02:49:57,jqnl1p,"Anyone into industrial/ebm check out the melodic Aesthetic Perfection cover of “Bye, Bye, Bye”"
1840,2020-11-09 03:15:33,jqnl1p,"Did they mEAn weird Al's ""party in the CIA""?"
1841,2020-11-09 03:17:16,jqnl1p,“some reason” we all know what the reason is LMAO
1842,2020-11-09 03:23:02,jqnl1p,I went and watched a clip of “Ding dong the wicked witch is dead” from The Wizard of Oz yesterday. Thought it was fitting.
1843,2020-11-09 03:37:14,jqnl1p,this is great news.
1844,2020-11-09 03:40:38,jqnl1p,"Oh, believe me. Everyone knows why."
1845,2020-11-09 03:49:25,jqnl1p,NSYNC slaps no matter what year it is
1846,2020-11-09 03:51:33,jqnl1p,Wait a second why did they suddenly become poular ag- oh..... wait a minute.... methinks i know why....  ;)
1847,2020-11-09 04:31:35,jqnl1p,I can honestly say I’ve been contributing to this from Spotify.
1848,2020-11-09 04:51:15,jqnl1p,"""All you fascists bound to lose"" from the Resistance Revival chorus has been making the rounds in the house hold as well."
1849,2020-11-09 05:01:21,jqnl1p,Might sound crazy but it ain’t no lie.
1850,2020-11-09 05:07:40,jqnl1p,"Okay, let me say I haven’t thought of this song in a long time.. But sometime in the last 72-96hrs I have had rhat song stuck in my head despite not hearing the song in years or seeing Ms.Cyrus’s face anywhere.

Spontaneous & stuck in my head that day."
1851,2020-11-09 05:08:27,jqnl1p,Oh I know a reason!
1852,2020-11-09 05:08:28,jqnl1p,“for some reason”
1853,2020-11-09 05:16:53,jqnl1p,I literally bought Bye Bye Bye on iTunes just so I could drive around my city blasting it. It was great.
1854,2020-11-09 05:20:28,jqnl1p,“Some reason” lol
1855,2020-11-09 05:26:33,jqnl1p,Suddenly I’m proud to be an American again ✨ bangers
1856,2020-11-09 05:49:19,jqnl1p,Because the nation is filled with children.  Adult children.
1857,2020-11-09 06:13:59,jqnl1p,"""Some reason"""
1858,2020-11-09 06:14:04,jqnl1p,"""Some reason"""
1859,2020-11-09 06:17:30,jqnl1p,Party in the USA is a classic.
1860,2020-11-09 06:28:25,jqnl1p,“For some reason” lmao
1861,2020-11-09 06:30:40,jqnl1p,"It's like when Margaret Thatcher died in the UK, 'ding dong the witch is dead. Went to the top of the charts."
1862,2020-11-09 07:22:47,jqnl1p,"""For some reason"""
1863,2020-11-09 07:34:59,jqnl1p,We all know the better version is party in the cia
1864,2020-11-09 08:13:02,jqnl1p,Probably people googling the Biden election celebrations
1865,2020-11-09 08:34:56,jqnl1p,"I was listening to the radio and ""what goes around comes around"" came on and it was quite fitting."
1866,2020-11-09 08:39:18,jqnl1p,We all know why. Hahaha.
1867,2020-11-09 08:54:35,jqnl1p,They’re just celebrating Biden winning why not
1868,2020-11-09 09:30:53,jqnl1p,"They need to try Lily Allen ""Fuck You"" listen to the lyrics and they fit this perfectly!"
1869,2020-11-09 09:32:57,jqnl1p,"That's so weird, I randomly thought about this song a few days ago..."
1870,2020-11-09 09:39:42,jqnl1p,There are a lot of woooosh-possibilities in the comments
1871,2020-11-09 09:58:49,jqnl1p,I wonder what possible reason there could be for that...
1872,2020-11-09 10:26:52,jqnl1p,"To be fair Bye, Bye, Bye is an absolute banger"
1873,2020-11-09 10:36:54,jqnl1p,Down With the Sickness soon to follow?
1874,2020-11-09 11:28:42,jqnl1p,Weddings have started picking back up in the US now.
1875,2020-11-09 11:33:16,jqnl1p,Omg amazing well done xx
1876,2020-11-09 14:41:44,jqnl1p,"""For some reason""..

Critical thinking died in 2012."
1877,2020-11-09 14:52:25,jqnl1p,"I’m going to guess part of this has to do with how music streaming services present artists. For example, I use Spotify, and when I type is Miley Cyrus, the first song that comes up for her is Party In The USA because it’s her most famous song still. She’s just released some new music, and is getting ready to release an album, so people are probably looking her up on their streaming service to see her new music, but the first thing that pops up is this old hit that everyone knows and is very nostalgic, so naturally they’re going to take some time to listen to that too.

I only say this because it’s exactly what happened to me so I am sure I can’t be alone in that. 


Also though, people are celebrating the election and that is a very “happy” USA song so that could have to do with it. Now that I say that, maybe people are saying “Bye Bye Bye” to Trump?"
1878,2020-11-09 15:15:47,jqnl1p,When Margaret Thatcher died the uk got ding dong the witch is dead into the charts
1879,2020-11-09 15:29:28,jqnl1p,That's means millennials celebrating.
1880,2020-11-09 15:40:09,jqnl1p,"Like ""Ding Dong the witch is dead"" charting in the UK when Margaret Thatcher died"
1881,2020-11-09 15:53:00,jqnl1p,"""Bye Bye Bye"" is mostly my fault, sorry guys, been on an N*SYNC kick all month, but glad my contribution is working."
1882,2020-11-09 16:01:56,jqnl1p,Probably because they're bangers
1883,2020-11-09 16:23:31,jqnl1p,"Narrator: ...but deep down, they all knew the reason."
1884,2020-11-09 16:26:47,jqnl1p,"“For some reason”

I think we all know the reason."
1885,2020-11-09 17:03:31,jqnl1p,I heard the news in the car on the way home from the grocery store and promptly told my Echo to play both of these songs while I put the groceries away.
1886,2020-11-09 17:11:57,jqnl1p,I won't lie I still love Party in the USA
1887,2020-11-09 17:34:42,jqnl1p,Don’t forget “f**k Donald Trump” is also a number 1 song on iTunes right now.
1888,2020-11-10 04:02:53,jqnl1p,Who even cares about any shitty charts which hardly have any real music on them
1889,2020-11-10 13:35:13,jqnl1p,"""For some reason"" lol everyone in America knows exactly why these songs are charting right now"
1890,2020-11-09 03:25:22,jqnl1p,Millennials are celebrating dumping Trump!
1891,2020-11-09 03:23:59,jqnl1p,*for some reason*
1892,2020-11-09 03:26:59,jqnl1p,Ding dong the wicked drumpf is dead
1893,2020-11-09 03:36:21,jqnl1p,"That's so weird, I've been hearing ""Na Na Hey Hey"" and ""Hit the Road Jack"" in my head pretty much nonstop for like a week now for some reason. I hope it's not a brain tumor."
1894,2020-11-09 03:37:03,jqnl1p,Is this the uniting Biden promised?
1895,2020-11-09 03:55:29,jqnl1p,"I've listened to ""Fuck You"" by Lily Allen about 20 times in the past 2 days."
1896,2020-11-09 04:24:32,jqnl1p,There's a fat reason why
1897,2020-11-09 06:26:06,jqnl1p,Probably cuz they’re bangers.
1898,2020-11-09 03:45:02,jqnl1p,Cringe
1899,2020-11-09 02:19:16,jqnl1p,"*Some reason* 

lmfao"
1900,2020-11-09 01:58:24,jqnl1p,Fingers crossed for “Call me Maybe” coming back to the top where it belongs!
1901,2020-11-09 02:18:30,jqnl1p,Someone should do a parody of 'Scotty Doesn't Know' but as 'Donny's Gotta Go'
1902,2020-11-09 04:09:43,jqnl1p,Someone was blasting Party in the USA outside on loop the day Biden took PA. Can't listen to that song without hearing Weird Al's lyrics in my head.
1903,2020-11-09 04:32:37,jqnl1p,Bye bye bye is a banger
1904,2020-11-09 06:00:51,jqnl1p,I don’t want to sound like a queer or nothin but party in the U.S.A totally kicks ass
1905,2020-11-09 04:36:10,jqnl1p,"And yet, when I posted Party in the USA here a few days ago we got up to a whopping 6 upvotes in 12 hours."
1906,2020-11-09 02:46:23,jqnl1p,"""for some reason""

...Hmm, I wonder why?  🤔"
1907,2020-11-09 02:49:14,jqnl1p,Because Kwik Trip keeps playing them twice every shift lol
1908,2020-11-09 02:53:18,jqnl1p,[for some reason indeed...](https://www.youtube.com/watch?v=rloNvQ0diwE)
1909,2020-11-09 02:56:49,jqnl1p,"""I know that I can't take no more
It ain't no lie
I want to see you out that door
Baby bye bye bye"""
1910,2020-11-09 02:59:30,jqnl1p,"You guys need to check out people’s champ by the arkells ! Perfect anti trump song !!!

https://youtu.be/Ce-K2joeCWU"
1911,2020-11-09 03:00:12,jqnl1p,"Did anyone else imagine the scene from Brooklyn 99 
https://youtu.be/ffyKY3Dj5ZE"
1912,2020-11-09 03:04:45,jqnl1p,"It's a very old, Wartime song, but I think ""Wishing Will Make It So"" by Vera Lynn is appropriate."
1913,2020-11-09 03:07:23,jqnl1p,This is how we do it in Australia [https://m.youtube.com/watch?v=oZJxSN_I2o8)]
1914,2020-11-09 03:09:06,jqnl1p,All news is real now.
1915,2020-11-09 03:10:05,jqnl1p,I randomly had that biggie smalls party n bullshit remix with this song in my head the other day... I think the simulation is breaking
1916,2020-11-09 03:12:32,jqnl1p,This is the iTunes 100 not the Billboard 100
1917,2020-11-09 03:12:47,jqnl1p,"do disney and nickelodeon still try make their starlets into pop stars these days? it was hilarious how they all used to try at least. 

makes me appreciate the 90s more like Boy Meets World when they were just regular kids. can't imagine Topanga trying to be a pop princess."
1918,2020-11-09 03:13:17,jqnl1p,"I moved out to Langley recently
With a plain and simple dream
Wanna infiltrate some third-world place
And topple their regime"
1919,2020-11-09 03:13:32,jqnl1p,I have a feeling another one of Mileys songs might also chart as well. https://youtu.be/kkTsUXw2VFo
1920,2020-11-09 03:24:43,jqnl1p,I work in the wedding industry and these songs get played at every event I've ever worked
1921,2020-11-09 03:30:50,jqnl1p,Blame Starbucks playlists
1922,2020-11-09 03:39:14,jqnl1p,"Suddenly? They've been playing on the radio kind of often for awhile.

I spend a fair deal driving through so suppose probably why I notice? Because I'm a nerd and also sing along for BBB and am amused by Miley's"
1923,2020-11-09 03:42:46,jqnl1p,I’m sorry that’s cringe
1924,2020-11-09 03:51:56,jqnl1p,EVERYBODY...
1925,2020-11-09 03:58:58,jqnl1p,"Sign
Firma
https://www.change.org/p/warner-brothers-bring-johnny-depp-back-to-fantastic-beasts?redirect=false"
1926,2020-11-09 04:35:00,jqnl1p,Man this was Peak Cyrus she was so hot... then she just went off the deep end.
1927,2020-11-09 04:39:21,jqnl1p,">suddenly charting for some reason.


Those songs are fuckin’ bangers."
1928,2020-11-09 04:47:07,jqnl1p,Charting on what?
1929,2020-11-09 04:51:28,jqnl1p,Because they’re absolute bangers?
1930,2020-11-09 04:51:56,jqnl1p,And people thought I'm an oldie that still listens to 2000+ songs wtf
1931,2020-11-09 04:54:04,jqnl1p,"https://youtu.be/a9FaX1w-Pmc 

This AMV is forever associated with Miley's party."
