,Timestamp,SubmissionID,Comment
0,2020-02-05 10:58:15,ez7wfm,Kik-YourBoy32130
1,2020-02-05 10:57:08,ez7w18, [https://lyricsvin.com/yikes-lyrics-nicki-minaj/](https://lyricsvin.com/yikes-lyrics-nicki-minaj/)
2,2020-02-05 07:49:44,ez5e4v,They are both saying the Nicki Minaj is Ncuti’s celebrity crush.
3,2020-02-05 06:50:04,ez5e4v,"the quality is so bad, im srry. i screenrecorded this frm twitter"
4,2020-02-05 07:27:28,ez5e4v,edit: they were playing a bff challenge.
5,2020-02-05 07:50:24,ez5e4v,"I already corrected this in the comments and they’re saying icon, not crush."
6,2020-02-05 04:39:56,ez1ygf,She should enter Soca Monarch.
7,2020-02-06 02:02:43,ez1ygf,Keep her. We doh want she here.
8,2020-02-06 18:54:19,ez1ygf,Nicki Minaj the one who thinks jamaican accent is trini
9,2020-02-05 17:13:32,ez1ygf,Hey Marin I saw it too
10,2020-02-06 02:44:34,ez1ygf,👀
11,2020-02-05 14:22:03,ez1ygf,LOL
12,2020-02-05 00:05:26,eyzvri,That’s... just not a good line
13,2020-02-05 00:32:17,eyzvri,"The bars you listed here are pretty mild, I wouldn’t consider them very controversial. Eminem’s columbine line from 20 years ago was way worse and he also rapped about ripping Pamela Lee’s tits off in one of his biggest radio hits lol. It’s just now with social media, 5 offended people on Twitter ignites a response from the media to generate clicks. These are not truly controversial bars."
14,2020-02-05 00:26:04,eyzvri,She straight up stole the switch like from Nas
15,2020-02-05 00:59:23,eyzvri,just reminds me of the outkast song. also this is clearly a sensationalist post to bring attention to the nicki snippet cause no one outisde of a small irrelavant fraction of the internet has said anything about that line
16,2020-02-05 00:07:08,eyzvri,[deleted]
17,2020-02-05 00:08:14,eyzvri,to each their own 🤷🏾‍♂️
18,2020-02-05 00:02:08,eyzvbp,"> My bitch a choosy lover, never fuck without a rubber

> Sweet yellow-bone thing, I call her Honey Mustard"
19,2020-02-04 23:40:33,eyzjif,"**Thank you for your submission. Make sure to follow the rules.**

**Check out our [FAP LOTTERY!](https://jerkofftocelebs.com/)**

**Don't forget to follow us on [Instagram](https://www.instagram.com/jotocelebs/) and [join our Discord Server](https://discord.gg/PrRFWsa)!**


*I am a bot, and this action was performed automatically. Please [contact the moderators of this subreddit](/message/compose/?to=/r/JerkOffToCelebs) if you have any questions or concerns.*"
20,2020-02-04 23:41:33,eyzjif,I dream about this at night 🤤🤤
21,2020-02-05 00:08:39,eyzjif,God I’d love to have this. Even an orgy where both get tag teamed
22,2020-02-06 05:45:01,eyucwp,For the love of god yes
23,2020-02-29 16:37:52,eyucwp,I would love to set up a role-play. I love the rivalry theme you suggested with Taylor Swift. Please contact me at rp6657542@gmail.com
24,2020-02-04 16:07:01,eys8wh,"**Thank you for your submission. Make sure to follow the rules.**

**Check out our [FAP LOTTERY!](https://jerkofftocelebs.com/)**

**Don't forget to follow us on [Instagram](https://www.instagram.com/jotocelebs/) and [join our Discord Server](https://discord.gg/PrRFWsa)!**


*I am a bot, and this action was performed automatically. Please [contact the moderators of this subreddit](/message/compose/?to=/r/JerkOffToCelebs) if you have any questions or concerns.*"
25,2020-02-04 16:21:28,eys8wh,She'd be perfect if she wore a ball gag 24-7
26,2020-02-04 16:47:45,eys8wh,Mmmm sexy
27,2020-02-04 17:13:04,eys8wh,Same she turns me into a whore
28,2020-02-05 01:53:11,eys8wh,I like her sexy ass
29,2020-02-27 16:44:14,eys8wh,[removed]
30,2020-02-27 16:44:15,eys8wh,"Your comment has been removed due to your account not meeting the required (> 7 day old) limit necessary to post here

*I am a bot, and this action was performed automatically. Please [contact the moderators of this subreddit](/message/compose/?to=/r/JerkOffToCelebs) if you have any questions or concerns.*"
31,2020-02-04 16:31:18,eyqynm,"It's ok, I don't like Awkwafina either and I feel no guilt about it at all."
32,2020-02-04 20:00:36,eyqynm,I thought you were talking about the water. LOL. I was going to say I hate Aquafina. It's too salty.
33,2020-02-05 01:26:22,eyqynm,I don’t like her because I just don’t think she’s funny. Her hosting and skits for SNL were terrible. I have not seen her be good in anything.
34,2020-02-06 07:09:41,eyqynm,I like her show Nora from Queens
35,2020-02-04 21:03:20,eyqynm,I don't like that water brand either. It has a weird mineral aftertaste
36,2020-02-05 18:03:15,eyqynm,[deleted]
37,2020-02-05 19:25:31,eyqynm,"It also increases your thirst, what water increases your thirst? That's nasty af too"
38,2020-02-04 14:02:03,eyqgnt,"**Thank you for your submission. Make sure to follow the rules.**

**Check out our [FAP LOTTERY!](https://jerkofftocelebs.com/)**

**Don't forget to follow us on [Instagram](https://www.instagram.com/jotocelebs/) and [join our Discord Server](https://discord.gg/PrRFWsa)!**


*I am a bot, and this action was performed automatically. Please [contact the moderators of this subreddit](/message/compose/?to=/r/JerkOffToCelebs) if you have any questions or concerns.*"
39,2020-02-04 14:02:11,eyqgnt,Kik breakmybrain4celebs
40,2020-02-04 13:38:23,eylnbv,"Guilty pleasure, this one. Love the Wayne verse. Love the hook. Even the bridge is great. 

Maybe the best Nicki has ever looked in a video too."
41,2020-02-04 05:49:45,eyldhu,"This is a heavily moderated, Pro-Black woman NSFW sub-reddit. Please read EVERY SINGLE RULE IN THE SIDEBAR before you participate within this sub-reddit that was purely created towards Black women exclusively.

*I am a bot, and this action was performed automatically. Please [contact the moderators of this subreddit](/message/compose/?to=/r/Afrodisiac) if you have any questions or concerns.*"
42,2020-02-04 05:48:17,eylcwu,"Make sure to follow our community guidelines.

**[Get user flair](https://redd.it/e0a4mn) and check out our Instagram page for more celebrity content!**

**https://www.instagram.com/celebtag**


*I am a bot, and this action was performed automatically. Please [contact the moderators of this subreddit](/message/compose/?to=/r/Celebhub) if you have any questions or concerns.*"
43,2020-02-04 12:59:48,eylcwu,I wanna see em so bad.
44,2020-02-04 05:49:39,eylcwu,I bet she is a God-tier fuck.
45,2020-02-04 14:30:24,eykyvl,https://www.reddit.com/r/TheseFuckingAccounts/comments/eiv0gj/redditor_for_6_days_posts_spams_jordanthrilla_via/
46,2020-02-04 03:22:42,eyjip4,"
Very short discussion posts are usually a sign of poor quality. Please try again with more in-depth text in your self post.

You will need to include text longer than 50 characters to get past the bot.

*I am a bot, and this action was performed automatically. Please [contact the moderators of this subreddit](/message/compose/?to=/r/Music) if you have any questions or concerns.*"
47,2020-02-04 03:18:22,eyjgky,Kik:graycog
48,2020-02-04 03:54:34,eyjfj2,“all you bitches rosa parks get your ass up” what is it with nicki and historical figures 💀
49,2020-02-04 03:17:31,eyjfj2,So much for retirement
50,2020-02-04 03:19:18,eyjfj2,"and y’all thought january was wild... 
february bout to begin"
51,2020-02-04 03:24:14,eyjfj2,at the beginning i thought she was sampling the clown circus music and then it turned into a trap beat with lyrics about someone being a clown and i was so excited
52,2020-02-04 03:45:29,eyjfj2,"y’all not here for it, but tbh it sounds better than anything she’s done in a minute"
53,2020-02-04 03:23:48,eyjfj2,I can't believe she's writing songs about JB's new era.
54,2020-02-04 05:44:50,eyjfj2,"wait there are travis scott adlibs in the background

went from beefing with travis to getting him on her song. a hit is coming!"
55,2020-02-04 04:33:47,eyjfj2,"Why is she serving this basic trap song after slaying Meghan's new song with one of the best verses she's had in years?? 

Nicki sis wyd?"
56,2020-02-04 03:18:19,eyjfj2,"I just feel like she/her team isn’t listening to criticism at all. The main criticism of her music is that its vapid, all about flexing. She clearly has it in her to make meaningful, interesting songs like Pills n Potions so why not just do that?"
57,2020-02-04 03:16:58,eyjfj2,....yikes
58,2020-02-04 04:11:00,eyjfj2,Is it possible she could actually bounce back from megatron? wow this sounds amazing
59,2020-02-04 16:41:18,eyjfj2,Rappers say they're retiring all the time but never actually do it.
60,2020-02-04 03:26:06,eyjfj2,Title pretty much sums up my reaction to that snippet.
61,2020-02-04 10:46:01,eyjfj2,"Wow a song describing what I say any time Nicki does anything, we stan a self-aware queen"
62,2020-02-04 03:56:32,eyjfj2,[deleted]
63,2020-02-04 04:54:32,eyjfj2,"Hello, thanks for posting to /r/popheads. However, your post has been removed for the following reasons:

* Please do not type out the tag in brackets when making a post to /r/popheads. Tags can now be chosen by clicking on the 'flair' button after submitting your post. If you're on mobile and are not able to, one of the mods will tag it for you. Also, if this is the part that applies to your removal, feel free to repost the song but without the bracket.

* If that was not the case, please do not add unnecessary information when posting [FRESH] music. The title of your post should only include the artist and song title, along with the correct tag you chose from the drop down menu.

* If those weren't the case, it could be because [THROWBACK] as a flair is no longer allowed. However, don't get too upset! In essence, you can still post throwback threads as a [DISCUSSION] post about it with a nice writeup. You can post these any day of the week.



For any further queries, please [message the mods](https://www.reddit.com/message/compose?to=%2Fr%2Fpopheads)."
64,2020-02-04 04:35:25,eyjfj2,this is even more out of line than “like mj doctah they killing me” or the bottoms up lines about anna nicole smith lmao
65,2020-02-04 04:22:50,eyjfj2,#YOU THINK HARRIET TUBMAN WAS WALKING AROUND WITH A FUCKING NICE SHINY FUCKING DRESS ON WITH A FUCKING CROWN ON HER HEAD WHEN SHE WAS TAKING SLAVES ...... TO FREEDOM 💣💣💣
66,2020-02-04 04:39:10,eyjfj2,Happy Black History Month [to the 62 of us on the sub!](https://www.reddit.com/r/popheads/comments/bdxxtd/rpopheads_75k_subscriber_census_results/?utm_medium=android_app&utm_source=share)
67,2020-02-04 04:17:32,eyjfj2,Is this an actual lyric...it can't be...
68,2020-02-04 04:38:47,eyjfj2,Yikes
69,2020-02-04 13:51:40,eyjfj2,Black history month QU EEN.
70,2020-02-04 14:54:51,eyjfj2,Today is Rosa Parks day too omg
71,2020-02-04 03:22:42,eyjfj2,sis was just announcing her retiring from one room in her house to another one
72,2020-02-04 05:07:30,eyjfj2,"Stans were like ""she recorded that before retirement"" a few weeks after her annoucement. Aged like milk"
73,2020-02-04 06:32:57,eyjfj2,The Hayao Miyazaki of the rap game
74,2020-02-04 14:29:02,eyjfj2,I don't want her to retire before getting that #1
75,2020-02-04 08:47:40,eyjfj2,"It's better than Megatron but it ain't no chun li, good form, or Barbie dreamz."
76,2020-02-04 06:07:41,eyjfj2,I agree. As soon as negation was released I forgot about it. This is definitely a step up
77,2020-02-04 14:15:14,eyjfj2,idk Queen was a good album and she only released one solo song since (Megatron)
78,2020-02-04 12:30:22,eyjfj2,no it doesnt. sounds like a generic migos track
79,2020-02-04 11:07:59,eyjfj2,I'm here for it. Or at least I hope she drowns him at the Beauty and a Beat mv
80,2020-02-04 12:34:03,eyjfj2,"She got on the winning team... but also, didn't she get new management?"
81,2020-02-04 12:33:49,eyjfj2,i heard migos adlibs not travis adlibs
82,2020-02-04 17:10:50,eyjfj2,You must be a Meghan Stan if you think that was one of nicki’s best verses in years 🤔
83,2020-02-04 07:57:33,eyjfj2,"Feel the exact same way with that beat as well, sounds like something future would use."
84,2020-02-04 04:19:50,eyjfj2,I mean artists are allowed to make the music they want to make though. It’s not just all fan service. You can’t force someone to write a deep song. You’re just gonna get an inauthentic product.
85,2020-02-04 03:22:05,eyjfj2,"This is it. Nicki Minaj has the potential to be one of the greats and she just doesn’t try for it at all. Why is she doing this generic trap beat thing? I guess you can’t judge a song by a little snippet, but I wish she would put in some Kendrick Lamar-like effort. She’d eat."
86,2020-02-04 07:10:51,eyjfj2,"I’d rather hear her do quality rap / trap songs with established producers in that field, than hear her make mediocre popsongs and chasing the pop success she once had (and will never have again)"
87,2020-02-04 12:33:11,eyjfj2,"I like Pills'n Potions, BUT I think that this song is kinda ""generic""...

I miss some old songs from Nicki: Va Va Voom, Starships, Freedom...

(besides that, I've loved her last album... for me Ganja Burn is perfection)"
88,2020-02-04 09:12:04,eyjfj2,It’s not like her lyrics are bad it’s just her production is trash
89,2020-02-04 09:50:10,eyjfj2,Is Pills n Potions more meaningful or interesting than songs where she's flexing? I like the song but 'I'm sad so I'm doing drugs' is a really common theme in songs so it's hardly new and exciting
90,2020-02-04 04:44:28,eyjfj2,...why
91,2020-02-04 04:21:27,eyjfj2,what is there to bounce back from? megatron was fun
92,2020-02-04 12:36:06,eyjfj2,You didn't like Nice To Meet Ya? She bounce back for the better
93,2020-02-04 04:02:08,eyjfj2,"Damn, you still holding on to old shit that has nothing to do with you. Kinda sad."
94,2020-02-04 12:34:40,eyjfj2,oddly enough this sounds more like a cardi song than anything else nicki has released
95,2020-02-04 04:55:04,eyjfj2,What? I didn't?
96,2020-02-04 06:28:53,eyjfj2,"Nicki has a weird obsession with Anna Nicole Smith...

Bottoms up: “ Rest In Peace Anna Nicole Smith/ yes my dear you’re so explosive”

Make Love: “ I got it in the can, Dole/ you’re career gon’ be with Anna Nicole”
She later rapped this verse in a Tidal interview in 2018 with her fan, leaving her infamous [“Did I lie, did I lie, did I fking LIEEEEEEEEEEE?” meme, then finished her statement with “RIP Anna”](https://youtu.be/zkd8FodiizM)"
97,2020-02-05 07:38:12,eyjfj2,this never gets old
98,2020-02-04 05:53:00,eyjfj2,i’m sure it’s increased in the last year though right
99,2020-02-04 06:24:44,eyjfj2,Jesus only 6 indigenous! I feel the specials
100,2020-02-04 11:02:40,eyjfj2,"I did not take that survey lol 

so actually 63 😂"
101,2020-02-04 06:58:09,eyjfj2,"Roughly generalizing from the sample it would be 2625~, assuming the sample is properly representational."
102,2020-02-04 19:10:02,eyjfj2,Now this really explains a lot.
103,2020-02-04 10:06:15,eyjfj2,Jay-Z is on his 3rd retirement now
104,2020-02-04 12:03:03,eyjfj2,Agh Chun Li is so heaven. That horn loop
105,2020-02-04 06:34:08,eyjfj2,did your phone/computer autocorrect Megatron or is this one of those stan thing where people type things wrong on purpose? Cos I honestly don't get this one.
106,2020-02-04 17:18:11,eyjfj2,this sounds nothing like a migos track
107,2020-02-04 20:45:16,eyjfj2,Good thing she doesn’t have to keep an eye out for Selenuh anymore
108,2020-02-04 13:49:41,eyjfj2,That's even less likely considering the Migos are Cardis friends/husband.
109,2020-02-04 05:42:53,eyjfj2,"Sure, and fans are allowed to criticize the music and not listen to it. Its not all about blind stanning. You can’t force yourself to like somebody’s new music. They’re just gonna get fake fans who don’t actually listen to the music. 

Nicki’s made it extremely clear that she cares a lot about getting a #1 album, so she should be doing fanservice."
110,2020-02-04 04:23:19,eyjfj2,"At her stage it is somewhat fan service. For smaller artists it doesn’t really matter, but for someone as big as Nicki it’s pretty important that she listens to what her fans want. Especially bc she’s made it clear that she still cares about charts, sales, Grammys, etc"
111,2020-02-04 03:33:59,eyjfj2,"I really just don't understand this sentiment. Nicki is already one of the greats. After all her success and accolades, why do people still feel like she has to prove herself? Yes, I agree that she has even more potential, but that doesn't diminish what she has already accomplished."
112,2020-02-04 03:26:53,eyjfj2,"Well put some respect on her name. She is one of the greats and she has put in that type of effort, I’m just saying this song from the snippet doesn’t sound anywhere close to her best"
113,2020-02-04 06:37:21,eyjfj2,">This is it. Nicki Minaj has the potential to be one of the greats and she just doesn’t try for it at all.

But Nicki *is* one of the great, point blank period. Does she live up to her greatness with these tracks? It's debatable, but don't front like any of the girls can do it like Nicki lmao

I don't say it as a Nicki stan, but only Nicki can be placed with the guys. (Sad but lbr)"
114,2020-02-04 15:26:46,eyjfj2,"Yes, Ganja Burn was my favorite song from the album. It captures the Queen aesthetic perfectly."
115,2020-02-04 11:07:53,eyjfj2,...because the song is called Yikes
116,2020-02-04 07:26:25,eyjfj2,2 Lit 2 Late > whatever megatron was trying to be
117,2020-02-04 04:59:59,eyjfj2,Sorry about that I was modding too fast. Reapproved.
118,2020-02-04 06:45:40,eyjfj2,the way these verses are two of her best verses
119,2020-02-04 09:48:36,eyjfj2,It's because Anna Nicole Smith is awesome
120,2020-02-04 08:15:15,eyjfj2,Is there any particular reason? I’m not familiar with her
121,2020-02-04 12:27:19,eyjfj2,I'm deceased
122,2020-02-04 06:41:29,eyjfj2,"After seeing Popheads for themselves, I’m sure a majority of them had the good sense to fucking leave."
123,2020-02-04 07:00:54,eyjfj2,are you indigenous too??
124,2020-02-04 13:50:33,eyjfj2,Make that 64 👀
125,2020-02-04 10:19:50,eyjfj2,"Can’t extrapolate anything more so than what people responded. 

its not a random sample, it’s a self selected group of people that are likely to visit the sub a lot more than avg and notice that there was a census.

(Like me I didn’t know there was a census and I feel like I see popHeads posts daily on my feed)"
126,2020-02-04 13:48:40,eyjfj2,That horn sounds like someone honking a clown nose and I can't escape it
127,2020-02-04 06:57:25,eyjfj2,Autocorrect lol
128,2020-02-04 22:47:32,eyjfj2,\*Selener
129,2020-02-04 09:31:10,eyjfj2,"I’m not talking about her commercial success. She doesn’t have to prove herself there. I’m talking about the content, what she has to say. She could be in the league of Tupac, Biggie, Nas, let’s even say Jay Z.

She’s already had commercial success. And I wish she’d cement herself as an artist who says something, stands for something, tells a story, pushes the genre in a certain direction. She doesn’t need to prove herself commercially anymore, so why not serve undoubted quality?"
130,2020-02-04 08:51:00,eyjfj2,"Yeah she's achieved a lot. No denying, but I feel it's about time to move on to that potential we see. It's frustrating that she isn't progressing."
131,2020-02-04 08:51:12,eyjfj2,Commercial success has nothing to do with music quality. She has one killer verse of MBDTF and that’s it. Her music is average pop music. She’s not “one of the greats”.
132,2020-02-04 03:31:14,eyjfj2,">She is one of the greats and she has put in that type of effort.

period period period"
133,2020-02-04 20:19:28,eyjfj2,"""I'm not much of a drinker"""
134,2020-02-04 12:47:21,eyjfj2,"She was a super famous Guess and Playboy model in the 90s, famous because she was the first plus sized (or curvier) model to be in those ads (she lost a lot of weight towards the end due to taking a plethora of pills). She also styled herself to look like a Marilyn Monroe type sexpot 24/7. She was quite... eccentric. She ended up marrying a 90-something year old multi-billionaire oil tycoon and he died thirteen months later without even consummating the marriage (making her one history's most famous ""gold diggers""). She also had her own reality show on E! wayyy before Keeping up with the Kardashians and even before The Simple Life (her show basically paved the way for others, even if hers was the hot mess version).

She was just very brazen and basically did whatever the fuck she wanted. She took a lot of pills towards the end due to a tragic last few months (her teenage son OD'd and died the same week she gave birth to her daughter and she never recovered, dying 4 months later). She was 39.

If any of that seems like something Nicki would glorify, then there ya go. (And since  Nicki's real name is Onika, which kind of sounds similar to Anna Nicole, I wouldn't be surprised if she felt some sort of connection to her growing up).

edit: ~~Nikki~~  Nicki, my bad"
135,2020-02-04 12:42:57,eyjfj2,"I don’t think there’s a specific one tbh. However, Nicki could have found her a niche to be a metaphor/simile for dead career or something...I mean it is common to write such thing in rap songs

Also Nicki has been in the game for more than a decade, so she could have some regular materials, like “these bitches is my sons” and it’s 1000000 alternatives (sadly haven’t been used much recently), she probably just found Anna came in clutch when she needs some vivid portrayal for death/dead career

Nicki, in fact, knows her thing pretty well and she reuses her materials. For example, Harriet Tubman has actually been on her mind since 2009 in “Beam me up Scotty”: “Baddest underground since Harriet Tub”"
136,2020-02-04 12:32:44,eyjfj2,Please explain...
137,2020-02-04 07:10:19,eyjfj2,Yeah Australian Koori you?
138,2020-02-04 10:34:32,eyjfj2,that's why I said assuming lol I just did it for fun
139,2020-02-04 17:33:03,eyjfj2,Places you took me: there. Please tell me there's a video of someone in a clown suit dancing to Chun-Li while squeezing their clown nose to the horns. I can't get this image out of my head lmao.
140,2020-02-04 22:17:17,eyjfj2,Tbh I feel like basically everything people say they want from her is stuff she’s already given us on The Pinkprint
141,2020-02-04 12:35:35,eyjfj2,"I think that she serves quality. Nowadays everybody needs to stand for something, have a political view, etc... But Nicki isn't about that, she's an egocentric woman that makes songs for her own ego or just to chill (that's what I like about her)"
142,2020-02-04 11:36:40,eyjfj2,"please. any female rapper worth anything these days respects nicki and more often than not, cites her as an inspiration. her flow, her look, her attitude is bitten off by alot of people and thats perfectly fine.

along with that, it’s incredibly impressive that to this day, nicki still manages to be as successful as she is. nicki has proven herself commercially AND she has proven her talent. she doesn’t need to make “all things go” or “bed of lies” with every single to be one of the greats cause she already is"
143,2020-02-04 13:44:22,eyjfj2,"A decade of enormous success and relevance says a lot about the quality of her music. Unfortunately for Nicki, the hip-hop community is misogynistic and hates crossover appeal. So despite being one of the greats, she will never get the credit she deserves and people will always think she has something to prove because they can't stand that the same person who wrote Monster is also out there singing Superbass."
144,2020-02-04 16:41:57,eyjfj2,why did i think anna nicole smith was that child pagent queen that was found dead in her basement
145,2020-02-04 15:41:10,eyjfj2,Nikki
146,2020-02-04 13:28:18,eyjfj2,"This sub doesn't have the best track record when it comes to racism, sadly."
147,2020-02-04 07:10:49,eyjfj2,Native American :)
148,2020-02-04 10:38:45,eyjfj2,That’s fair! Sorry if that came off in a dick-ish tone.
149,2020-02-04 22:41:18,eyjfj2,if there isn’t one i will do it because holy shit that’s hilarious
150,2020-02-05 03:18:12,eyjfj2,"This. I get tired of people saying all Nicki raps about is her pussy. Like that journalist who said Nicki needed to find another direction, like obviously she never listened to pinkprint."
151,2020-02-04 12:49:42,eyjfj2,"On one hand, she doesn’t need to say something politically. What does 1989 or Melodrama say politically? Even Lemonade is light on politics. She just hasn’t made something fully introspective, which to me is important as an artist.

On the other hand, rap is a sociopolitical movement. It stared because people’s voices were being suppressed. It grew from an oppressive environment. So there’s somewhat of an argument to be made that if you want to be an actual rapper, you should stand for something. There’s a lot of ways to make a good rap song — be a storyteller, be a great producer, be funny, clever word play. But to be a great rap artist is something else."
152,2020-02-04 11:45:59,eyjfj2,"...I’m not saying she isn’t an inspiration, but she hasn’t made a magnum opus and she should to cement a legacy. That’s it."
153,2020-02-05 10:37:53,eyjfj2,"I don’t hate her because she’s female, I think her music is cookie cutter shit. There are lots of better female MC’s out there to pick from."
154,2020-02-04 22:26:53,eyjfj2,"weirdly, there are a number of similarities between the two 

the general air of exploitation surrounding them, for one"
155,2020-02-04 07:13:53,eyjfj2,"Ohh awesome! Would love to visit one day, haha"
156,2020-02-04 11:11:21,eyjfj2,"No no, you're good. I'm not offended, just prideful"
157,2020-02-04 12:51:42,eyjfj2,You got a point there!
