,Timestamp,SubmissionID,Comment
0,2020-02-03 20:27:07,eycxzu,"she said the kids and their cousins use it all the time, so it’s not really a waste"
1,2020-02-03 20:18:51,eycxzu,"Everyone says this, the novelty wears off pretty fast. I had a pool growing up, parents barely used it, that's how it goes. 5 other people live there too so I'm sure it gets used."
2,2020-02-03 21:34:25,eycxzu,I’ll admit I have a pool and maybe use it 5 x a summer. My husband forces himself to go in. But it is great for kids and entertaining
3,2020-02-03 20:45:29,eycxzu,"I thought that initially too, but she said the kids and cousins use it all the time, although she did make it seem like they really only use the stairs. Also conflicted on them saying instead of having a jacuzzi they just keep the whole pool warm all the time, seems like a waste of energy, but so would building a whole separate jacuzzi I guess."
4,2020-02-04 01:38:17,eycxzu,My fav is their living space that has the glass and the green wall outside it. Love that!
5,2020-02-03 22:09:03,eycxzu,Crying that Kanye pronounces bathroom as bafroom as a 42 year old
6,2020-02-03 23:48:56,eycxzu,"OK I get that people don't tend to use their own pools that often. (I'm in the UK and a pool at home has always seemed like such a luxurious American thing to have! Our gardens are small and it rains all the time here ok. Let me dream!) 

But to not even have tried it out?? Not to just see how it feels to swim in the pool even once? I don't know how much that pool cost but likely hundreds of thousands of dollars, right? To be able to spend all that money and then not even have the slightest curiosity to use it? That's mad to me. That pool probably cost as much as an apartment."
7,2020-02-04 16:44:09,eycxzu,"I bet the kids use it. My mom didn't like to swim as much cause she would ruin her hair. I bet that is why Kim doesn't. All that work she puts into her hair and makeup would be ruined in a second. 

My family was lucky to have a pool when I was in HS. We were in it all the time and always had friends come over to swim. We also lived in S. TX where it is hot and humid 24/7. The pool was my favorite thing in HS. Hopefully I can have one day!"
8,2020-02-04 06:13:20,eycxzu,Bet she can't swim... but i'm sure she can float.
9,2020-02-04 06:14:09,eycxzu,"Man I love pools.. not really novelty, you can get a great workout and relax."
10,2020-02-04 02:06:04,eycxzu,think of the stairs as a shallow end. it's definitely more fun for the little kids to splash around and stuff.
11,2020-02-04 01:40:32,eycxzu,I literally thought he was joking at first but I think that’s how he really says it
12,2020-02-03 22:45:11,eycxzu,LMAO
13,2020-02-04 05:41:55,eycxzu,"A standard, basic pool in America really only costs about $30,000."
14,2020-02-05 22:19:55,eycxzu,That’s how much my bachelors degree cost!
15,2020-02-04 18:42:19,eycxzu,"""really only"""
16,2020-02-04 20:16:32,eycxzu,"I was just reacting to the “hundreds of thousands” comment from the previous poster. I agree, though. It still isn’t cheap. Just doesn’t cost $100,000+"
17,2020-02-04 20:17:29,eycxzu,yeah fair point actually! apologies for misinterpreting
18,2020-02-04 20:18:26,eycxzu,No problem. I gotchu. 👍🏼
19,2020-02-03 14:10:13,ey7l55,"can someone explain to me how this house worth jumped from 20m to 60m in less than a year, also i wonder how much the house worth now after all the changes they did ?"
20,2020-02-03 15:00:42,ey7l55,Why do they always show the same three rooms 🤔
21,2020-02-03 14:10:28,ey7l55,That was an interesting read.  I think the house is very reflective of their relationship dynamic.  Before Kim married Kanye she had a lot more fun with her personal style.  Her old house and the clothes/makeup she used to wear were totally different than they are now and she loved to play with colors and glam elements.  She really changed her entire style to match Kanye's.  I'm not going to speculate whether she's happy with that decision or not but I do think it's very interesting.  To me it's clear this house is like 95% Kanye's taste and 5% Kim's.
22,2020-02-03 14:09:24,ey7l55,"So beautiful I mean that’s a given, but the all white is sooooo strange haha. I believe another followers opinion on here that they think half of the house has color and stuff. And what’s seen is just to put on the show."
23,2020-02-03 17:30:16,ey7l55,"I want to see the kids’ rooms so bad


Edit. Yayyy we got norths room!"
24,2020-02-04 07:45:24,ey7l55,"Okay, I love it. When I first saw it I was like. Nah, that's no house, but of course we're not seeing the full house (for privacy reasons, they probably shouldn't, although I'm soo curious). Now, seeing the AD article, really makes me want to jump in and see all of Kanye and Axel's ideas! 

That being said, as a super messy artist that loves ceramic titles and crazy wall paper prints, all the tones of white really make me want to add color on the hallway walls and rooms. Otherwise it's very cool and serene."
25,2020-02-04 18:40:37,ey7l55,"its funny that she wasn't even sure of what to call the room they were sitting in the for the interview.  I think that is also  very telling of their home design choices. She defers to him for his inspiration, and his extensive knowledge and expertise in design. 

I just find in that video that he's so sweet and kind and she seems annoyed with him. That was uncomfortable a bit.

With that said the house is so beautiful and calming . I love it."
26,2020-02-03 16:39:31,ey7l55,"It was 20 mil and out of nowhere Kris said it was 60 mil, and now that number is everywhere. It’s going to be embarrassing when they won’t be able to sell it for 60 mil"
27,2020-02-03 16:18:06,ey7l55,"There's no way that place is worth 60 mil. I love it, but nothing in that area is worth that much unless they have enormous amounts of land attached in the back or something. There are better houses on the most expensive streets in bel air that aren't worth that much."
28,2020-02-03 18:07:07,ey7l55,"I believe they bought an adjacent plot which increased the value. But it’s still not worth 60m, that’s just a Kris-ism. Maybe it’s insured for 60m including all furnishings, art, valuables, etc. No way they can sell this for that much when it’s four times the value of the average house in their neighborhood."
29,2020-02-04 12:28:08,ey7l55,agreed
30,2020-02-03 17:04:07,ey7l55,That would be crazy! I remember they showed North's room and it looked like a rock cave and it was tiny. I remember Kim mentioning the kids have a play room so there must be color in there at least.
31,2020-02-03 16:44:23,ey7l55,It is probably worth 15-20 mil ish looking at comparable properties in the area. I don't understand the need for such a large lie. Like saying its 25 or something I would get if they wanted to flex but putting 40 million imaginary dollars on? Lmao. Silliness.
32,2020-02-03 19:07:52,ey7l55,Update:  Kim just posted a picture of North's bedroom and its bright pink.  They must have recently redid it.
33,2020-02-03 16:52:06,ey7l55,"I know, at most double the 20 and push it up to 40 mil. But Kris really went overboard for no reason. It was so unnecessary too, she retweeted an article and said it’s 60 mil. It was so stupid"
34,2020-02-03 21:35:07,ey7l55,Lol that’s funny!!
35,2020-02-03 16:56:17,ey7l55,"They expanded it a lot. I think the original was 20 mil, now it’s 40 mil. No WAY is it 60 mil."
36,2020-02-03 09:52:46,ey1hq1,"My thought after Bloomberg’s ad, having seen both of them: “Man, these shitty old billionaires really want us to believe they don’t have a problem with black people.”"
37,2020-02-02 04:44:20,ex36e7,u/WhatSheOrder
38,2020-02-01 22:42:32,ex36e7,Fish-Fillet?
39,2020-02-02 04:45:00,ex36e7,We really out here.
40,2020-01-31 08:39:07,ewkjov,"I'm a bot, *bleep*, *bloop*. Someone has linked to this thread from another place on reddit:

- [/r/pornaddiction] [Porn Kills Relationship](https://www.reddit.com/r/PornAddiction/comments/ewlfps/porn_kills_relationship/)

&nbsp;*^(If you follow any of the above links, please respect the rules of reddit and don't vote in the other threads.) ^\([Info](/r/TotesMessenger) ^/ ^[Contact](/message/compose?to=/r/TotesMessenger))*"
41,2020-01-28 11:12:48,ev3uju,Who cares.
42,2020-01-27 19:55:33,eut1kl,"When you don't have the struggles of the working class, the middle class, and the professional class because you can pay somebody to deal with all that cognitive overhead...."
43,2020-01-28 00:17:02,eut1kl,I hope to one day reach the appropriate socioeconomic bracket where I can make traveling to Jamaica for shrooms-induced psycho-spiritual experiences a priority.
44,2020-01-27 19:56:40,eut1kl,I hate everything about this type of pseudoscientific infomercial. The last thing we need in this day and age is the further advancement of con artistry.
45,2020-01-27 20:06:29,eut1kl,"i guess i can take some comfort in the knowledge that she's fleecing the wealthy.  irks me to no end when i know that most americans haven't the time off work or money to staycation, let alone fly to jamaica.  but by all means you rich a-holes, snatch up those jade eggs and vagina candles, all the while bitching about your taxes."
46,2020-01-28 00:12:16,eut1kl,I can't think of a single celebrity I find more insufferable than Gwyneth Paltrow (and may I remind you that this is a world in which Justin Bieber and the Kardashians exist).  I'm not going to take her advice about ANYTHING.
47,2020-01-28 02:08:51,eut1kl,"Y'all, they're sitting naked in a circle and observing each other's vulvas"
48,2020-01-27 20:57:53,eut1kl,Meh. We've discussed Goop and Paltrow before. She's a snakeoil saleswoman who just charges a lot for your stupidity. Not much else to say. She's boring.But we continue to peer into her vapid life and get off on hating her because she's beautiful and rich.
49,2020-01-28 14:58:39,eut1kl,". . until that terrible day when the ""Cognitive Morlocks"" will at last rise up from their dank, data-filled tunnels to overthrow and devour their enfeebled overlords, the Cognitive Eloi."
50,2020-01-28 00:18:53,eut1kl,"Also, watching now."
51,2020-01-28 02:17:08,eut1kl,What!  No!  Yes I want this.
52,2020-01-27 20:59:12,eut1kl,I'm just trying to post things that aren't politics and don't always smell like dude.
53,2020-01-27 21:12:23,eut1kl,">get off on hating her because she's beautiful and rich.

nope.  not really the case at all... at least not from my perspective."
54,2020-01-28 00:14:20,eut1kl,The reason I can't stand her isn't because she's rich; it's because she's so far up herself that she can peer out of her own nostrils.
55,2020-01-27 21:18:21,eut1kl,"She’s made money selling dubious stuff and I think she’s been successful bc she’s white, beautiful, and already rich. People hate her for it but don’t look away is what I’m trying to say inartfully."
56,2020-01-28 00:23:28,eut1kl,Lolololololol
57,2020-01-27 23:30:53,eut1kl,"yes, i get that... but all too often people who are critical of said rich, beautiful charlatans are written off as ""just jealous""."
58,2020-01-26 16:12:19,eu8ay4,In the same video they clarified that  Kylie agreed with the name even though it sounded weird at first. She didn't actually name the kid. I think it's from the make up video someone posted a few days ago.
59,2020-01-25 14:55:33,etrktn,[deleted]
60,2020-01-26 02:18:22,etrktn,"Let's be honest here, kanye is doing it because it's a nice tax dodge, he seriously thinks he has a run on president, and he's a rampant narcissist with a tenuous grasp on mental stability.

That he would fix on the prosperity gospel con aspect should surprise no one."
61,2020-01-25 15:22:20,etrktn,[deleted]
62,2020-01-25 15:49:56,etrktn,[deleted]
63,2020-01-22 15:33:15,esdkgh,"Thank you for your submission to /r/NotTheOnion!  Your submission has been automatically removed since your submission's title appears to be different from the headline of the article you submitted.  Submissions with altered titles are not permitted, all titles must be the headline from the article, copy-and-pasted. 

#Please read the information below *before* modmailing us.  We will not answer your modmail if your issue was addressed below. 

* Do not add **periods or quotation marks** to the title.

* Do not use the **suggest title button**.  Instead, copy-and-paste the article's title *directly* from the link you are submitting.

* Make sure your source doesn't have a **paywall**.  Because of the method used to check titles, submissions from sites that have paywalls may be removed since the bot cannot access the article.  If your source does have a paywall, you can resubmit from an alternative source that is not behind a paywall.

You may resubmit with the correct title, but remember that our other rules must be followed as well.  For more information on our rules, check out /r/NotTheOnion/w/NTO101.

*I'm a bot, and this action was performed automagically.*"
64,2020-01-21 04:32:41,erpfrv,Look it up on whosampled
65,2020-01-21 04:32:55,erpfrv,I think is [this](https://www.youtube.com/watch?v=YPVAmDawNhE) song?
66,2020-01-21 16:12:25,erpfrv,"Yeah, it is that. Thanks a lot!"
67,2020-01-20 15:40:24,er7mct,Anything that family does is for publicity... and I do mean literally everything.
68,2020-01-20 03:55:04,er78xg,Those Strathberry bags are... amazing... I love them so much! They're structured and classic but also... mechanical looking with their little metal bars. Thank you for introducing me to that designer. I love the way these two ladies dress.
69,2020-01-20 05:21:33,er78xg,"On the opposite side of things, I work for an Australian Brand often worn by the First Lady and British Royalty during trips there or in general. We have TONS of ladies come in and ask for the same pieces! It’s quite fascinating."
70,2020-01-20 05:50:04,er78xg,I have Essie Ballet Slippers nail polish which I learned afterward was supposedly “The Queen’s preferred brand and color”. 🤷‍♀️ not exactly the same but that’s as close as I’ve got.
71,2020-01-20 06:51:59,er78xg,I bought the Fleabag jumpsuit.
72,2020-01-20 03:30:00,er78xg,"Meghan Markle has a green/blue tartan coat from Burberry that I very nearly bought a few years ago, and every winter since, I regret it. No other celebrity or royalty worn item has ever made me feel like that!"
73,2020-01-20 09:43:54,er78xg,I think those huge sparkly dangly earrings Joan Collins wore in Dynasty are gorgeous! So I bought a pair like them off eBay. ^^but ^^mine ^^are ^^acrylic ^^because ^^I ^^don't ^^have ^^Dynasty ^^money ^^rip
74,2020-01-20 05:07:15,er78xg,I bought Seraphine maternity dresses after seeing Kate Middleton in them. One I bought in store was wonderful but another ordered online I wouldn't have bought if I'd tried it on first.
75,2020-01-20 13:57:25,er78xg,"Padded headbands that are so huge they look almost like hats. 

I have one similar to this one [Kate Middleton ](https://www.google.com/amp/s/www.instyle.com/fashion/accessories/best-padded-headbands%3famp=true) wore. I felt ridiculous the first few times I wore it, but if the rest of my outfit is fancy enough, I get lots of compliments on it. 

I have a few of the pearl studded ones, and [this velvet braided one ](https://www.revolve.com/mobile/jennifer-behr-lorelei-headband-in-mulberry/dp/JEHR-WA62/?&d=F&currency=USD&countrycode=US&_cclid=Google_EAIaIQobChMIl_XDwKqS5wIVhMDACh3m6gSuEAQYASABEgKCwvD_BwE&gclid=EAIaIQobChMIl_XDwKqS5wIVhMDACh3m6gSuEAQYASABEgKCwvD_BwE&product=JEHR-WA62)  that’s all over Instagram, but the huge one is my favorite."
76,2020-01-20 13:40:06,er78xg,Kate Middleton wore these amazing Catherine Zoraida fern hoop earrings to [Wimbledon](https://pin.it/cunpojr7kfibrc). I fell in love but assumed I couldn’t afford them. One day a package came from the UK - my husband surprised me with them! I wear them whenever I want a pick me up and to feel extra classy and powerful. Actually now I think I’ll wear them today!
77,2020-01-20 04:52:57,er78xg,"I bought a Lavish Alice dress after seeing it worn on Jane the Virgin by Petra. 
[dress](https://www.pinterest.co.uk/pin/806566614492203237/) 
It was like $40 on sale ASOS. I have it lavender, not white."
78,2020-01-20 09:54:13,er78xg,"Wow that D&G Miss Sicily bag is gorgeous, I’ve never seen it before.  I actually really like the blue and white version."
79,2020-01-20 08:32:28,er78xg,[deleted]
80,2020-01-20 06:23:42,er78xg,Lk Bennett sledge and Stuart weitzman 5050. I know there’s a ton more but I can’t think of any atm. I have an obsession with film and tv fashion- if I could afford it I would buy everything they put Viola Davis in on how to get away with murder
81,2020-01-20 07:46:33,er78xg,"I bought a pair of real australian UGGs after seeing Jennifer Aniston wear them in ""Along Came Polly"". And I am a man"
82,2020-01-20 13:50:00,er78xg,"I bought a couple things that Emma Roberts wore on Scream Queens and I have no regrets - Two pairs of sunglasses (Miu Miu and Quay) and a feather trim blouse from Topshop. Her style was so over the top and I loved it. There are a few more pieces I hunted down that I may pick up at one point, if I can convince myself to spend the money on a vintage pink Chanel T-shirt..."
83,2020-01-20 16:30:51,er78xg,"This photo of [Princess Anne](https://i.guim.co.uk/img/media/2ea597da64b8dbc1541c0d23dc3985ed0309aa10/0_49_5276_3165/master/5276.jpg?width=300&quality=85&auto=format&fit=max&s=36438935e3b434d6171ae3631f1deb84)  inspired me to get myself some interesting broaches to pair with scarves, sunglasses, and a IDGAF expression."
84,2020-01-20 07:31:10,er78xg,"I bought [this](https://www.pinterest.com/pin/155233518385640648/?lp=true) white dress Kate wore off TheRealReal, but I have significantly bigger boobs than she does and it does not fit my chest area :/ too attached to it to sell or gift the dress, so it's been sitting in my closet for months..."
85,2020-01-20 07:56:05,er78xg,"I like pretty much everything the Olsen twins wear. Sadly, everything they wear is from their brand The Row, and of course, I cannot afford it. But a girl can dream..."
86,2020-01-20 14:27:33,er78xg,"I tend to take inspiration from the British royals, more than the exact same items. For example:

A Madewell belt that Meghan wore recently (I didn't buy the exact one, it was OOS, but I love the one I did get). 

A Petit Bateau top Kate wore on the cover of Vogue once. Not the exact same, but from the same brand. I got mine NWT from Thredup.

My favorite site (and guilty pleasure) is the website  WhatKateWore https://whatkatewore.com/

Top notch breakdown on the clothes and events!"
87,2020-01-20 03:44:35,er78xg,"I’ve never done it with clothes, but I saw Michelle Obama speak a while ago and I was lucky enough to be so close that I could see her amazing ice blue manicure. I bought [matching polish](https://imgur.com/a/7jrLor4) and I wear it whenever I need to channel her energy."
88,2020-01-20 03:40:45,er78xg,I bought a leather bohemian style necklace from amazon after seeing Jennifer Aniston wearing something similar.  😁
89,2020-01-20 06:15:02,er78xg,I had been looking for stylish cargo pants and jungkook from BTS had a brand he always wore...even though they were men’s I ordered a pair and they’re super high quality and exactly what I was looking for
90,2020-01-20 16:58:21,er78xg,"I normally don't care who's wearing what but I've found myself admiring Ali Wong's outfits a couple times! I eventually bought the puffy [sumo jacket](https://7115newyork.com/collections/outerwear/products/sumo-puffer-linen-fw19-chartreuse) she wore. It's a bit pricey for me, but I've been wanting it for a while!"
91,2020-01-20 12:26:30,er78xg,I uh...admit to going out and purchasing emerald green yarn to knit my own version of [Kate's milk run shawl](http://1.bp.blogspot.com/-MB9e7hdnfl8/Tcm3pkqHOQI/AAAAAAAAAB8/lkrerG7z0JI/s1600/waitrose+kate.jpg) that one time.
92,2020-01-20 13:52:31,er78xg,"I didn't realize it until I called a sales rep to request a smaller size, but apparently Meghan has this Wilfred coat from Aritzia:
 https://ca.hellomagazine.com/fashion/02018120648924/meghan-markle-aritzia-coat-kings-college-london

I purchased it in gold camel in a S and called to exchange for an XS, and the rep was telling me about Meghan wearing it. A happy accident haha!"
93,2020-01-20 06:09:25,er78xg,LK Bennett pumps after Kate. Can't say I find them especially comfortable (no heels are for me) but they're a nice classic shoe.
94,2020-01-20 04:31:55,er78xg,I would desperately like a cream draped Mackage trench that I’ve seen Meghan Markle wearing pretty frequently but can’t bring myself to spend the money for it. It’s incredible!
95,2020-01-20 14:11:19,er78xg,"I bought a pair of ""Deneuve"" pumps [in black](https://www.aquazzura.com/en/boutique-online/woman/shoes/pumps/deneuve-pump-105-black-suede-leather-denhigp0-sue-000.html) from Aquazzura after seeing them on Meghan Markle. They are so unbelievably beautiful but I had to return them because the toe box was just SO SMALL. I have somewhat wide feet so these didn't work at all and I'm still sad about it 😭 

*ETA I also bought a pair of Manolo Blahniks (Hangisi) for my wedding after considering a grand total of zero other designers because of how I watched Sex and the City growing up. Had to do it and don't regret it for a second. I wear them every chance I get and feel like a total babe when I do."
96,2020-01-20 14:05:53,er78xg,"I just bought the [ceramic drop earrings by Zeen](https://www.zeenwoman.com/row/wxe92033-green-dazzling-ceramic-drops) that [Kate wore recently](https://whatkatewore.com/2020/01/15/new-alexander-mcqueen-zara-mixed-with-old-favorites-for-bradford-engagements/). The shipping cost more than the earrings, but they’re super cute!"
97,2020-01-20 14:24:59,er78xg,"A pair of Veja esplar sneakers after I saw Meghan Markle wear them. No regrets, super comfy, ethically made and go with everything."
98,2020-01-20 12:06:27,er78xg,"I got this coin pendant after I saw it on Veronica Mars. I wear a lot of crew necks and loved the way it lays. Although I got the Athena version instead of Joan of Arc.

https://wornontv.net/145541/"
99,2020-01-20 07:21:22,er78xg,"I've got my eye on a black felt top hat after seeing Bill Bourne wear one while performing at a folk club a while back. I'm not sure if I've got the right kind of eccentric style to wear it as an everyday thing, but I'm sure I'll find a chance to wear it. He's got that sort of effortlessly cool old guy with a guitar vibe going on that I can't help but want to emulate even though I'm not old or a guy lol"
100,2020-01-20 09:37:57,er78xg,I bought the [Air Heart](https://lespecs.com/collections/womens-sunglasses/products/air-heart-black-gold-khaki-mono-lsp1602175) Le Specs sunglasses after seeing Meghan wear them. I love them and they suit me perfectly. I’ve gone on to buy more from Le Specs. I’m also in love with the Sentaler coat she’s worn but the cost stops me. I just need to convince myself that it’s a classic design that I’ll wear for years.
101,2020-01-20 08:00:11,er78xg,"3.1 phillip lim crushed blue velvet boots - kendall jenner

matching orange cargo set from everlane - allegra shaw (youtube)

ray ban rounds - allegra shaw (youtube)

thin gold ring specifically for my thumb - emily schuman (cupcakes and cashmere)

gucci loafers - everyone and their father

some really really sh*tty mascara that i later on realized was sponcon by one of my favorite beauty youtubers and they don’t even sell it anymore which goes to show how bad it was - estée lalonde (youtube)"
102,2020-01-20 13:39:23,er78xg,I tried very hard to purchase these [Ted Baker](https://pin.it/mw34i67vqubs3e) gloves last year after seeing them on Freddy Cousin-Brown's (UK YouTuber) channel but I couldn't find them anywhere in the US! I did end up purchasing some pink leather gloves but they aren't anywhere near as nice.
103,2020-01-20 17:38:10,er78xg,Can I ask where do you all follow what Meghan and Kate are wearing or their pictures? I love their style would love to follow their fashion
104,2020-01-20 18:42:26,er78xg,"Not sure if this counts since I never look for the actual specific items (because they’re from the 60s), just the style of items, but I adore Brigitte Bardot’s younger wardrobe and always look for items to replicate her looks (namely, anything in “And God Created Woman”). It’s so timeless and sexy without being too revealing - can’t get enough."
105,2020-01-20 21:36:37,er78xg,"I purchased Ray Ban High Street sunglasses [Meghan wore](https://www.meghansfashion.com/ray-ban-black-highstreet-51mm-round-sunglasses.html) and love them.  I wear them interchangeably with my Wayfarers.

I also purchased the Superga Cotu sneakers [Kate wears](https://www.townandcountrymag.com/style/fashion-trends/a22173401/kate-middleton-superga-cotu-sneaker-amazon-prime-day/) and they're okay.  Definitely not the most comfortable. 
 I kind of ruined them from wearing them in an unexpected downpour."
106,2020-01-20 05:58:16,er78xg,Kim Namjoon has black furry Birkenstock Arizonas...and now so do I.
107,2020-01-20 05:59:06,er78xg,Just bought a pair of Birdies flats that Meghan Markle was seen wearing. They get here in couple of days and I'm stoked to try them on!
