,Timestamp,SubmissionID,Comment
503,2020-05-02 07:14:39,gc2acl,"**Thank you for your submission. Make sure to follow the rules.**

**Check out our [FAP LOTTERY](https://jerkofftocelebs.com/) and [PORNHUB PAGE](https://jerkofftoporn.com/p/users/jerkofftocelebs)**

**Don't forget to [join our Discord Server](https://discord.gg/PrRFWsa)!**


*I am a bot, and this action was performed automatically. Please [contact the moderators of this subreddit](/message/compose/?to=/r/JerkOffToCelebs) if you have any questions or concerns.*"
504,2020-06-26 15:39:54,hg9w3a,"Make sure to follow our community guidelines.

**[Get user flair](https://redd.it/e0a4mn) and check out our [Instagram page](https://www.instagram.com/celebtag) for more celebrity content!**


*I am a bot, and this action was performed automatically. Please [contact the moderators of this subreddit](/message/compose/?to=/r/Celebhub) if you have any questions or concerns.*"
505,2020-06-26 16:04:26,hg9w3a,See Nicki Minaj's titties in one-half speed [IN THIS POST ON IMGUR](https://imgur.com/HZwYZY7)
506,2020-07-02 11:25:28,hg9u34,I‘d fuck her...
507,2020-06-27 03:07:45,hg9u34,She's not even attractive in the least.
508,2020-06-27 06:17:32,hg9u34,Trashy degenerate
509,2020-06-26 23:09:45,hg9u34,Nazty!
510,2020-06-26 17:29:40,hg9u34,I like it.
511,2020-06-26 21:13:54,hg9u34,Mesmerising
512,2020-06-26 16:04:50,hg9sup, See Nicki Minaj's titties in one-half speed [IN THIS POST ON IMGUR](https://imgur.com/HZwYZY7)
513,2020-06-26 15:35:40,hg9sup,"Yeah, I just put this together. I hope she does it for you!"
514,2020-06-26 15:51:06,hg9sup,Amazing
515,2020-06-26 15:37:39,hg9sup,God 🥵
516,2020-06-26 15:34:27,hg9l71,"The thigh pat was a little awkward, but the 'go hard, wish I could' was kind of funny. I interpreted it more as a self-deprecating joke if anything."
517,2020-06-26 15:52:09,hg9l71,"Just a heads up, the part your referencing is actually around 1:48."
518,2020-06-26 18:08:55,hg9l71,"i don’t know... maybe i’m just not sensing the perceived discomfort from her but this doesn’t seem very cringe, i’m half doubting myself saying this when comparing his age to hers - but it seemed
somewhat innocent & Nicki doesn’t seem to have an issue when it comes to declaring that she’s offended. i assume she would’ve slapped the dude tbh - on the other hand, that kind of touching with someone you’re barely acquainted with is inappropriate. not sure how i feel 😐

btw, like the other guy said - the ass tap is at 1:48"
519,2020-06-27 02:56:33,hg9l71,"All that aside, the way they banter back and forth is so weird for an interview format. They don't give her time to really answer anything and a lot of the questions require single word answers, which is poor form when interviewing."
520,2020-06-26 17:58:15,hg9l71,She IS a good actress - when he made the dirty joke and patted her ass she kept smiling.
521,2020-08-16 15:47:51,hg9l71,Little wayne
522,2020-06-29 21:44:22,hg9l71,"the clip is from 2010 (or earlier)

nicki was promoting her album and had an incentive to mask discomfort (if any). even if it were a pre-rehearsed bit, it wouldn't pass by today's standards"
523,2020-06-26 15:22:22,hg9kcq,"Your submission has been automatically removed because it links to the mobile version of the site. Please delete and resubmit from the standard version of the site (usually just requires deleting the ""m."" or ""mobile."" from the beginning of the link).

*I am a bot, and this action was performed automatically. Please [contact the moderators of this subreddit](/message/compose/?to=/r/cringe) if you have any questions or concerns.*"
524,2020-06-26 13:39:07,hg6nmq,Only feature from her four albums. That is so shocking.
525,2020-06-26 13:33:42,hg6nmq,That last one 😂😂😂
526,2020-06-26 23:21:10,hg6nmq,"Also thos moser, like everything surrounding it"
527,2020-06-26 16:26:38,hg6nmq,We Stan our QUEEN Elon
528,2020-06-26 18:08:15,hg6nmq,we don’t stan billionaires here
529,2020-06-26 18:35:40,hg6nmq,I’ll stan that freak baby when it goes turbo on grimes and musk and eliminates them.
530,2020-06-26 18:40:27,hg6nmq,I hope its first words to mommy are “class traitor”
531,2020-06-26 20:29:20,hg6nmq,sadly it’s first words might be the intro to track 10
532,2020-06-26 19:10:21,hg48zp,Try DE DEDEGDE DEDEG
533,2020-06-26 08:13:19,hg3n5n,"### [Nicki Minaj's JerkOffChallenge](https://jerkofftoporn.com/p/view_video.php?viewkey=ph5b663f57cfde2)  • [Nicki Minaj's Subreddit](https://www.reddit.com/r/Nicki_Minaj/)

^(*Thank you for your submission. Make sure to follow the rules.*) 

^(*Check out our FAP LOTTERY*) ^[*here*](https://jerkofftocelebs.com/). 

^(*Join our Discord*) ^[*here*](https://discord.gg/s4TZBR4).


*I am a bot, and this action was performed automatically. Please [contact the moderators of this subreddit](/message/compose/?to=/r/JerkOffToCelebs) if you have any questions or concerns.*"
534,2020-06-26 08:15:04,hg3n5n,[deleted]
535,2020-06-26 08:13:18,hg3n5n,"### [Iggy Azalea's JerkOffChallenge](https://jerkofftoporn.com/p/view_video.php?viewkey=ph5b663f57ae18e)  • [Iggy Azalea's Subreddit](https://www.reddit.com/r/IggyAzalea/)

^(*Thank you for your submission. Make sure to follow the rules.*) 

^(*Check out our FAP LOTTERY*) ^[*here*](https://jerkofftocelebs.com/). 

^(*Join our Discord*) ^[*here*](https://discord.gg/s4TZBR4).


*I am a bot, and this action was performed automatically. Please [contact the moderators of this subreddit](/message/compose/?to=/r/JerkOffToCelebs) if you have any questions or concerns.*"
536,2020-06-26 08:15:59,hg3n5n,I second this mans view on the matter
537,2020-06-26 08:19:14,hg3n5n,Ditto
538,2020-06-26 08:29:07,hg3ijt,Now this is unpopular. Good job op!
539,2020-06-26 08:02:19,hg3ijt,100% agree
540,2020-06-26 08:11:33,hg3ijt,She's a talentless whore who would never have made it if she didn't show her tits and ass at any given chance
541,2020-06-26 09:56:05,hg3ijt,"It's pretty weird that she can sing well, yet most of her 'popular' songs weren't *rap,* but half-yelling singing. It probably doesn't help that she puts on a lot of stupid voices mid-song too."
542,2020-06-26 08:12:39,hg3ijt,[deleted]
543,2020-06-26 08:13:07,hg3ijt,The misogyny jumped out
544,2020-06-26 08:15:45,hg3ijt,How was the [book](https://i.imgur.com/BbDDYBu.jpg)?
545,2020-06-26 08:14:12,hg3ijt,"I dont care about your vibes, she's dirt and insulting to real musicians who don't make it big because they dont sell out, let others create their music and whore themselves out for success. Sorry but i don't just disagree with you, but I personally hate Nikki minaj"
546,2020-06-26 08:15:08,hg3ijt,Its not misogynistic whatsoever. Criticising a single woman doesn't mean i hate all women.
547,2020-06-26 08:17:30,hg3ijt,Love how im somehow sexist for not liking something *one woman* does. Sorry but I have no respect for someone who performs other people's music and relies on getting near naked to be in the game
548,2020-06-26 08:32:26,hg3ijt,Ok beethoven
549,2020-06-26 08:15:22,hg3ijt,"STFU about the Queen, bro."
550,2020-06-26 08:15:03,hg3ijt,[deleted]
551,2020-06-26 16:30:58,hg3ijt,Could u name some examples of real musicians? Just interested.
552,2020-06-26 19:58:53,hg3ijt,The issue is that your criticism of this one woman is steeped in misogyny
553,2020-06-26 08:36:30,hg3ijt,chill its a joke why are you getting so worked up
554,2020-06-26 08:18:19,hg3ijt,You have a shitty taste in music and poor judgement on character if you consider this bimbo as your queen
555,2020-06-26 08:19:53,hg3ijt,Its insulting to any talented musician when they can't get reginised but some talentless bimbo gets famous simply by flashing her tits
556,2020-06-26 21:57:01,hg3ijt,"I can hundreds that you'd know of, but I'm talking about the ones who never made it big"
557,2020-06-26 21:50:07,hg3ijt,No it's not
558,2020-06-26 08:26:45,hg3ijt,"Nah Princess Diana is my queen but, you’ve had your account for 13 days and have 10 different posts in *this* sub. I think that’s a solid sign that your opinions are just doggy shit."
559,2020-06-26 22:53:15,hg3ijt,Why are you reluctant to say what musicians you like? Scared somebody will shit all over your personal preferences maybe?
560,2020-06-26 21:51:06,hg3ijt,Because clearly you’re certified to determine what is/isn’t misogynistic.
561,2020-06-26 22:54:17,hg3ijt,"No, I didn't mention them because you wouldn't know them. Are you denying that a lot of talented bands never make it? Coz if not I dont understand your point"
562,2020-06-26 22:56:44,hg3ijt,Because people like you rant about how mainstream artists suck but a lot of people wouldn't enjoy the music you listen to either
563,2020-06-26 22:57:13,hg3ijt,Didn't know I was speaking to an idiot. Cya
564,2020-06-26 05:12:00,hg1h00,"I'm confused because the title and the body don't seem to exactly line up for me.  


If I start a youtube career. And then later on there's a realistic photoshop which surfaces of me kicking a cat. And no matter how much I refute it, people insist on ""cancelling"" me.  


Then do you think I should feel personally responsible for the cancelling?"
565,2020-06-26 05:15:14,hg1h00,"Facing backlash is not the same thing as having coordinated attacks on your character (instead of facing criticism for your actions) by angry Twitter mobs who probably get a kick out of watching you fall and suffer. 

Cancel culture needs to fucking stop. It is mindless and has driven people to suicide. Criticism is okay (and welcomed, even) but not if your only goal is to see someone fall. That’s fucking juvenile and exactly why people are complaining about cancel culture. There is no actual character growth possible under cancel culture because you don’t have an opportunity to think or feel anything before you have millions  of people harassing you online. 

Just... stop."
566,2020-06-26 05:46:00,hg1h00,"What about when they get accused of something out of spite/hate by a person that knew him/her, it gets blown up in Twitter, and no matter how many times he/she proves that the crime never happens the mob stays there. A good example of this is the Spanish Youtuber DalasReview. He dumped his girlfriend and she got so mad that she convinced some of their friends in common or exes to accuse him of rape, pedophilia, and abuse over some screenshots taken out of context and half true testimonies (shouting during fights, texting with 19 year olds who sent him nudes that he didn’t ask for, kicking their dog when he misbehaved, kicking her out of the house a week after they broke up because it was his apartment legally and she never paid rent) They even sued him for all of this. For a year and a half he was the most hated person in the entirety of the YouTube Spain and Latin America community. He got his accounts regularly doxxed till the point that saying that this guy raped you became a hashtag and kind of a meme. He won every single trial. All of them. Even the JUDGE OF THE CASE said that she’s a feminist that specializes in cases of home abuse and that in her experience, the ex “didn’t look or behaved like someone that had experienced abuse”. His win was so definitive he is right now suing everyone that accused him of fraud, forgery of evidence, and conspiracy. Despite all of the previously mentioned points, he is treated like nuclear waste. No one wants to collaborate with him because his presence is toxic marketing-wise and to this day the twitter mob keeps accusing him of this crimes and spreading hate about his name. Although it is true that he commited ashole-ish behavior AT BEST. He keeps getting hate for it. Is he responsible por all that has happened to him?"
567,2020-06-26 06:27:47,hg1h00,I didn't know you could cancel a youtuber. How does this work? She surely still has fans that watch her videos and that bring her money? Aren't youtubers all independant? Why would she stop? Just cause of public pressure?
568,2020-06-26 02:38:19,hfxdnp,bro this is from 2011. Not cringe. This was considered random youtuber comedy back then.
569,2020-06-26 02:34:33,hfxdnp,[deleted]
570,2020-06-26 20:05:12,hfxdnp,It was honestly pretty cringe then too
571,2020-06-26 20:18:57,hfxdnp,"for me it was just as bad back then 

no idea how the worst youtubers get so popular"
572,2020-06-26 18:45:58,hfxdnp,"You know, I don't necessarily think it's unhealthy to bring problematic content like this up and hold those who created it accountable, but I think the level of vitriol and hatred many hold towards Jenna is very excessive considering this was almost the entire YouTube comedy scene's MO in the late 2000s/early 2010s. Her statement seemed sincere to me--and I am aware I am not the supreme arbiter of social justice or whatever, but Jesus folks at some point when are we going out of our way to demonize folks who clearly mean no harm? And I say this as someone who legitimately sees value in many aspects of cancel culture!"
573,2020-06-26 04:29:13,hfx3ls,Aww sorry about what happened but I’d love to be your friend. I don’t have that symbol in my name but I have a unique looking smiley face if that works
574,2020-06-26 07:05:11,hfx3ls,"Have you thought about joining a family? I mean the big ones out there, not goin hip to someone and asking them to be your sister. The big families have a ton of people in them and they do a lot of stuff including giveaways for their members"
575,2020-06-26 11:27:56,hfx3ls,I dont have that symbol but i love Nicki Minaj XD
576,2020-06-26 11:15:08,hfx3ls,Of course that would work!
577,2020-06-26 18:02:53,hfx3ls,My username is the same as it is on here
578,2020-06-26 11:02:14,hfx3ls,How would I find them?
579,2020-06-26 11:28:39,hfx3ls,"My username is the same as it is on here, for anyone wondering..."
580,2020-06-26 18:06:25,hfx3ls,Ok gotcha! I sent a friend request
581,2020-06-26 11:29:10,hfx3ls,"Ill search it, mine is swėėtpötåtöfrïės  :)"
582,2020-06-26 11:29:57,hfx3ls,I love food names... mmmmm... Heeheehee! That’s a lot of tiny dots!
583,2020-06-26 11:30:37,hfx3ls,I added u :) urs is easier to type xD
584,2020-06-25 16:30:29,hfowhf,I would like to take this moment to celebrate my first meaningful contribution to this sub
585,2020-06-25 16:15:23,hfowhf,fighting to get New Body released
586,2020-06-25 18:01:44,hfowhf,Sounds childish af. Why can’t she just get on the phone to Ye and ask? Unless she’s doing it to show there is a demand but surely Ye knows that? (It’s trended multiple times and is on a shit ton of Tik Tok videos)
587,2020-06-25 17:26:34,hfowhf,nahhhhh rather not have it released if kanye's not on it
588,2020-06-25 16:58:29,hfowhf,Why ferg tho?
589,2020-06-25 17:52:44,hfowhf,She really is a 40 years old acting like a teenager that shit is sickening.
590,2020-06-25 21:51:11,hfowhf,watch ye drop it but its jesusfied and nickis verse isn't there lol
591,2020-06-25 21:52:36,hfowhf,W but I dont think Kanye will ever drop it
592,2020-06-25 22:35:39,hfowhf,I listen to JIK New Body because Nicki isn’t on it
593,2020-06-25 23:17:59,hfowhf,XPLRNWBDY
594,2020-06-26 06:30:15,hfowhf,NEW WALK NEW TALK
595,2020-06-25 17:27:38,hfowhf,W
596,2020-06-25 16:24:02,hfowhf,[deleted]
597,2020-06-25 19:19:28,hfowhf,She probably called him but he only spoke in beeps
598,2020-06-25 18:44:20,hfowhf,Ye's a weird dude. He probably drops communication with people out of nowhere sometimes
599,2020-06-26 00:53:01,hfowhf,Marketing bruh. It’s all a show for hype and attention.
600,2020-06-25 18:43:18,hfowhf,better than the entire song not seeing the light of day just saying
601,2020-06-25 17:00:38,hfowhf,There’s another unreleased song with Ferg that I guess she’s tryna get released
602,2020-06-25 17:55:31,hfowhf,"i mean if i got paid millions every year because of it why not 🤷🏾‍♂️, plus it seems like that’s just how she is"
603,2020-06-25 22:42:19,hfowhf,I hate Nicki but I think her verse is the best part of New Bory
604,2020-06-25 16:27:40,hfowhf,"If they can get this done, Nicki slander is cancelled"
605,2020-06-25 19:24:31,hfowhf,> She probably called him but he only spoke in ~~beeps~~ poop di scoops
606,2020-06-25 19:28:51,hfowhf,Ye probably is still deliberating on whether to put on his album or not maybe that why he hasn’t gave Nicki an answer?
607,2020-06-25 22:05:04,hfowhf,"Imagine she called him and ye he like “you have pre marital sex, so this is Jesus punishing you through me”😭"
608,2020-06-25 23:17:30,hfowhf,"“Boop bop di boop bop”

-Terrance “Pusha T” Thornton"
609,2020-06-25 19:25:22,hfowhf,"I’m not gonna listen to it if Ye isn’t on it, so whats the point. Usually just skip it after the Nicki part comes on anyway"
610,2020-06-25 23:09:28,hfowhf,oh i thought it was saying fergs on new body
611,2020-06-25 19:23:42,hfowhf,Ehhhhh I don’t know about that
612,2020-06-25 21:36:29,hfowhf,Nah she's defended multiple pedophiles
613,2020-06-25 20:17:03,hfowhf,he wanted the christian version on jik but nicki didnt wanna redo her verse so he scrapped it for that
614,2020-06-25 20:00:04,hfowhf,But the ty dolla sign verse is fat
615,2020-06-25 23:30:47,hfowhf,Gotta read these articles 😎
616,2020-06-25 19:37:41,hfowhf,I mean it is monumental for a leak to come back after it being fully spread everywhere. She killed her verse in the leaks we heard so a finished mixed and mastered version would be awesome
617,2020-06-25 22:09:01,hfowhf,Oh fuck i forgot. Slander is uncanceled
618,2020-06-25 23:16:43,hfowhf,I mean it’s not like she’s defending the pedofillia. One could argue that it’s mature of her to assess the full human rather than write someone off due to a mistake they made
619,2020-06-25 20:27:49,hfowhf,But maybe he is trying to work out a way to get that one out? If someone wants a tune he usually lets them have it but I think he still wants to put it out. It’s something he haven’t just let go on the shelf like other unreleased Ye
620,2020-06-25 20:44:49,hfowhf,Tittyfuck verse? I’m good.
621,2020-06-25 19:56:54,hfowhf,Well I mean stopping the slander not refusing a release
622,2020-06-26 06:27:37,hfowhf,get outta here jack
623,2020-06-25 22:07:09,hfowhf,yo what yall ON nicky and tys verses are so good
624,2020-06-25 20:36:24,hfowhf,"I’m explaining why slander should be canceled, at least until further fuckery"
625,2020-06-26 07:09:08,hfowhf,Maybe I’m a glass half full guy
626,2020-06-25 15:39:15,hfnxt3,"lol this author is the saltiest. How does he feel about Drake still putting out songs with Chris brown? How could he put this much effort into dissecting the morals of a shallow, gang associated shock artist and people willing to use him for clout..."
627,2020-06-25 15:40:55,hfnxt3,This is so lame I wish I didn’t give it a click
628,2020-06-25 17:27:15,hfnvi6,all thanks to Wayne. The goat
629,2020-06-25 17:53:20,hfnvi6,Gotta make a song bragging called Triple Crown 👑
630,2020-06-25 18:56:31,hfnvi6,"What's your favourite? Mines Only, truffle butter close second"
631,2020-06-25 20:35:39,hfnvi6,Fw the username bro. Long Live Steelo
632,2020-06-25 20:37:15,hfnvi6,"No Frauds prob my fav with just them 3; 
I find it wild YM hasn’t had a mainstream hit since Bedrock. 

YM Salute is prob one of my fav Nicki melodies since she signed"
633,2020-06-25 23:22:14,hfnvi6,No Frauds is really good tbh
634,2020-06-25 15:18:58,hfmtc3,I’ll stay on my knees for you
635,2020-06-26 13:33:15,hfmnsx,Damn I bet you taste good. And so furry. I think I've just fallen in love
636,2020-06-28 20:30:27,hfmnsx,I could ride you all day
637,2020-06-25 16:41:09,hfmnce,I think your cock is beautiful
638,2020-06-25 22:04:05,hfmnce,"That's such a beautiful cock, its so lovely I might take all of it in and let you cum all over. Don't listen to any bullshit, you've got people who'll do you for being the nicest person you are. Cum in me my man!"
639,2020-06-26 16:07:26,hfmnce,Mmm it's like a sausage I wish I could suck it all long please pm me!
640,2020-06-25 15:20:14,hfmnce,Don’t ever post again this is a damn shame
641,2020-06-25 12:31:12,hfl8pg,One word. Tits.
642,2020-06-25 12:31:25,hfl8pg,She’s going through a midlife crisis
643,2020-06-25 12:31:29,hfl8pg,Nicki Minaj is a piece of shit anyway it doesn't matter what she does she ruined her carreer a long time ago
644,2020-06-25 12:33:32,hfl8pg,Super bass was actually pretty decent
645,2020-06-25 09:51:22,hfi0j2,Lol 90% of her collabs are in the Rap/RnB genre.
646,2020-06-25 07:50:46,hfi0j2,the most interesting one for me is Be Careful with Ricky Martin. sounds such a great 90s song
647,2020-06-25 09:20:18,hfi0j2,"*Hard Candy* was such a shit record.

She looked at the amazing work that Justin Timberlake, Danja and Timbaland had done on *FutureSex/LoveSounds* and just forced herself into that sound, even though it didn't really work. There are like two songs that the four of them did on that record that are any good and the tracks she did with The Neptunes was just Pharrell's usual I-can't-be-bothered-copy-and-paste shit and the Kanye West feature sticks out like a sore thumb.

That having been said, I really do like ""4 Minutes"" that's a really good tune, but it doesn't really fit the vibe of her record at all. It would have been better if it was just a standalone single. Justin Timberlake should have gotten more credit for the work he did on that track. He co-wrote the track, co-produced it and did a lot of the vocal production on it too."
648,2020-06-25 10:38:34,hfi0j2,yes ng in the 90s
649,2020-06-25 09:36:00,hfi0j2,"I kind of agree with you. after the confessions success she should have settled down and looked for what was good for her. instead, she wanted to get some bite from justin's success, which was ok. During hard candy era, i did enjoy those tracks you mentioned; yet, they just did not age well. now in 2020 they sound just ""wannabe""."
650,2020-06-25 09:52:28,hfi0j2,"I found that, while it didn’t sound like a Madonna record, it was still fresh and high-quality songwriting/production. Most of the songs still sound good today. DWRY is one of her all-time best songs."
651,2020-06-25 06:21:13,hfgmlp,I’m a redditor so fat people bad 😤
652,2020-06-25 07:00:24,hfgmlp,delete it fat
653,2020-08-05 17:19:31,hfgmlp,"wait, demi gained another 10 lbs. again?"
654,2020-06-25 08:03:28,hfgmlp,"Hi, your post was removed for the following reason(s):

* Please refrain from making topics that can be perceived as fatphobic"
655,2020-06-25 03:47:32,hffh95,I bet she fucks like a virgin
656,2020-06-25 12:35:00,hffh95,Would def smash
657,2020-06-25 09:39:46,hffh95,Are they fake or real?
658,2020-06-25 08:58:25,hffh95,She's corny and full of fix a flat. Hard pass.
659,2020-06-25 04:34:45,hffh95,Her skin is white...Does she bleach?
660,2020-06-25 12:58:21,hffh95,"The state of the black female in 2020, it looks nice but where are we heading is it getting better or is it getting worse just a thought"
661,2020-06-25 11:43:03,hffh95,"Fake, but damn good surgeon. Some pornstars need to go to her surgeon if they wanna get these changes. The whole“bolt-on” tits and “stiff” asses post surgery is pretty... not bad just to obvious."
662,2020-06-25 11:12:33,hffh95,Kinda obvious you think?
663,2020-06-25 11:04:53,hffh95,"fake yes. real also yes, as not imaginary. i believe you wanna know if they are natural?"
664,2020-06-25 13:20:55,hffh95,State of the black female??? Are black women the only ones who show their titties now?
665,2020-06-30 14:26:53,hins68,5/10
666,2020-06-30 14:16:43,hins68,?
667,2020-07-02 17:13:03,hins68,4/10 they dont go together at all
668,2020-06-30 19:22:13,hins68,Bro put the worst Uzi leak into it
669,2020-06-30 15:44:06,hins68,[deleted]
670,2020-06-30 14:27:15,hins68,Damn :(
671,2020-07-02 18:56:26,hins68,Bruh
672,2020-06-30 19:25:46,hins68,Which one
673,2020-06-30 15:45:12,hins68,Bruh most of those aren't even leaked
674,2020-06-30 14:28:54,hins68,Its only an opinion... I only like shrooms and 1600 from your list
675,2020-06-30 14:31:07,hins68,I respect u for being UNIQUE
676,2020-06-30 19:33:21,hins68,Sanctuary
677,2020-06-30 14:31:18,hins68,lmao
678,2020-06-30 19:34:12,hins68,"Bruh Uzi goes hard on that one, and it sounds real dark compared to most his other stuff"
679,2020-06-30 19:34:47,hins68,It’s literally so unfinished
680,2020-06-30 19:35:22,hins68,Yeah so?
681,2020-06-30 21:25:38,hile7e,If you're into Nicki Minaj in pasties you should check out her newest music video. Half of it is literally just her shaking her tits in pasties.
682,2020-06-30 10:08:19,hikggj,queen always breaking records
683,2020-06-30 10:50:44,hikggj,Couldn't have happened to more deserving artists
684,2020-06-30 11:10:15,hikggj,[removed]
685,2020-06-30 10:12:14,hikggj,itswhatshedeserves.jpg
686,2020-06-30 10:43:09,hikggj,We anticipated (the fall) and they delivered (a great plummeting)
